objectID,userID,objectType,classification,completeness,quantity,broadperiod,periodo,rightCorner,collection,museumID,collectionIdentifier,museumCollection,site,stolenStatus,hoard,discoveryContext,parish,district,country,county,toSearch,fourFigureLat,fourFigureLon,gridRef,dateDiscoveryDay,dateDiscoveryMonth,dateDiscoveryYear,length,width,edge,weight,patina,surface,thickness,other,composition,associations,description,publications,remarks,inputBy,thumbnail,imageURL,flickrURL,Processing,project
BAI-11045,543,PALSTAVE/CHISEL,,,NA,Bronze Age,p0gjgrs6qb2,"A3,A3","Society of Antiquities Collection, B.18,presented 1860 by Sudlow Roots, esq. from the collection of his father William Roots - no.6",B.18,,Society of Antiquaries,"England,Greater London,River Thames,Kingston",,,river,,,England,Greater London,,NA,NA,,NA,NA,NA,120.7,butt 19,31.5,,dark chocolate brown;  v. little speckling to darker colour; some yellow to orange staining,attached material: v. small spots of concretion,"max. B. fg. 19.5,max. T sep. 3.7,min. B. st. 14.5","Top left corner (in box labelled NGR) says “c. TQ 17” and on the next line, “ 68” (aligned under the “17”). Is this a grid ref?  Bottom right of card: Rec. “SN Feb’79”; DF “c”; Source “MV”; old cards “1” and ticks in boxes labelled PIF, AFI, SI & CI",,7b Group,"Typology"" butt notch prob. orig. feature;arched shoulder on one side of bl/fg. =  just hump on other side; stops dip from flanges - asym. & irreg.; flattened Fg. bases provide beginning of""v"" enclosed depression on one face - virt. none on rev.; fairly crisp sep. angles, thin rounded/flattened fg. crests; fgs. skew to body,Manufacture: cg. fls. remain as cracks - one v. off central; Deliberately dimpled bl. tips; some prob. hmks. on sides; moulding irregularities in one sep. - prob. cg.flaw; v. sl. flattening of top of fgs. - tending to tipping; hollow ground e. bev. with suggestion of lesser bevel above,Condition: sl. bent & twisted along line of body - pres. dam.; edge intact & sharp","a) P.S.A.1 I, 1843-9, 21,Arch XXX, 1844, 491,c)P.S.A.2 I, 1859-61, 83 no. 6",Labels/Markings: white ink inscr: 'B18'; loose hand-printed label;loose tag label - roots orig.,Jane Fellows,https://farm6.staticflickr.com/5584/14884716228_6ce893a397_q.jpg,https://farm6.staticflickr.com/5584/14884716228_6ce893a397_b.jpg,https://www.flickr.com/photos/MicroPasts/14884716228,most detailed record,flangedchiselsA1
BAI-12190,64,BOSS ,"Convex,Loop for attachment",,NA,Bronze Age,p0gjgrs6qb2,24,"British Museum. 66.2.24.11,given by A.W. Franks. 1866",1866.2.24.11,,British Museum,"GREATER LONDON,Kensington",,,,Kensington,Kensington and Chelsea,England,Greater London,"Kensington, London Sw7, UK",51.4926356,-0.1775038,,NA,NA,NA,,40 x 42,,14.62,green,,7,,,Founder's Hoard,Little hole in centre,,Inacc,Hugh Fiske,https://farm6.staticflickr.com/5594/14961393149_6a53e6999e_q.jpg,https://farm6.staticflickr.com/5594/14961393149_6a53e6999e_b.jpg,https://www.flickr.com/photos/MicroPasts/14961393149,superuser,DrawerA16
BAI-63691,433,Hammer Flanged Flat Celt,Flanged,,NA,Bronze Age,p0gjgrs6qb2,d,"Museum of Archaeology + Ethnology, Cambridge,No. 94 Murray Collection",94 Murray Collection,,MAA Cambridge,"Ireland,Co. Westmeath,Kinnegad",,,,Kinnegad,,Ireland,County Westmeath,"Kinnegad, Co. Westmeath, Ireland",53.4594378,-7.10679402395831,,NA,NA,NA,114,butt 24.5,60,264,Brown patina + green metal showing through on one side.,Smooth,14,,,,Slight flanges + stop ridge. Ornamented between the stop + bevel with 7 rows of incised chevrons. Sides ornamented with fluted rope pattern. Tapering butt + very much rounded + expanded cutting edge.,,,Joellen McGann,https://farm8.staticflickr.com/7556/28162098132_8e3cac4606_q.jpg,https://farm8.staticflickr.com/7556/28162098132_8e3cac4606_b.jpg,https://www.flickr.com/photos/115096994@N02/28162098132,superuser,IrishAxesB5
BAI-11790,433,Short Haft-Flanged Celt,,,NA,Bronze Age,p0gjgrs6qb2,,Wakefield Museum,,,Wakefield Museum,"England,Yorkshire,Lakelock,Wakefield ( 2 3/4 m. NW of),1869",,,,Lakelock,,England,West Yorkshire,"Wakefield, West Yorkshire, UK",53.6829541,-1.4967286,,NA,NA,1869,,,,225,"Green and brown patina, mostly brown. Rust colour between flanges on one face and traces of the same colour on the other.",Fairly smooth; one edge pitted.,,,,,"Blade with straight, parallel edges widening out sharply as they near the cutting edges; cutting edge fairly sharp and crescentic in form. high flanges, very thin and lozenge-shaped.  Rudimentary stop ridge; butt end missing.",,,Joellen McGann,https://farm4.staticflickr.com/3882/14793690689_f7d5329b48_q.jpg,https://farm4.staticflickr.com/3882/14793690689_f7d5329b48_b.jpg,https://www.flickr.com/photos/MicroPasts/14793690689,only good record,flangedAxesA1
BAI-15074,433,Knobbed Sickle,,,NA,Bronze Age,p0gjgrs6qb2,,"Ipswich Museum, 1934.76.8",1934.76.8,,Ipswich Museum,"England,Suffolk,Lakenheath",,,,Lakenheath,,England,Suffolk,"Lakenheath, Suffolk, UK",52.4175635,0.5180418,,NA,NA,NA,,,,,,,,,,,,,MJR,Joellen McGann,https://farm4.staticflickr.com/3909/15199422372_22264fc8a0_q.jpg,https://farm4.staticflickr.com/3909/15199422372_22264fc8a0_b.jpg,https://www.flickr.com/photos/MicroPasts/15199422372,superuser,A8tools
BAI-5786,433,Palstave Blade,,,NA,Bronze Age,p0gjgrs6qb2,I-P,"Museum of Archaeology and Ethnology, Cambridge,Annual Records 1908. 115A (the numbers do not always correspond),Pres. by Cambridge Antiquarian Society",115A,,MAA Cambridge,"England, suffolk,lakenheath,1908",,,,Lakenheath,,England,Suffolk,"Lakenheath, Suffolk, UK",52.4175635,0.5180418,,NA,NA,1908,59,24,49,162,Bright green - some metal showing through.,Smooth and even.,21,Width: edge 49mm; where broken 24mm,,,Ornamented with 4 flutings. There are 2 little pockets (on the sides) above each point of blade.,,,Joellen McGann,https://farm8.staticflickr.com/7397/12674938414_2ab4ec87be_q.jpg,https://farm8.staticflickr.com/7397/12674938414_2ab4ec87be_b.jpg,http://www.flickr.com/photos/MicroPasts/12674938414,superuser,drawA9
BAI-11617,433,Low-Flanged Axe Chisel,,,NA,Bronze Age,p0gjgrs6qb2,,"Jewell, R.H.I. - private (1993), 62 Ivydale Rd. London, SE15 3BS,?ex Holleyman Collection,ex Ball Collection",,,Private Collection,"England,Suffolk,Lakenheath",,,,Lakenheath,,England,Suffolk,"Lakenheath, Suffolk, UK",52.4175635,0.5180418,,NA,NA,NA,99,13,27,64,,Greeny-brown patina with substantial areas of bumpy corrosion.,7,,,,"Dimensions: L 98.5mm; We 27.3mm; Wst 16mm; Wbt 12.5mm; max T 7.3mm; max H fg. 0.3mm; Deb 10mm; Teb 4.5; Wt 63.8 gms,Typology: appears to be just one small lozenge facet on either side, otherwise double-faceted; rounded stop bevel; minimal flanges,Manufacture: slight skew down length of body,Condition: edge sharp but very jagged",,"Circ. adhesive label ""BALL COLLECTION"" printed ; long adhesive label: ""LAKENHEATH""; handwritten black ink: ""836"",Archive PIF X PTO,Rec: SN Nov. 93,Source Sb. A",Joellen McGann,https://farm6.staticflickr.com/5589/14793845177_b07c1b15fa_q.jpg,https://farm6.staticflickr.com/5589/14793845177_b07c1b15fa_b.jpg,https://www.flickr.com/photos/MicroPasts/14793845177,superuser,flangedAxesA1
BAI-62244,433,Band,,,NA,Bronze Age,p0gjgrs6qb2,,"National Museum of Science and Art, Dublin,No. 51, Pl. X,Wilde's Cat. 82",W82,,"National Museum of Science & Art, Dublin","Ireland,Co. Dublin,Lambay Island",,,,Lambay Island,,Ireland,County Dublin,"Lambay Island, Lambay Island, Co. Dublin, Ireland",51.4698873,-0.2685226,,NA,NA,NA,,,,7.75,,,,,Gold,Stated to have been found with a sword (according to Wilde the circumstances are not very clear),,,,Joellen McGann,https://farm8.staticflickr.com/7410/27075982835_72990383d8_q.jpg,https://farm8.staticflickr.com/7410/27075982835_72990383d8_b.jpg,https://www.flickr.com/photos/115096994@N02/27075982835,superuser,DubiousBA
BAI-63816,580,Band,,,NA,Bronze Age,p0gjgrs6qb2,,"National Museum of Science & Art, Dublin, No 59 Pl X. Wilde's Cat. 279.",Wilde 279,,"National Museum of Science & Art, Dublin","Ireland, Co Kildare, near Castledemot, Saint-johns, 1858.",,,,,,Ireland,County Kildare,"Saintjohns, Co. Kildare, Ireland",52.9243257,-6.8241388,,NA,NA,1858,,,,15.86,,,,,gold,"found with No 58 Pl. X (Grooved Band), No 105 Pl. XIII (Torque-armlet), No 110 Pl. XIII (Torque Armlet), No 376 Pl. XVIII (Penannular Ring)",,"Proc. Royal Irish Academy vii, p 132.",,Denis Antoine,https://farm9.staticflickr.com/8660/28231701406_96c1d9d202_q.jpg,https://farm9.staticflickr.com/8660/28231701406_96c1d9d202_b.jpg,https://www.flickr.com/photos/115096994@N02/28231701406,only good record,IrishAxesB5
BAI-63815,580,Band,,,NA,Bronze Age,p0gjgrs6qb2,,"National Museum of Science & Art, Dublin, No. 58, Pl. X. Purchased from Mr. Donegan. Wilde's cat. 273.",Wilde273,,"National Museum of Science & Art, Dublin","Ireland, Co Kildare, near Castledermot, Saint-Johns, 1858.",,,,,,Ireland,County Kildare,"Saintjohns, Co. Kildare, Ireland",52.9243257,-6.8241388,,NA,NA,1858,,,,18.28,,,,,gold,"found with No. 59 Pl. X (Grooved band), No. 105 Pl. XIII (Torque-armlet), No. 110 Pl. XIII (Torque armlet), No. 376 Pl. XVIII (Penannular Ring)",,Proc. Royal Irish Academy vii p. 132.,,Denis Antoine,https://farm9.staticflickr.com/8758/27650313774_9cc899e4ca_q.jpg,https://farm9.staticflickr.com/8758/27650313774_9cc899e4ca_b.jpg,https://www.flickr.com/photos/115096994@N02/27650313774,only good record,IrishAxesB5
BAI-51436,433,Bar Ingot,,,NA,Bronze Age,p0gjgrs6qb2,2,"Society of Antiquaries,Burlington House W.,Pres. by Rev. Malachy Hitchins, 1802",B.8 (ii),,Society of Antiquaries,"England,Cornwall,Lanant Parish,1802",,,,Lanant Parish,,England,Cornwall,"Lelant, Saint Ives, Cornwall Tr26, UK",50.183848,-5.440407,,NA,NA,1802,255.5,"varying 6.5, 11, 10",,92.13,No patina.,"Smooth, dark golden bronze colour + a few black stains.",2.75 to 4.25,,,Part of a Bronze Founder's Hoard which included Bars of Gold.,Probably only a strip of hammered bronze.,"Arch XV, 118",,Joellen McGann,https://farm2.staticflickr.com/1588/24225381410_b75fc0d567_q.jpg,https://farm2.staticflickr.com/1588/24225381410_b75fc0d567_b.jpg,https://www.flickr.com/photos/115096994@N02/24225381410,superuser,BitsandBobsPt1
BAI-15358,433,Flat axe mould,,,NA,Bronze Age,p0gjgrs6qb2,,"British Museum, W.G. 2267",WG.2267,H_WG-2267,British Museum,"England,Durham,Lanchester,Hurbuck",,,,Lanchester,,England,County Durham,"Hurbuck Farmhouse, Lanchester, Durham, County Durham Dh7 0rt, UK",54.829654,-1.783684,,NA,NA,NA,,,,,,,,,,,,,,Joellen McGann,https://farm4.staticflickr.com/3942/14980277603_eaa3733008_q.jpg,https://farm4.staticflickr.com/3942/14980277603_eaa3733008_b.jpg,https://www.flickr.com/photos/MicroPasts/14980277603,superuser,miscellaneous
BAI-27563,433,Rapier Stone Mould,,Fragment,NA,Bronze Age,p0gjgrs6qb2,,Truro Museum,,,Truro Museum,"England,Cornwall,Lanlivery,Bodwen",,,,Lanlivery,,England,Cornwall,"Bodwen, Saint Austell, Cornwall Pl26, UK",50.4126819,-4.7710183,SX 069 610,NA,NA,NA,253,,,,,,,,,7a. Area Find,,,AFI; SI; CI; SN July 79; R,Joellen McGann,https://farm9.staticflickr.com/8588/15912565596_82ab33e80a_q.jpg,https://farm9.staticflickr.com/8588/15912565596_82ab33e80a_b.jpg,https://www.flickr.com/photos/MicroPasts/15912565596,superuser,ornamentsA15
BAI-27562,433,Stone Mould,,Fragment,NA,Bronze Age,p0gjgrs6qb2,,Truro Museum,,,Truro Museum,"England,Cornwall,Lanlivery,Bodwen",,,,Lanlivery,,England,Cornwall,"Bodwen, Saint Austell, Cornwall Pl26, UK",50.4126819,-4.7710183,SX 069 610,NA,NA,NA,56,,,,,,,,,7a. Area Find,,,AFI; SI; CI; SN July 79; R.,Joellen McGann,https://farm8.staticflickr.com/7554/15936402221_e468a960a8_q.jpg,https://farm8.staticflickr.com/7554/15936402221_e468a960a8_b.jpg,https://www.flickr.com/photos/MicroPasts/15936402221,superuser,ornamentsA15
BAI-27217,433,Stone Mould,,,NA,Bronze Age,p0gjgrs6qb2,,"Cardiff, National Museum of Wales,79.26 H",79.26 H,,National Museum of Wales,"Wales,Powys,Manafon,New Mills,Found winter 1978/9 by AE Price, Hafran Junior School, Park Lane, Newtown, Powys, on the surface of the valley floor immediately below the steep slop of the valley side, while field walking (DF)",,,,,,Wales,,"Manafon, Welshpool, Powys Sy21, UK",NA,NA,SJ 0913 0128,NA,NA,1978,172,60,,2126,,,,,"Res. Lab XRF determination (on Matrices 1 & 3) did not detect any significant parts for Cu, Sn, As, Pb; The stone would appear to have significant quantities of Fe, Po, Ca, Ti, Si",8a. Single Find,"Dimensions: of block per illustration; face kept parallel and perpendicular to plane of drawing in each view; faces 1 & 3 approx. parallel in cross section, converging a little in long section; Wt. 2125.7 g,Matrix 1: internal L 162mm; ext. L 171.5; int. W 52; ext. W 59.5; max. D matrix (intact matrix sur.) 6.2; max D. end 3.8; most of matrix surface smooth, intact, & very gently concave; side walls mainly near & flat standing at 70*; v. slight furrows down length probably tooling marks; patch of surface chipped away - roughened surface, but similar blue-grey colour to rest of matrix; most of surrounding face generally flat with slight modulations - probably intact; lower left corner reduced by damage; depth at wide end fairly consistent, even to tip.,Matrix 2: L 193.5 or 160; max W 49 or ?; max D 3.5; surface of matrix rough pocked, sides ill-defined - one virt. straight, other with central [?sevelling]; broad edge very diffuse - two poss. lines of matrix defined by bevels and pittings (shorter length); narrower end virt. pointed; surrounding face undulates - some almost level with matrix surface; colour similar to black;,Matrix 3: int. L 131.5mm; external L 135.5; int. max. W. 54.5; max D side wall (one side) 8.2; max D. other side wall 3.5; max D broad end 5.5; most of matrix smooth and very gently concave, more-or-less flat across broad end, but actual edge angle rises slightly in centre; angle of one side wall very straight - slight ridge inside - other wall very concave line, slightly bowed in section and at angle of c. 70*; top end - no distinct bevel line - but no end of dam.; 2 or 3 small patches chipped to rough texture - sim. blue-grey col. to rest of matrix; much of surrounding face flat with slight undulation -largely undam. prob.; depression reducing lower left side wall poss. dam. - but not fresher sur.; also facet across lower right tip prob. dam. - irregular surface but not fresher.,Face 4: comparatively irregular; tendency for three furrows on lower parts.,Block: pale bluey/greeny grey surface, patches of rusty brown staining?; odd chips at corners with maroon brown surface - prob. more recent; groove across top end and across right side face of face 3 - both look ancient and probably incidental; bottom end slightly hollowed - not smooth, pocked; top end flat; patch of blackening on angle between faces 2 & 3, some moss adhering plus green staining in parts,Medium Grained Sandstone",,PIF; DF(S); SI; CI; SN April 79; Source: Sb. A.,Joellen McGann,https://farm9.staticflickr.com/8658/15316193824_1d8513e45b_q.jpg,https://farm9.staticflickr.com/8658/15316193824_1d8513e45b_b.jpg,https://www.flickr.com/photos/MicroPasts/15316193824,superuser,ornamentsA15
BAI-31360,226,Mount,"Ring mount, PERFORATED RING",,NA,Bronze Age,p0gjgrs6qb2,red dot,"Museum of Archaeology & Ethnology, Cambridge, No. 249 Murray Colln.",249 Murray Collection,,MAA Cambridge,"Ireland, Queens Co., Laois, Maryborough Portlaoise, 1872",,,,Laois,,Ireland,County Laois,"Portlaoise, Co. Laois, Ireland",53.0368853,-7.3013754,,NA,NA,1872,47,45.5,,30,dusty green & brown,dull & even,8,,,"One of a hoard consisting of 59: 54 rings, bracelet, pin, gouge & 2 amber necklaces","Ring with transverse long oval perforations., (NB also another ring with similar wider perforations) Diameter 42 weight 16",,,Elaine Dale,https://farm9.staticflickr.com/8659/16474458158_dc0d037fdb_q.jpg,https://farm9.staticflickr.com/8659/16474458158_dc0d037fdb_b.jpg,https://www.flickr.com/photos/MicroPasts/16474458158,superuser,irishB10
BAI-27464,433,Mount,Ring-Mount 2 Slots for Attachment,,NA,Bronze Age,p0gjgrs6qb2,,"The Priory, Prittlewell (Southend on Sea),276/98",276/98,,"The Priory, Prittlewell","England,Essex,Leigh,Flemming Avenue,Prittle Brook,29.1.26,(Found by workmen)",,,,Leigh-on-sea,,England,Essex,"Flemming Avenue, Southend-on-sea, Leigh-on-sea, Southend-on-sea Ss9, UK",51.5487215,0.6492116,,29,1,1926,,20,,17.71,"No patina, greeny bronze colour.",Heavily encrusted.,7.5,Width: 20mm x 23mm,,A bronze founder's hoard.,"This is shaped like a ring, is hollow and has two slots. The hole in centre is filled with encrustment.",,,Joellen McGann,https://farm8.staticflickr.com/7512/15752308669_85e526b5cd_q.jpg,https://farm8.staticflickr.com/7512/15752308669_85e526b5cd_b.jpg,https://www.flickr.com/photos/MicroPasts/15752308669,superuser,ornamentsA15
BAI-27596,433,Mount,Ring Mount 4 Slots for Attachment,,NA,Bronze Age,p0gjgrs6qb2,No C,"Museum of Archaeology and Ethnology, Cambridge,Purchased by the Cambridge Antiquarian Society, April 1919,1919.6",1919.6,,MAA Cambridge,"England,Cambridgeshire,Wilburton,In fen-land owned by Mr. Oliver Claude Pell,1882",,,,Wilburton,,England,Cambridgeshire,"Wilburton, Cambridgeshire, UK",52.3531661,0.1777163,,NA,NA,1882,34,,,14,Dull dusty brown patina.,"Unbroken, but signs of fusing",10,,,The Wilburton Hoard,,"Archaeologia, XLVIII, 106,New Cambridge, 17 May 1919",,Joellen McGann,https://farm8.staticflickr.com/7473/15912572286_e35788b822_q.jpg,https://farm8.staticflickr.com/7473/15912572286_e35788b822_b.jpg,https://www.flickr.com/photos/MicroPasts/15912572286,superuser,ornamentsA15
BAI-27595,433,Mount,Ring Mount 4 Slots for Attachment,,NA,Bronze Age,p0gjgrs6qb2,C,"Museum of Archaeology and Ethnology, Cambridge,Purchased by the Cambridge Antiquarian Society, April 1919,1919.6",1919.6,,MAA Cambridge,"England,Cambridgeshire,Wilburton,In fen-land belonging to Mr. Oliver Claude Pell.,1882",,,,Wilburton,,England,Cambridgeshire,"Wilburton, Cambridgeshire, UK",52.3531661,0.1777163,,NA,NA,1882,33,,,10,Dull black patina with a green tinge.,Broken and brittle.,10,,,The Wilburton Hoard,"""Hollow ring of nearly circular section, but slightly flattened on one face. Through the periphery are three broad openings almost touching each other so that the supports from one face of the ring to the other are at three of the corners of a square. The fourth side of the square is a smaller opening."" (Archaeologia).","Archaeologia, XLVIII, 106,New Cambridge, 17 May 1919",,Joellen McGann,https://farm9.staticflickr.com/8588/15752329329_208f034176_q.jpg,https://farm9.staticflickr.com/8588/15752329329_208f034176_b.jpg,https://www.flickr.com/photos/MicroPasts/15752329329,superuser,ornamentsA15
BAI-27593,433,Mount,Ring Mount 2 Loops for Attachment,,NA,Bronze Age,p0gjgrs6qb2,C,"Museum of Archaeology and Ethnology, Cambridge,Purchased by the Cambridge Antiquarian Society, April 1919,1919.6",1919.6,,MAA Cambridge,"England,Cambridgeshire,Wilburton,In fen-land belonging to Mr. Oliver Claude Pell,1882",,,,Wilburton,,England,Cambridgeshire,"Wilburton, Cambridgeshire, UK",52.3531661,0.1777163,,NA,NA,1882,44,43,,10,Dull black patina and rusty brown.,,,Width: 43mm; 8mm,,The Wilburton Hoard,"""Annular button, with two loops at the back"" (Archaeologia)","Archaeologia, XLVIII, 106,New Cambridge, 17 May 1919",,Joellen McGann,https://farm8.staticflickr.com/7503/15751086620_f9293952c8_q.jpg,https://farm8.staticflickr.com/7503/15751086620_f9293952c8_b.jpg,https://www.flickr.com/photos/MicroPasts/15751086620,superuser,ornamentsA15
BAI-27592,433,Mount,Ring Mount 2 Loops for Attachment,,NA,Bronze Age,p0gjgrs6qb2,C,"Museum of Archaeology and Ethnology, Cambridge,Purchased by the Cambridge Antiquarian Society, April 1919,1919.b",1919.6,,MAA Cambridge,"England,Cambridgeshire,Wilburton,In fen-land belonging to Mr. Oliver Claude Pell.,1882",,,,Wilburton,,England,Cambridgeshire,"Wilburton, Cambridgeshire, UK",52.3531661,0.1777163,,NA,NA,1882,45,32,,8,,Rough and dust colour.,,,,The Wilburton Hoard,Fragment of Annual Button on one loop remaining.,"Archaeologia, XLVIII, 106,New Cambridge, 17 May 1919",,Joellen McGann,https://farm9.staticflickr.com/8616/15938367395_42a8737b43_q.jpg,https://farm9.staticflickr.com/8616/15938367395_42a8737b43_b.jpg,https://www.flickr.com/photos/MicroPasts/15938367395,superuser,ornamentsA15
BAI-61529,580,Strap end,,Fragment,NA,Bronze Age,p0gjgrs6qb2,,"The Priory, Prittlewell (Southen on Sea) 276/128.",276/128,,"The Priory, Prittlewell","England,Essex,Leigh,Fleming Avenue,Prittle Brook,29. 1. 26. (found by workmen)",,,,Leigh,,England,Essex,"Leigh-on-sea, Southend-on-sea, Southend-on-sea, United Kingdom",51.5416283,0.645510378203594,,29,1,1926,50,39; 45.5,,28.35,"no patina, golden & dark bronze",blue & green encrusted. Heavily encrusted on the under side.,of metal about 1.5,,,A bronze founder's hoard.,Cracked & repaired.,,,Denis Antoine,https://farm2.staticflickr.com/1511/25956850594_767a9d4e29_q.jpg,https://farm2.staticflickr.com/1511/25956850594_767a9d4e29_b.jpg,https://www.flickr.com/photos/115096994@N02/25956850594,superuser,BitandBobsA15
BAI-61661,433,Strap End,Broad perforated,,NA,Bronze Age,p0gjgrs6qb2,"Section view of ends,C","Museum of Archaeology + Ethnology, Cambridge,Purchased by the Cambridge Antiquarian Society, April 1919,1919.b",1919.6,,MAA Cambridge,"England,Cambridgeshire,Wilburton,In fen-land belonging to Mr. Oliver Claude Pell,1882",,,,Wilburton,,England,Cambridgeshire,"Wilburton, Ely, Cambridgeshire Cb6, UK",52.3531661,0.1777163,,NA,NA,1882,73,10,,15,,Rough dull and dust colour.,,,,The Wilburton Hoard,"Described and illustrated in the 'Archaeologia' Object looks like the mounting for the end of a broad strap of thick leather, but with openings to allow of thin strips in continuation of main strap to come through. Like a piece of tube closed at the ends, but with longitudinal opening 5/6mm wide all along it on one side and 3 small openings 4mm x 9mm arranged at equal distances along the opposite side.","Archaeologia, XLVIII, 106,New Cambridge 17 May 1919",,Joellen McGann,https://farm2.staticflickr.com/1608/26495753071_b27f12da3f_q.jpg,https://farm2.staticflickr.com/1608/26495753071_b27f12da3f_b.jpg,https://www.flickr.com/photos/115096994@N02/26495753071,superuser,BitandBobsA15
BAI-19972,64,Socket celt,,Fragment,1,Bronze Age,p0gjgrs6qb2,Frag,"The Priory, Prittlewell (Southend on Sea),276/117",276/117,,"The Priory, Prittlewell","England,Essex,Leigh,Fleming Avenue,Prittle Brook,29.1.26 (found by workmen)",,,,Leigh-on-sea,,England,Essex,"Leigh-on-sea, Southend-on-sea, UK",51.5416283,0.645510378203594,,29,1,1926,39,29,,19.47,,"smooth, some earth encrusted on the under side","3.5,2.5 (about)",,,A bronze founder's hoard,,,,Hugh Fiske,https://farm4.staticflickr.com/3933/15413725947_a31c5729f7_q.jpg,https://farm4.staticflickr.com/3933/15413725947_a31c5729f7_b.jpg,https://www.flickr.com/photos/MicroPasts/15413725947,superuser,drawerA5A6
BAI-21235,782,Socket celt,,,NA,Bronze Age,p0gjgrs6qb2,UII2,"Museum of Archaeology Cambridge,  Presented by Professor Henslow 1849",,,MAA Cambridge,"England, Suffolk, Stowmarket, (in the bag)",,,fenland,Stowmarket,,England,Suffolk,"Stowmarket, Stowmarket, Suffolk Ip14, UK",52.1900292,0.9995893,,NA,NA,NA,106,42,47,264,All shades of green and brown,Smooth and rather dull,30,,,,Mouth broken at one side,"Prehistoric Bronzes 82 Catalogue lost.,  Bronzes 31 Numbers 15  be found in catalogue called museum of Archaeolgy,  Cambridge antiquarian Society catalogue 134 May 1884",,Martyn Franklin,https://farm4.staticflickr.com/3941/15414123818_1f28146505_q.jpg,https://farm4.staticflickr.com/3941/15414123818_1f28146505_b.jpg,https://www.flickr.com/photos/MicroPasts/15414123818,most detailed record,drawerA5A6
BAI-4751,433,Socket Celt,,,NA,Bronze Age,p0gjgrs6qb2,,"Lukis Museum, Guernsey",,,Lukis Museum,France,,,,,,France,,France,46.603354,1.8883335,,NA,NA,NA,68,18,28,84,"socket is a light greyish green, rubbed off in several places, showing dark brown metal.",,25,"Site: unspecified location in France - geolocation not accurate to 10 kms,  Width; edge 28; socket 18,  Thickness: socket 25,  Weight: 84.15 gms",,,Edge is unsharpened and the rim of the socket is very imperfect. There is some mud inside the socket and also near the loop.,,,Joellen McGann,https://farm4.staticflickr.com/3727/13306461925_3600dc155e_q.jpg,https://farm4.staticflickr.com/3727/13306461925_3600dc155e_b.jpg,http://www.flickr.com/photos/MicroPasts/13306461925,superuser,drawB8
BAI-4680,433,Socket Celt,,,NA,Bronze Age,p0gjgrs6qb2,,"Farnham Museum, Dorset",,,Farnham Museum,"Austria or italy, tyrol",,,,,,Austria,,Tirol,47.223193,11.5261028,,NA,NA,NA,138,50,45,425,,smooth dark bronze,32,"Site: unspecified location from Tyrol (Austria or Italy) - geolocation not accurate to 10 kms,  Width: edge 45; socket 50,  Thickness: socket 32,  Weight: 425.25 gms",,,edge slightly indented,,,Joellen McGann,https://farm4.staticflickr.com/3690/13306636663_d78d43e408_q.jpg,https://farm4.staticflickr.com/3690/13306636663_d78d43e408_b.jpg,http://www.flickr.com/photos/MicroPasts/13306636663,superuser,drawB8
BAI-4684,433,Socket Celt,,,NA,Bronze Age,p0gjgrs6qb2,,"Pitt Rivers Museum, Oxford, J.W. Flower",,,Pitt Rivers Museum,Austria,,,,,,Austria,,Austria,47.59397,14.12456,,NA,NA,NA,88,44,40,,,"smooth, fairly good casting",27,"Site: unspecified location in Austria - geolocation not accurate to 10 kms,  Width: edge 40; socket 44,  Thickness: socket 27,",,,"Not much worn, except for hole near loop",,,Joellen McGann,https://farm8.staticflickr.com/7141/13306481585_a5c8aaff08_q.jpg,https://farm8.staticflickr.com/7141/13306481585_a5c8aaff08_b.jpg,http://www.flickr.com/photos/MicroPasts/13306481585,superuser,drawB8
