objectID,userID,objectType,classification,completeness,quantity,broadperiod,periodo,rightCorner,collection,museumID,collectionIdentifier,museumCollection,site,stolenStatus,hoard,discoveryContext,parish,district,country,county,toSearch,fourFigureLat,fourFigureLon,gridRef,dateDiscoveryDay,dateDiscoveryMonth,dateDiscoveryYear,length,width,edge,weight,patina,surface,thickness,other,composition,associations,description,publications,remarks,inputBy,thumbnail,imageURL,flickrURL,Processing,project
BAI-40857,433,Point,Tanged,,NA,Bronze Age,p0gjgrs6qb2,,"Geological Museum, Lisbon,No. 203",203,,"Geological Museum, Lisbon","Portugal,Estremadeira Transtagana,Palmella,2nd Grotto (Furna)",,,,,,Portugal,,"Palmela, Portugal",38.569601,-8.9011653,,NA,NA,NA,103,blade 40,,,,,,,,"Another blade, longer with short tang, + many other objects in same grotto.","Blade flat, tang oblong in section.","E. Cartailhac, Ages Prehistoriques, Fig. 181,V.G. Childe, Dawn of European Civilization (1925), Fig. 57, 2, erroneous scale ""1/2"", actually less than 1/4; also Peake + Fleure, Merchant Venturers in Bronze, Fig. 5 c, p. 17,Aberg, Civilisation Eneolithique Iberique, Fig. 76, 2.",,Joellen McGann,https://farm9.staticflickr.com/8850/18610896135_aa6546f68f_q.jpg,https://farm9.staticflickr.com/8850/18610896135_aa6546f68f_b.jpg,https://www.flickr.com/photos/115096994@N02/18610896135,superuser,ForeignWeapons
BAI-14866,433,Socketed Chisel/Punch,,,NA,Bronze Age,p0gjgrs6qb2,,"Dorchester Museum,Donated by Sandra Dobson, 1976",,,Dorchester Museum,"England,Dorset,Tarrant Monkton,""in the mud of a river bank"",roughly ST 943 086,presumably the River Towant but G.R. quoted does not lie on it,22.1.76,""found by schoolchild""",,,river,Tarrant Monkton,,England,Dorset,"Tarrant Monkton, Blandford Forum, Dorset Dt11, UK",50.87402725,-2.0874582747989,c. ST 94 08,22,1,1976,113,17,,,,"Brown, slightly pitted and green corrosion.",,Width: 17 socket,,,Fairly sound condition.,,"ND 76,PIF; CI; SI",Joellen McGann,https://farm4.staticflickr.com/3844/15013272238_d6ba6f705d_q.jpg,https://farm4.staticflickr.com/3844/15013272238_d6ba6f705d_b.jpg,https://www.flickr.com/photos/MicroPasts/15013272238,only good record,A8tools
BAI-15090,433,Looped socketed Adze,,,NA,Bronze Age,p0gjgrs6qb2,,"British Museum, W.G. 1759",WG.1759,H_WG-1759,British Museum,"England,Surrey,Thames Ditton,Found in the Thames",,,river,Thames Ditton,,England,Surrey,"Thames Ditton, Surrey, UK",51.389182,-0.3290769,,NA,NA,NA,79,26,38,105,Light brown,Slightly rough,24,Width: Butt 26mm; Blade 38mm,Bronze,,"Square section, marks of casting. Shouldered blade. Green edges.",,"It is possible that this celt may have been found at Ditton in the Parish of Stoke Poges, Bucks.",Joellen McGann,https://farm4.staticflickr.com/3880/15013218547_a878191818_q.jpg,https://farm4.staticflickr.com/3880/15013218547_a878191818_b.jpg,https://www.flickr.com/photos/MicroPasts/15013218547,superuser,A8tools
BAI-27678,64,Stake,Trunnion Celt Form,,NA,Bronze Age,p0gjgrs6qb2,,"British Museum,given by H. Drummond 1853",,,British Museum,"England,Surrey,Albury,Farley Heath",,,,Albury,,England,Surrey,"Farley Heath, Albury, Guildford, Surrey Gu5, UK",51.2715316,-0.341452351129091,,NA,NA,NA,121,edge 17 middle 25 butt 16,,80.27,rich green,encrusted spots,8,,,,,"Antiqs. Jo. V (1925), 52.,Evans A.B.I., pp. 69, 169,V.C.H. Surrey I 240",,Hugh Fiske,https://farm8.staticflickr.com/7514/15758758020_4fdd3dafc1_q.jpg,https://farm8.staticflickr.com/7514/15758758020_4fdd3dafc1_b.jpg,https://www.flickr.com/photos/MicroPasts/15758758020,superuser,toolsA8
BAI-31183,580,Stake,,,NA,Bronze Age,p0gjgrs6qb2,,"Salisbury, S. Wilts and Blackmoor Museum, B257 on side. 23 on face.","23,B257",,Blackmoor Museum,"Ireland, Tipperary, Toomavara",,,,Toomavara,,Ireland,County Tipperary,"Toomevara, Co. Tipperary, Ireland",52.8611825,-8.112493,,NA,NA,NA,127,edge 29; middle 38; butt 12,,110.5,brown,pitted,8,,,,,,,Denis Antoine,https://farm9.staticflickr.com/8662/16039740844_386d7e6851_q.jpg,https://farm9.staticflickr.com/8662/16039740844_386d7e6851_b.jpg,https://www.flickr.com/photos/MicroPasts/16039740844,superuser,irishB10
BAI-31220,580,Stake,,,NA,Bronze Age,p0gjgrs6qb2,,"Sotheby's Sale 14. 12. 25. Lot 283, Property of Mons. Fenardent.",,,Private Collection,"Ireland, Cork, Bandon",,,auction,,,Ireland,County Cork,"Bandon, Co. Cork, Ireland",51.7356023,-8.9328923,,NA,NA,NA,168,edge 36; middle 40.5; butt 21,,,"polished patina, medium mottled green. loghter colour on reverse.","smooth, slightly pocked.",11,,,,,,"Painted on: Nr. Bandon, 14977, n.x.x.",Denis Antoine,https://farm9.staticflickr.com/8603/16474469358_8c463e2d61_q.jpg,https://farm9.staticflickr.com/8603/16474469358_8c463e2d61_b.jpg,https://www.flickr.com/photos/MicroPasts/16474469358,superuser,irishB10
BAI-31211,580,Stake,,,NA,Bronze Age,p0gjgrs6qb2,,"Private collection, Professor Sir Lucas-White-King CSI. LLD. FSA, late of Roebuck Hall, Co Dublin., Sold by Auction at Sotheby's 9. 11. 21. Lot 135",,,Private Collection,"Ireland, Co Antrim, In a crannog.",,,auction,,,Ireland,County Antrim,"District D'antrim, United Kingdom",54.70441085,-6.19586621545405,,NA,NA,NA,75.5,edges 24; 28; middle 31,,,no patina,smooth - a little pocked. Bright bronze colour.,7.5,,,,Edges are sharp although damaged.,,,Denis Antoine,https://farm9.staticflickr.com/8632/16042123193_8c13bded03_q.jpg,https://farm9.staticflickr.com/8632/16042123193_8c13bded03_b.jpg,https://www.flickr.com/photos/MicroPasts/16042123193,superuser,irishB10
BAI-31325,580,Stake,,,NA,Bronze Age,p0gjgrs6qb2,,"British Museum 54 12 27 30, presented by John Lindsay Esq. of Cork, 1854",1854 12 27 30,H_1854-1227-30,British Museum,Ireland,,,,,,Ireland,,Ireland,NA,NA,,NA,NA,NA,173,edge 36; middle 34; butt 12,,222.2,light green & brown showing metal at butt,much corroded,9,,,,Both points much worn,,,Denis Antoine,https://farm9.staticflickr.com/8622/16042114283_6994dd5d71_q.jpg,https://farm9.staticflickr.com/8622/16042114283_6994dd5d71_b.jpg,https://www.flickr.com/photos/MicroPasts/16042114283,superuser,irishB10
BAI-27803,64,STAKE,,,NA,Bronze Age,p0gjgrs6qb2,,"Private,1923,Mr C.B. Jones-Mortimer,Wigfair, St. Asaph",,,Private Collection,"Wales,Denbighshire,}probably",,,,,,Wales,,,NA,NA,,NA,NA,NA,196,edge 40.5; middle 39; butt 12,,226.8,no patina much cleaned,"heavily pitted all over, dark brass colour","6.5, 7.5",,,,"Sharp edge, butt has been sharp, appears filed","W.J. Hemp, Antiquaries Journal V (1925), 51, Fig.",,Hugh Fiske,https://farm8.staticflickr.com/7549/15760029879_ae7c052970_q.jpg,https://farm8.staticflickr.com/7549/15760029879_ae7c052970_b.jpg,https://www.flickr.com/photos/MicroPasts/15760029879,superuser,toolsA8
BAI-27720,580,Stake,,,NA,Bronze Age,p0gjgrs6qb2,,"Private Collection, 1923, Dr. E. Davies Rees, Rhufeinfa, Caersws, Montgomeryshire",,,Private Collection,"Wales, Montgomeryshire, between Carno & Llanbrynmair, turned up by a plough.",,,,,,Wales,,"Carno, Caersws, Powys Sy17, United Kingdom",NA,NA,,NA,NA,NA,179,edge 37.5; middle 37; butt 18,,219.7,"traces of thin patina, black & light green powdery patches.",filed surfaces. smooth & much cleaned. Slightly pocked.,9.5; 8.5,,,,,,,Denis Antoine,https://farm8.staticflickr.com/7476/15323789174_263ea2eb16_q.jpg,https://farm8.staticflickr.com/7476/15323789174_263ea2eb16_b.jpg,https://www.flickr.com/photos/MicroPasts/15323789174,superuser,toolsA8
BAI-14857,433,Double Axe,,,NA,Bronze Age,p0gjgrs6qb2,,"British Museum, 1933.4-6.126,BRM Dept. Rept. In Bequest of R Garraway Rice, Exp, F.S.A., received April 1933; has been in his collection since January 1913 - see statement on label quoted opposite.",1933.4-6.126,,British Museum,"England,Devon,Topsham,'Found by a labourer circa. 1911 while digging ""in a market garden near Mount Howe, Topsham, Devon, about 4 miles from Exeter""; came into possession of H. Wilson HOlman, Esq., FSA during Summer 1912, who presented it to the under-signed in January 1913. R. Garroway Rice, FSA',(Label in Mr. Rice's hand on hand to which axe was fixed in his collection - preserved in British Museum as document.)",,,,Topsham,,England,Devon,"Topsham, Devon, UK",50.6850732,-3.4658063,,NA,NA,1911,,,,714,Origionally dirty greenish black more golden-brown after BM Laboratory treatment.,,,,Copper-rich bronze (Copper 94.3; Tin 3.3; Lead 1.5; Antimony 0.7),,"Cutting edges blunt and chipped, one very considerably. Wings of the blades symmetrical; however on socket rather elongated at the ends in its wider part.,Chemical Analysis (B.M. Laboratory, Nov. 1937) gave these figures, so might be called copper rather than bronze.",,"CF. Specimen of similar shape from Whitby, N.R. Yorks.,AOK (Section)",Joellen McGann,https://farm4.staticflickr.com/3903/15013185180_c7642c44b4_q.jpg,https://farm4.staticflickr.com/3903/15013185180_c7642c44b4_b.jpg,https://www.flickr.com/photos/MicroPasts/15013185180,superuser,A8tools
BAI-14790,433,Double Axe,,,NA,Bronze Age,p0gjgrs6qb2,,"Craven Museum, Skipton-in-Craven, Yorkshire, no. A63",A63,,Craven Museum,"England,Yorkshire,N. Riding,Whitby",,,,Whitby,,England,North Yorkshire,"Whitby, North Yorkshire, UK",54.4874141,-0.6155111,,NA,NA,NA,,,,523,Very dark greenish back in colour: cleaned off in one patch which is golden bronze.,Smooth except for one face near the cutting edges where it is considerably pitted.,,,"Bronze (Copper, 90.6; Tin 8.9),Chemical Analysis, (B.M. Laboratory, Nov. 1937): Copper 90.6; Tin 8.9; Lead Trace; Antimony Trace; Iron Trace; Thus to be called bronze, not copper (as Elgee [...])",,"Double axe (if specimen from Topsham, Devon) both cutting edges unsymmetrical. Surface rather knocked about, with scratches and chips missing, especially along all the edges. Transverse socket.","Elgee, F., Early Man in N.E. Yorkshire (1930), pp. 62-3, fig. 20, top, and Pl XI, fig. 1.",,Joellen McGann,https://farm4.staticflickr.com/3873/15199856275_836bcf2887_q.jpg,https://farm4.staticflickr.com/3873/15199856275_836bcf2887_b.jpg,https://www.flickr.com/photos/MicroPasts/15199856275,superuser,A8tools
BAI-4531,433,Double Axe,,,NA,Bronze Age,p0gjgrs6qb2,,"Dr. Christopher Martins, George Road, Edgbaston",,,Private Collection,"greece, salonika (thessalonika), sept. 1903 by col. massey",,,,,,Greece,,"Thessalonika, Greece",40.6403167,22.9352716,,NA,9,1903,195,45,65,,nearly black,Quite smooth,,Width: 65 at edges 45 at centre,Bronze,,"These are 3 objects mounted on a stiff cardboard in this collection described as double axes see my sketches., No. 55 and 57",,,Joellen McGann,https://farm3.staticflickr.com/2879/13306281095_654db5992f_q.jpg,https://farm3.staticflickr.com/2879/13306281095_654db5992f_b.jpg,http://www.flickr.com/photos/MicroPasts/13306281095,superuser,drawB8
BAI-4528,433,Double Axe,,,NA,Bronze Age,p0gjgrs6qb2,,"British Museum, 1893. 12-19.2","1893,12-19.2",,British Museum,France,,,,,,France,,France,46.603354,1.8883335,,NA,NA,NA,114,44,,,,Shiny mask bright green patina.,,Unspecified location in France - geolocation not accurate to 10 kms.,,,,"Hawkes, BSA 37 (1936-7), 155 fig. 4.1",,Joellen McGann,https://farm3.staticflickr.com/2832/13306643044_168ed89112_q.jpg,https://farm3.staticflickr.com/2832/13306643044_168ed89112_b.jpg,http://www.flickr.com/photos/MicroPasts/13306643044,superuser,drawB8
BAI-44980,433,Double Axe,,,NA,Bronze Age,p0gjgrs6qb2,,"Acc. No. 44:45,Keighley Museum, Yorkshire,Purchased from T. A. Glenn (the Late), Garthowen, St. George's Road, Abergele, Denbighshire, N. Wales",,,Private Collection,"Ireland,Kildare,Bog of Allen (possibly)",,,bog,,,Ireland,Kildare,"Kildare, Ireland",53.15436455,-6.81841756609764,,NA,NA,NA,150.876,73.66,,935.534,Nil,Smooth,25.4,"Length: 5 15/16"" = 150.876 mm,Width: 2 9/10"" = 73.66mm,Thickness: 1"" = 25.4 mm,Weight: 2 lb 1 oz = 935.534 gms",Bronze,?,Double Axe with one blade removed by cold chisel technique,"""Bronze Double Axes in the British Isles"", Piggot, Stuart.,""Proc. Prehistoric Society, 1953, Vol. XIX, Part 2""","G. Ogden, Curator.,Formerly purchased at sale of effects of Lord W. Vertree's Irish racing estate. The axe was with specimens of modern tools. Family had no knowledge of its discovery or source; but suggested that it came out of the Bog of Allen.",Joellen McGann,https://farm6.staticflickr.com/5664/20843389134_ef23feab32_q.jpg,https://farm6.staticflickr.com/5664/20843389134_ef23feab32_b.jpg,https://www.flickr.com/photos/115096994@N02/20843389134,superuser,IrishAxesPt2
BAI-15119,433,Double Axe,,,NA,Bronze Age,p0gjgrs6qb2,,"Mr. Christopher Martin, George St. Edgbaston",,,Private Collection,,,,,,,,,,NA,NA,,NA,NA,NA,80,15,38,,Light clear green,Very smooth,11,,Bronze,,"Described to me as a ""Double Axe"" - There are 3 examples in collection. See my sketches Nos. 56 5 57-",,,Joellen McGann,https://farm4.staticflickr.com/3923/15199414272_c14ff00d7b_q.jpg,https://farm4.staticflickr.com/3923/15199414272_c14ff00d7b_b.jpg,https://www.flickr.com/photos/MicroPasts/15199414272,superuser,A8tools
BAI-27804,64,Two-edged KNIFE,,,NA,Bronze Age,p0gjgrs6qb2,C,"Privately owned by,Miss ISABEL DOBSON,NORTH VIEW COTTAGE,,LITTLE URSWICK,,Nr ULVERSTON",,,Private Collection,"(LANCASHIRE) CUMBRIA,Urswick,About 1/4 mile north of central hut, Urswick Stone Walls on surface of ground in 1912, by Rev. J. Dobson.",,,,Urswick,,England,Cumbria,"Urswick, Cumbria, UK",54.14996635,-3.14189083357979,,NA,NA,1912,135,"22,Tang 25 long, 16 wide at butt",,,,,Greatest thickness 3,"Length 5 5/16"",Width 7/8"",Tang 1"" long, 5/8"" wide at butt,Greatest thickness 1/8""",,No associated finds.,"Raised rib on both faces of tang 7/8"" long and 1/16 in deep. Low mid-rib; both edges are chamfered and rather decayed. cf Heathery Burn. Probably Late Bronze Age II or III. Tip broken off. Smooth green patina","Trans. Cumb. & West. Ant. and Arch. Soc. (N.S.) XII, 283 and NS XXVI, 49.","Miss Dobson says the field where the knife was found is known as ""Tostills"".",Hugh Fiske,https://farm8.staticflickr.com/7469/15944109041_b7df10aab8_q.jpg,https://farm8.staticflickr.com/7469/15944109041_b7df10aab8_b.jpg,https://www.flickr.com/photos/MicroPasts/15944109041,superuser,toolsA8
BAI-29652,727,Socketed Awl,,,NA,Bronze Age,p0gjgrs6qb2,,B.M. WG 1762,WG.1762,H_WG-1762,British Museum,"London, Waltham Forest, Walthamstow, Lea Marshes",,,marshland,Walthamstow,,England,Greater London,"Walthamstow, Greater London, UK",51.5844701,-0.0188186,"TQ 37, 89",NA,NA,NA,,,,,,,,,,,,,,Marla Walcott,https://farm8.staticflickr.com/7443/16441709495_0894bfa6c1_q.jpg,https://farm8.staticflickr.com/7443/16441709495_0894bfa6c1_b.jpg,https://www.flickr.com/photos/MicroPasts/16441709495,most detailed record,singleA18
BAI-21239,782,Socketed axe - chisel,,,NA,Bronze Age,p0gjgrs6qb2,,"Cambridge A.M.A.E,  ?   53.175",53.175,,MAA Cambridge,"Suffolk (West), Wangford",,,,Wangford,,England,Suffolk,"Wangford, Beccles, Suffolk Nr34, UK",52.3552038,1.6221639,,NA,NA,NA,,,,,,,,Lack of information recorded on original card,,,,,,Martyn Franklin,https://farm6.staticflickr.com/5598/15576560316_3cd25fda15_q.jpg,https://farm6.staticflickr.com/5598/15576560316_3cd25fda15_b.jpg,https://www.flickr.com/photos/MicroPasts/15576560316,most detailed record,drawerA5A6
BAI-13327,433,Spearhead Lunate,,,NA,Bronze Age,p0gjgrs6qb2,L,"Mr. R. Rexton, Watton Priory (1955)",,,Private Collection,"England,Yorkshire,Watton,Holderness,Bridge Farm,Ploughing in 1934",,,farm,Watton,,England,East Riding of Yorkshire,"Watton, Driffield, East Riding Of Yorkshire Yo25, UK",52.5699185,0.8253494,"0* 25' 27"" 53* 55' 46""",NA,NA,1934,244,54,,,,,,,,,,Yks. Ag Pr. 152 (XXXVIII/4) 447-8,,Joellen McGann,https://farm4.staticflickr.com/3863/15156673616_56f7d2faff_q.jpg,https://farm4.staticflickr.com/3863/15156673616_56f7d2faff_b.jpg,https://www.flickr.com/photos/MicroPasts/15156673616,superuser,DrawerA14
BAI-27275,433,Side-Looped Ring,,,NA,Bronze Age,p0gjgrs6qb2,3,"Leicester Museum,Lent by Mrs. Hocart",,,Leicester Museum,"England,Leicestershire,Welby",,,,Welby,,England,Leicestershire,"Welby, Melton Mowbray, Leicestershire Le14, UK",52.7812672,-0.9266174,,NA,NA,NA,,35,,,,,6,"Width: diam. 35mm,Thickness: 6mm to 7mm",Bronze,,This was doubtless used on a belt. The actual fastener being on the other clasp which is not represented.,,,Joellen McGann,https://farm8.staticflickr.com/7570/15751199470_e6dbb9b08a_q.jpg,https://farm8.staticflickr.com/7570/15751199470_e6dbb9b08a_b.jpg,https://www.flickr.com/photos/MicroPasts/15751199470,superuser,ornamentsA15
BAI-27148,433,Side-Looped Ring,,,NA,Bronze Age,p0gjgrs6qb2,,"Moyses Hall Museum,Bury St. Edmunds Suffolk,acc. numbers F115 and 116",F115 and 116,,Moyses Hall Museum,"England,Suffolk,Woolpit,(found many years ago)",,,,Woolpit,,England,Suffolk,"Woolpit, Bury Saint Edmunds, Suffolk Ip30, UK",52.2247689,0.8880944,,NA,NA,NA,,13,,35,,Both cleaned some years ago and both have one decayed hole in one side.,,Outer Diameter: 35mm,Hollow cast bronze on clay core with loop attachment.,Late Bronze Age Leaf Sword F16 from same locality but not associated.,Two. Hollow cast bronze rings with loop attachments on clay cores. Weight both approx 1 1/4 oz (35.44 gms) each.,"Comparison: Welby Hoard, Leicestershire, Inventaria Archaeologica, GB 24 (2) 2., Number 8.","Very Late Bronze Age,The Leaf sword was formerly at Norwich Museum.",Joellen McGann,https://farm9.staticflickr.com/8666/15938413745_fc632b30df_q.jpg,https://farm9.staticflickr.com/8666/15938413745_fc632b30df_b.jpg,https://www.flickr.com/photos/MicroPasts/15938413745,superuser,ornamentsA15
BAI-20973,433,Looped and socketed celt,,,NA,Bronze Age,p0gjgrs6qb2,BII2,"Reading Museum, 273:47,Thames Conservancy Board Collection",273:47,,Reading Museum,"England,Oxfordshire (Oxon),Whitchurch,Dredged from the Thames",,,"river,dredged",Whitchurch,,England,Oxfordshire,"Whitchurch-on-thames, Reading, Oxfordshire Rg8, UK",51.49396785,-1.07475864641017,,NA,NA,NA,,,,,Dark green-brown,Very good,,,Bronze,,Condition very good,,,Joellen McGann,https://farm4.staticflickr.com/3953/15414653720_5f9cc6d1dd_q.jpg,https://farm4.staticflickr.com/3953/15414653720_5f9cc6d1dd_b.jpg,https://www.flickr.com/photos/MicroPasts/15414653720,superuser,drawerA5A6
BAI-62247,433,Harness Fitting,,,NA,Bronze Age,p0gjgrs6qb2,,"Brighton Museum,lent by H.S. Toms Esq. (the curator)",,,Brighton Museum,"England,Sussex,Portslade near Whitelot Bottom, Thundersbarrow",,,barrow,Whitelot Bottom,,England,East Sussex,"Portslade, The City Of Brighton And Hove, UK",52.0862643,1.1331329,,NA,NA,NA,33,"16, 20.5",,5.67,Light greyish green patina,Smooth. Light earth adheres nearly all over this.,0.5,,,Found with a Bronze hoard.,This consists of a piece of thin and bronze folded over and riveted.,,,Joellen McGann,https://farm8.staticflickr.com/7037/26801756400_07ce8752b2_q.jpg,https://farm8.staticflickr.com/7037/26801756400_07ce8752b2_b.jpg,https://www.flickr.com/photos/115096994@N02/26801756400,superuser,DubiousBA
BAI-62225,433,Harness fitting,,,NA,Bronze Age,p0gjgrs6qb2,,"Private Collection,F. Ransom Esq., Hitchin",,,Private Collection,Unprov.,,,,,,,,,NA,NA,,NA,NA,NA,125,"33.5, 32.5, 29.5",,slightly under 31.89,No patina,Rough with a green encrustment all over,nearly 2,,? made of iron,,Doubtful Bronze Age,,,Joellen McGann,https://farm8.staticflickr.com/7568/27042870316_2062827bfd_q.jpg,https://farm8.staticflickr.com/7568/27042870316_2062827bfd_b.jpg,https://www.flickr.com/photos/115096994@N02/27042870316,superuser,DubiousBA
BAI-61658,433,Cap Terminal,,,NA,Bronze Age,p0gjgrs6qb2,,"Museum of Archaeology + Ethnology, Cambridge,Purchased by the Cambridge Antiquaries Society, April 1919,1919.b",1919.6,,MAA Cambridge,"England,Cambridgeshire,Wilburton,In fen-land belonging to Mr. Oliver Claude Pell,1882",,,fenland,Wilburton,,England,Cambridgeshire,"Wilburton, Ely, Cambridgeshire Cb6, UK",52.3531661,0.1777163,,NA,NA,1882,79,,,102,Black and dusty brown patina,Rough and corroded. Broken away round the edge and near one of the Rovet holes. Cast marks show by Rivet holes,27,,,The Wilburton Hoard,"Described and illustrated in the Archaeologia, as an object ""not unlike the lid of jar, consisting of a convex circular plate with a shallow groove round margin + having attached to it and the concave side, a short tube of metal. Through this runs a hole for the Rivet bu which it was probably attached to a piece of wood"". Cast marks show by Rivet holes. Single casting","Archaeologia, XLVIII, 106,New Cambridge, 17 May 1919",,Joellen McGann,https://farm2.staticflickr.com/1442/25956834904_ca7d29d85a_q.jpg,https://farm2.staticflickr.com/1442/25956834904_ca7d29d85a_b.jpg,https://www.flickr.com/photos/115096994@N02/25956834904,superuser,BitandBobsA15
BAI-27599,433,CheekPiece,Bit Cheek Piece,,NA,Bronze Age,p0gjgrs6qb2,C,"Museum of Archaeology and Ethnology, Cambridge,Purchased by the Cambridge Antiquarian Society, April 1919,1919.6",1919.6,,MAA Cambridge,"England,Cambridgeshire,Wilburton,In fen-land owned by Mr. Oliver Claude Pell.,1882",,,,Wilburton,,England,Cambridgeshire,"Wilburton, Cambridgeshire, UK",52.3531661,0.1777163,,NA,NA,1882,75,46,,38,Dusty green patina.,Smoother in front than behind.,8,,,The Wilburton Hoard,"""A flat C-shaped object expanding at the 2 ends in which are deep recesses with rivet holes through them. Through the middle of the curved part is an oblong hole 16mm x 5mm which communicates with the narrow slit in the thickness of the metal that opens out at the back of the C. This place is broken and mended. One face ornamented with marginal grooves round the curved part and double transverse lines behind the rivet holes."",Incised decorative lines bordering edges and running across below terminals are only on one side of the objects.","Archaeologia, XLVIII, 106,New Cambridge, 17 May 1919",,Joellen McGann,https://farm8.staticflickr.com/7504/15752330479_35da8e4f04_q.jpg,https://farm8.staticflickr.com/7504/15752330479_35da8e4f04_b.jpg,https://www.flickr.com/photos/MicroPasts/15752330479,superuser,ornamentsA15
BAI-27455,433,CheekPiece,Bit Cheek Piece Winged,,NA,Bronze Age,p0gjgrs6qb2,C,"National Museum of Wales,12.11/17",12.11/17,,National Museum of Wales,"Wales,Glamorgan,Rhigos,Llynfawr Reservoir",,,,,,Wales,Rhondda Cynon Taff,"Llyn Fawr, Aberdare, Rhondda Cynon Taff Cf44, UK",51.719666,-3.568595,,NA,NA,NA,164,49,,54.33,No patina,Smooth and polished - dark brown bronze colour.,8,"Width: 49mm; 24.5mm,Thickness: 8mm; 5mm",,One of a hoard.,Only decorated on the face side. Splendidly made and in good preservation. There is half another chape in this collection of identical design.,,,Joellen McGann,https://farm9.staticflickr.com/8666/15751064750_8cf26702c4_q.jpg,https://farm9.staticflickr.com/8666/15751064750_8cf26702c4_b.jpg,https://www.flickr.com/photos/MicroPasts/15751064750,superuser,ornamentsA15
BAI-27454,433,CheekPiece,Bit Cheek Piece Winged,Broken,NA,Bronze Age,p0gjgrs6qb2,,"National Museum of Wales,12.11/18",12.11/18,,National Museum of Wales,"Wales,Glamorgan,Rhigos,Llynfawr Reservoir",,,,,,Wales,Rhondda Cynon Taff,"Llyn Fawr, Aberdare, Rhondda Cynon Taff Cf44, UK",51.719666,-3.568595,,NA,NA,NA,97,49,,28.35,Thin blackish patina with dark golden bronze showing.,Smooth.,7.5,"Width: (unbroken about 49mm); 24mm,Thickness: 7.5mm; 3.5mm",,One of a hoard.,The design is identical with that of the complete chape in this hoard.,"PW, No. 690.",,Joellen McGann,https://farm8.staticflickr.com/7560/15752600787_95577f4bd1_q.jpg,https://farm8.staticflickr.com/7560/15752600787_95577f4bd1_b.jpg,https://www.flickr.com/photos/MicroPasts/15752600787,superuser,ornamentsA15
BAI-62324,433,CheekPiece,,,NA,Bronze Age,p0gjgrs6qb2,,"Alnwick Castle, No. 456",456,,Alnwick Castle,Ireland,,,,,,Ireland,,Ireland,NA,NA,,NA,NA,NA,78,,,53,Bronze patina,Smooth,,,,,,,,Joellen McGann,https://farm8.staticflickr.com/7446/26801742620_b185256484_q.jpg,https://farm8.staticflickr.com/7446/26801742620_b185256484_b.jpg,https://www.flickr.com/photos/115096994@N02/26801742620,superuser,DubiousBA
BAI-62323,433,CheekPiece,,,NA,Bronze Age,p0gjgrs6qb2,,"Alnwick Castle, No. 455",455,,Alnwick Castle,Ireland,,,,,,Ireland,,Ireland,NA,NA,,NA,NA,NA,70,,,31.8,Green patina,Very corroded,3,,,,,,,Joellen McGann,https://farm8.staticflickr.com/7637/27007611591_5cf4f2d59d_q.jpg,https://farm8.staticflickr.com/7637/27007611591_5cf4f2d59d_b.jpg,https://www.flickr.com/photos/115096994@N02/27007611591,superuser,DubiousBA
BAI-62322,433,CheekPiece,,,NA,Bronze Age,p0gjgrs6qb2,,"Alnwick Castle, No. 454",454,,Alnwick Castle,Ireland,,,,,,Ireland,,Ireland,NA,NA,,NA,NA,NA,123,,,74.9,,,4,,,,,,,Joellen McGann,https://farm8.staticflickr.com/7547/26801742980_42db550d78_q.jpg,https://farm8.staticflickr.com/7547/26801742980_42db550d78_b.jpg,https://www.flickr.com/photos/115096994@N02/26801742980,superuser,DubiousBA
BAI-62321,433,CheekPiece,,,NA,Bronze Age,p0gjgrs6qb2,,"Alnwick Castle, No. 453",453,,Alnwick Castle,Ireland,,,,,,Ireland,,Ireland,NA,NA,,NA,NA,NA,106,,,153.3,Brown patina,Smooth,5,,,,,,,Joellen McGann,https://farm8.staticflickr.com/7484/27007612061_63dfc03da6_q.jpg,https://farm8.staticflickr.com/7484/27007612061_63dfc03da6_b.jpg,https://www.flickr.com/photos/115096994@N02/27007612061,superuser,DubiousBA
BAI-62320,433,CheekPiece,,,NA,Bronze Age,p0gjgrs6qb2,,"Alnwick Castle, No. 452",452,,Alnwick Castle,Ireland,,,,,,Ireland,,Ireland,NA,NA,,NA,NA,NA,108,,,66.8,Bronze,,6,,,,,,,Joellen McGann,https://farm8.staticflickr.com/7785/26801743320_6b94f16c76_q.jpg,https://farm8.staticflickr.com/7785/26801743320_6b94f16c76_b.jpg,https://www.flickr.com/photos/115096994@N02/26801743320,superuser,DubiousBA
BAI-62319,433,CheekPiece,,,NA,Bronze Age,p0gjgrs6qb2,,"Alnwick Castle, No. 457",457,,Alnwick Castle,Ireland,,,,,,Ireland,,Ireland,NA,NA,,NA,NA,NA,146,81,,115,Bronze patina,Smooth,8,,,,Portion of leather reins attached,,,Joellen McGann,https://farm8.staticflickr.com/7664/27007612981_c800a19d41_q.jpg,https://farm8.staticflickr.com/7664/27007612981_c800a19d41_b.jpg,https://www.flickr.com/photos/115096994@N02/27007612981,superuser,DubiousBA
