objectID,userID,objectType,classification,completeness,quantity,broadperiod,periodo,rightCorner,collection,museumID,collectionIdentifier,museumCollection,site,stolenStatus,hoard,discoveryContext,parish,district,country,county,toSearch,fourFigureLat,fourFigureLon,gridRef,dateDiscoveryDay,dateDiscoveryMonth,dateDiscoveryYear,length,width,edge,weight,patina,surface,thickness,other,composition,associations,description,publications,remarks,inputBy,thumbnail,imageURL,flickrURL,Processing,project
BAI-11745,433,flanged Axe,Haft,,NA,Bronze Age,p0gjgrs6qb2,,Scarborough Museum,,,Scarborough Museum,"England,Yorkshire,River Humber",,,river,,,England,East Riding of Yorkshire,"Newlands Lane, Hull, East Riding Of Yorkshire Hu12 8ay, UK",NA,NA,,NA,NA,NA,121,22,47,,Dull green patina,Rough,,Width: centre 22mm; edge 47mm,,,,,,Joellen McGann,https://farm4.staticflickr.com/3845/14957385396_bf393c8b2e_q.jpg,https://farm4.staticflickr.com/3845/14957385396_bf393c8b2e_b.jpg,https://www.flickr.com/photos/MicroPasts/14957385396,superuser,flangedAxesA1
BAI-11580,433,flanged Axe,Haft,,NA,Bronze Age,p0gjgrs6qb2,,"Smith Institute, Stirling,Cat. No. AJ13",AJ13,,"Smith Institute, Stirling","Scotland,Killin,Perthshire",,,,,,Scotland,Perthshire,"Killin, Killin, Stirling Fk21, UK",NA,NA,,NA,NA,NA,126,,38,227,Dark brown.,Somewhat corroded.,25,Weight: 8 oz (approx) = 226.796 gms,Bronze,,Small winged axe. Very slight stop-ridge. Edge fairly sharp - also butt.,,"Label: ""Killin, Perthshire""",Joellen McGann,https://farm6.staticflickr.com/5566/14980057622_021491c245_q.jpg,https://farm6.staticflickr.com/5566/14980057622_021491c245_b.jpg,https://www.flickr.com/photos/MicroPasts/14980057622,superuser,flangedAxesA1
BAI-11342,433,Flanged Axe,,,NA,Bronze Age,p0gjgrs6qb2,,"Yorkshire Museum, York",,,Yorkshire Museum,"England,Greater London,From R. Thames",,,river,,,England,Greater London,"Thames Path, Isle Of Dogs, London E14 8ng, UK",NA,NA,,NA,NA,NA,177,29,77,628,Dull black to brown,,27,"Width: edge 77mm; middle 33mm; butt 29mm,Thickness: 27mm; 12mm,Weight: 627.87 gms",,,Very well preserved. Edge sharp and shows signs of whetting.,,,Joellen McGann,https://farm4.staticflickr.com/3874/14793171019_67e9b5a0e8_q.jpg,https://farm4.staticflickr.com/3874/14793171019_67e9b5a0e8_b.jpg,https://www.flickr.com/photos/MicroPasts/14793171019,superuser,flangedAxesA1
BAI-63136,580,Flanged Axe,,,NA,Bronze Age,p0gjgrs6qb2,,"Bristol Museum F855,Bought at Auction Sale 1924.",F855,,Bristol Museum & Art Gallery,Ireland.?,,,auction,,,Ireland,,,NA,NA,secn.,NA,NA,NA,124.5,middle 25; butt 21,80,347.28,,,12; 20,,,,,,,Denis Antoine,https://farm8.staticflickr.com/7454/28187739651_be28784ba4_q.jpg,https://farm8.staticflickr.com/7454/28187739651_be28784ba4_b.jpg,https://www.flickr.com/photos/115096994@N02/28187739651,superuser,IrishAxesB5
BAI-63718,580,flanged Axe,Haft,,NA,Bronze Age,p0gjgrs6qb2,,"British Museum 54 7 14 197,purchased from Collection of Mr. Cooke of Parsonstown 1854.","1854,7-14.197",,British Museum,Ireland. (probably),,,,,,Ireland,,,NA,NA,,NA,NA,NA,114,middle 26.5; butt 34,58,420.14,dark greyish green,heavily corroded.,8; 35,,,,Edge & wings much broken. Butt broken off short.,,,Denis Antoine,https://farm9.staticflickr.com/8818/28162090842_55e9805851_q.jpg,https://farm9.staticflickr.com/8818/28162090842_55e9805851_b.jpg,https://www.flickr.com/photos/115096994@N02/28162090842,superuser,IrishAxesB5
BAI-63711,433,Flanged Axe,,,NA,Bronze Age,p0gjgrs6qb2,,"British Museum, P1976 7-1 7,Royal Ontario Museum, Toronto,112/11,Purchased at Christies, 26.3.25,Probably from the Jas Burton Collection dispersed in London July 1836 and acquired by the then Marquis of Breadalbane,The property of Lieut-Col. T.G. Breadalbane Morgan Grenville-Gavin,ex Fleming Collection","P1976,7-1.7",,British Museum,locality unknown,,,,,,,,,NA,NA,,NA,NA,NA,87,middle 27; butt 22,41.5,,Dull dark green,Smooth,15; 6.5,,,,Bubble holes on left hand side (ie the side opposite to that which bears the loop. The decoration is indented + over the decoration are marks that might be from a large file.,,"A doubtful specimen.,See new index,PIF",Joellen McGann,https://farm8.staticflickr.com/7357/28187604481_24f676b6c2_q.jpg,https://farm8.staticflickr.com/7357/28187604481_24f676b6c2_b.jpg,https://www.flickr.com/photos/115096994@N02/28187604481,superuser,IrishAxesB5
BAI-63134,580,Flanged Axe,,,NA,Bronze Age,p0gjgrs6qb2,,"Museum of Archaeology & Ethnology, Cambridge, 141.,Foster Bequest.",141 Foster,,MAA Cambridge,Ireland,,,,,,Ireland,,Ireland,NA,NA,,NA,NA,NA,115,butt 26,71,269,,,14,,,,"A label is marked ""Ireland"", Robinson Collection"". Slight flanges & stop ridge. Ornamented below the stop with two vertical grooves enclosed by two ridges, each of which runs to the round bevel which is marked out in the same way - two ridges enclosing a groove. All the ornamentation is very shallow & faint. The sides are decorated with fluted rope pattern which disappears towards the butt.","Prehistoric Bronzes 8. Catalogue is lost.,Foster Bequest 6. Catalogue.",,Denis Antoine,https://farm9.staticflickr.com/8748/27650566633_283832e88f_q.jpg,https://farm9.staticflickr.com/8748/27650566633_283832e88f_b.jpg,https://www.flickr.com/photos/115096994@N02/27650566633,superuser,IrishAxesB5
BAI-63153,433,Flanged Axe,,,NA,Bronze Age,p0gjgrs6qb2,,"Sotheby's Sale, 19.11.24, 606,Collection of W.J. Knowled, MRIA of Flixton Place, Ballymena",,,Private Collection,"Locality unknown,Label: Oultens Sale, Bot. from Arthur, Ballymena",,,auction,,,,,,NA,NA,,NA,NA,NA,120.5,middle 29; butt 26,57.5,,"Traces of patina brown and black, but mostly bronze and golden bronze colour.",Smooth,27; 11; 28,,,,Hammer marks behind the edge. Very slight depression at A on each side of septum. The sides are decorated with slanting indentations.,,,Joellen McGann,https://farm9.staticflickr.com/8805/27650458794_eb78905b0c_q.jpg,https://farm9.staticflickr.com/8805/27650458794_eb78905b0c_b.jpg,https://www.flickr.com/photos/115096994@N02/27650458794,superuser,IrishAxesB5
BAI-63101,580,Flanged Axe,Bent,,NA,Bronze Age,p0gjgrs6qb2,,"Miss Eleanor M. Ferguson, Monkstown, Co. Cork.",,,Private Collection,"Ireland, Co Antrim, Donegore, Silversrings",,,,,,Ireland,County Antrim,"Donegore Hill, Muckamore, Antrim Bt41 2hw, United Kingdom",NA,NA,,NA,NA,NA,152,middle 33; butt 22.5,57,481.95,,Greeny Bronze colour,7.5; 13; 33.5,,,,,,,Denis Antoine,https://farm9.staticflickr.com/8588/28265948175_b78e5a3cac_q.jpg,https://farm9.staticflickr.com/8588/28265948175_b78e5a3cac_b.jpg,https://www.flickr.com/photos/115096994@N02/28265948175,superuser,IrishAxesB5
BAI-63712,433,Flanged Axe,,,NA,Bronze Age,p0gjgrs6qb2,,"Royal Ontario Museum, Toronto,purchased at Christie's 26.3.25,112/11,Probably from the Jas. Burton Collection dispersed in London July 1836 + acquired by the then Marquis of Breadalbane,The property of Lieut. Col. T. G. Breadalbane Morgan Grenville-Gavin",112/11,,"Royal Ontario Museum, Toronto",Locality unknown,,,"auction,lake",,,,,,NA,NA,,NA,NA,NA,84,middle 27; butt 14,41,,Dirty green,,8.5; 15,,,,Depression at A.,,,Joellen McGann,https://farm8.staticflickr.com/7700/28162092302_2a0ab7a9ff_q.jpg,https://farm8.staticflickr.com/7700/28162092302_2a0ab7a9ff_b.jpg,https://www.flickr.com/photos/115096994@N02/28162092302,superuser,IrishAxesB5
BAI-30151,580,Short Dirk,Trapezoidal Plate,,NA,Bronze Age,p0gjgrs6qb2,B,British Museum W.G. 1693.,WG.1693,H_WG-1693,British Museum,"England, Oxon, Thames, Abingdon, Sandford",,,river,Abingdon,,England,Oxfordshire,"Sandford-on-thames, Oxford, Oxfordshire Ox4, United Kingdom",51.71372265,-1.21126291975201,SU 49 97,NA,NA,NA,224,blade 13; hilt plate 32,,65.78,patch of bright green on reverse.,dull gold with black stains.,blade 4,,,,Two rivets. Lower part of blade slightly crooked.,,"Somewhat inacc., CI",Denis Antoine,https://farm9.staticflickr.com/8623/16255816977_bef05fe492_q.jpg,https://farm9.staticflickr.com/8623/16255816977_bef05fe492_b.jpg,https://www.flickr.com/photos/MicroPasts/16255816977,superuser,singleA18
BAI-30184,817,Short Dirk,",Trump's III Lisburn",,NA,Bronze Age,p0gjgrs6qb2,D,"British Museum,W.G. 1698.,J.P. Morgan Gift 1909.",WG.1698,H_WG-1698,British Museum,"England,THAMES,GREATER LONDON, Thames, Battersea",,,river,Battersea,Wandsworth,England,Greater London,"Battersea, London Sw11, UK",51.465339,-0.1801042,TQ2876,NA,NA,NA,198,16,,58.7,"on face, dark brown, with lower third light green. Reverse light greenish brown",finely specked. upper part worn.,5,"Width shows ""blade 16  hilt plate 26"". Thickness shows ""5 blade"".",,,,"B.A.V. Trump. P.P.S. 1962 No.5 p. 97,184","Not quite accurate.,C1",JP OConnor,https://farm8.staticflickr.com/7361/16439961881_e5db2bab52_q.jpg,https://farm8.staticflickr.com/7361/16439961881_e5db2bab52_b.jpg,https://www.flickr.com/photos/MicroPasts/16439961881,most detailed record,singleA18
BAI-29058,433,Short Dirk,Trapezoidal Plate,,NA,Bronze Age,p0gjgrs6qb2,A,"Ashmolean Museum, Oxford,1927-2344, Evans Collection",1927.2344,340417,Ashmolean Museum,"England,Cambridge,Burwell,Burwell Fen,1872",,,fenland,Burwell,,England,Cambridgeshire,"Burwell, Cambridge, Cambridgeshire Cb25, UK",52.2664422,0.3259917,,NA,NA,1872,215,36,,74.01,Dirty greenish patina.,,4,,,,"Length of rivets 14mm; diam. 7-9mm. Hilt approximately spatulate. 3 rivet-holes in line at butt. Originally 3 round-headed rivets, but 1 has been lost and this hole torn out.","Evans, Ancient Bronze Implements, p. 248,B.A.V. Trump, P.P.S., 1962, No. 5, p. 95, 26",Trump's I,Joellen McGann,https://farm8.staticflickr.com/7540/16081082357_f4771fd379_q.jpg,https://farm8.staticflickr.com/7540/16081082357_f4771fd379_b.jpg,https://www.flickr.com/photos/MicroPasts/16081082357,superuser,dirkspart2
BAI-28946,727,Short Dirk,Trapezoidal Plate,,NA,Bronze Age,p0gjgrs6qb2,B,"Ashmolean Museum, Oxford, 1927-2352. Evans Collection, (G. Fenton).",1927.2352,,Ashmolean Museum,"England, Suffolk, Bury St. Edmunds, ""Cambridge Fens"", 1863",,,fenland,Bury St. Edmunds,,England,Suffolk,"Bury Saint Edmunds, Bury Saint Edmunds, Suffolk Ip33, UK",52.2460367,0.7125173,,NA,NA,NA,248,See description,,191.4,,,8,,,,"Width as: ""46 mm, Length of rivets 15 mm, diam. 10 mm"", 2 rivets, round headed, head of one broken off",,"Evans, A.B.1; p.  248, says “A number of blades of this character … have been found in the Cambridgeshire Fens.”",Marla Walcott,https://farm8.staticflickr.com/7475/16080772619_fcf4b3ac51_q.jpg,https://farm8.staticflickr.com/7475/16080772619_fcf4b3ac51_b.jpg,https://www.flickr.com/photos/MicroPasts/16080772619,most detailed record,dirkspart2
BAI-28433,433,Short Dirk,,,NA,Bronze Age,p0gjgrs6qb2,D,"Reading Museum,Thames Conservancy Board",,,Reading Museum,"England,Berkshire and Buckinghamshire,Cookham,Oct. 1896,(Dug out of River Bed)",,,river,Cookham,Windsor And Maidenhead,England,Windsor And Maidenhead,"Cookham, Windsor And Maidenhead, UK",51.5600965,-0.7081509,,NA,10,1896,264,22,,,Green brown,,7,Width: blade 15mm; hilt plate 22mm,,,,,,Joellen McGann,https://farm9.staticflickr.com/8619/15863457630_f9ef2a4eea_q.jpg,https://farm9.staticflickr.com/8619/15863457630_f9ef2a4eea_b.jpg,https://www.flickr.com/photos/MicroPasts/15863457630,superuser,drawA10
BAI-29048,433,Short Dirk,Trapezoidal Plate,,NA,Bronze Age,p0gjgrs6qb2,B,"Museum of Archaeology and Ethnology, Cambridge,Cole-Ambrose Collection,558",558 Ambrose Colllection,,MAA Cambridge,"England,Cambridgeshire,Coveney,Downham Hill",,,hillside,Coveney,,England,Cambridgeshire,"Coveney, Ely, Cambridgeshire Cb6, UK",52.4263654,0.175235449658021,,NA,NA,NA,283.5,57,,99.22,No patina.,Smooth. Browny green.,3.5,"Width: blade 17.5mm; hilt 57mm,Thickness: blade 3.5mm; rivet8.5mm; 9mm",,,One rivet remains.,"B.A.V. Trump, P.P.S., 1962, No. 5, p. 95, 22",Trump's I.,Joellen McGann,https://farm8.staticflickr.com/7575/16266947095_e1513e563d_q.jpg,https://farm8.staticflickr.com/7575/16266947095_e1513e563d_b.jpg,https://www.flickr.com/photos/MicroPasts/16266947095,superuser,dirkspart2
BAI-28799,658,Short Dirk,"with trapezoidal plate,Trump's III Lisburn",,NA,Bronze Age,p0gjgrs6qb2,D,Scarborough Museum,,,Scarborough Museum,"England,Yorkshire,Flotmanby",,,,Flotmanby,,England,North Yorkshire,"Flotmanby Lane, Muston, Filey, North Yorkshire Yo14 0hx, UK",54.2011625,-0.3534262,,NA,NA,NA,267,34,,,bronze with black patina marks.,fairly smooth,5,,,,,"B.A.V. Trump, P.P.S. 1962, No. 5, p. 99, 267",,Susan Magyarody,https://farm8.staticflickr.com/7496/15644386114_ded64d2035_q.jpg,https://farm8.staticflickr.com/7496/15644386114_ded64d2035_b.jpg,https://www.flickr.com/photos/MicroPasts/15644386114,only good record,dirkspart2
BAI-29045,433,Short Dirk,,,NA,Bronze Age,p0gjgrs6qb2,D,"Museum of Archaeology and Ethnology, Cambridge,Cole Ambrose Collection,550",550 Ambrose,,MAA Cambridge,"England,Cambridgeshire,near Ely",,,fenland,Isle Of Ely,,England,Cambridgeshire,"Ely, Ely, Cambridgeshire, UK",52.4011282,0.258636044449304,,NA,NA,NA,276,19,,70.88,No patina.,Rough. Light bronze.,3.5,Width: 19mm; 12mm,,,,"Evans, Bronze Implements, Fig. 321",,Joellen McGann,https://farm8.staticflickr.com/7541/16081073567_121f3582f1_q.jpg,https://farm8.staticflickr.com/7541/16081073567_121f3582f1_b.jpg,https://www.flickr.com/photos/MicroPasts/16081073567,superuser,dirkspart2
BAI-28615,433,Short Dirk,Trapezoidal Plate,,NA,Bronze Age,p0gjgrs6qb2,D,"London Museum, A.1201",A.1201,,Museum of London,"England,Greater London,Isleworth,Sion Reach",,,,Isleworth,Hounslow,England,Greater London,"Isleworth, Greater London, UK",51.4683558,-0.3263111,,NA,NA,NA,222,12,,63.75,Light brown patina.,Slightly rough,4.5,,,"Found among the Pile-dwellings, with many other objects.",,"B.A.V. Trump, P.P.S., 1962, No.5, p. 97, 170",Trump's III Lisburn,Joellen McGann,https://farm8.staticflickr.com/7543/15428470774_79c98f893a_q.jpg,https://farm8.staticflickr.com/7543/15428470774_79c98f893a_b.jpg,https://www.flickr.com/photos/MicroPasts/15428470774,superuser,drawA10
BAI-28608,433,Short Dirk,Trapezoidal Plate,,NA,Bronze Age,p0gjgrs6qb2,D,"Private Collection,W. C. Wells Esq.,2 Maybank Avenue, Sudbury, Harrow, 21.6.20",,,Private Collection,"England,Greater London,Isleworth,Sion Reach (Thames)",,,river,Isleworth,Hounslow,England,Greater London,"Isleworth, Greater London, UK",51.4683558,-0.3263111,,NA,NA,NA,259,16,,85.05,Dark blackish bronze coloured patina.,Fairle smooth,4,,,,,"B.A.V. Trump, P.P.S., No. 5, p. 97, 183",Trump's III Lisburn,Joellen McGann,https://farm8.staticflickr.com/7475/16050060202_5ddd2005b2_q.jpg,https://farm8.staticflickr.com/7475/16050060202_5ddd2005b2_b.jpg,https://www.flickr.com/photos/MicroPasts/16050060202,superuser,drawA10
BAI-30201,727,Short Dirk,"Trump's III Barnes, with trapezoidal plate",,NA,Bronze Age,p0gjgrs6qb2,B,British Museum  WG.  1702,WG.1702,H_WG-1702,British Museum,"England, Greater London, Thame,s Isleworth, Sion Reach",,,,Isleworth,Hounslow,England,Greater London,"Isleworth, Greater London, UK",51.4683558,-0.3263111,"TQ, 16, 75",NA,NA,NA,250,See descripton,,149.08,a few light green patches with black stains,"dull bronze, rough",5,"Lower left corner: ""OK (rivets)""",,,"Width as: ""blade 22, hilt plate 54"",  Point broken.  Edges grooved.  Slight central ridge.  Two rivets","B.A.V. Trump. P.P.S.1962 No. 5, p.  96 No 164",--,Marla Walcott,https://farm8.staticflickr.com/7396/16441735165_a18fd28831_q.jpg,https://farm8.staticflickr.com/7396/16441735165_a18fd28831_b.jpg,https://www.flickr.com/photos/MicroPasts/16441735165,most detailed record,singleA18
BAI-30200,727,Short Dirk,"Trump's I, with trapezoidal plate",,NA,Bronze Age,p0gjgrs6qb2,B,"British Museum , 1904, 4, 19, 1","1904,4-19,1",,British Museum,"England, Greater London, Isleworth, in Thames",,,river,Isleworth,Hounslow,England,Greater London,"Isleworth, Greater London, UK",51.4683558,-0.3263111,"TQ, 16, 75",NA,NA,NA,279,See description,,124.97,"dark Brown, showing bronze",white encrustations,5,"Lower left corner: ""OK (needs rivets)",,,"Width as: ""blade 19, hilt plate 22"",  2 Rivet holes with rivets.  Edges + top very slightly chipped.","B.A.V. Trump. P.P.S.1962 No. 5, p.  96 No 94",,Marla Walcott,https://farm9.staticflickr.com/8604/16255819617_4428c2feeb_q.jpg,https://farm9.staticflickr.com/8604/16255819617_4428c2feeb_b.jpg,https://www.flickr.com/photos/MicroPasts/16255819617,most detailed record,singleA18
BAI-28606,433,Short Dirk,Trapezoidal Plate,,NA,Bronze Age,p0gjgrs6qb2,B,"London Museum, A.10954",A.10954,,Museum of London,"England,Greater London,Richmond,Thames",,,river,Richmond,,England,Greater London,"Richmond, Richmond, Greater London, UK",51.4613531,-0.3032767,,NA,NA,NA,264,21,,136,White patina light brown metal beneath.,Encrusted.,5,,,,One rivet.,"B.A.V. Trump, P.P.S., 1962, No. 5, p. 97, 156","Trump's III Barnes,Inacc.",Joellen McGann,https://farm8.staticflickr.com/7537/15863473900_af82745e2b_q.jpg,https://farm8.staticflickr.com/7537/15863473900_af82745e2b_b.jpg,https://www.flickr.com/photos/MicroPasts/15863473900,superuser,drawA10
BAI-30198,727,Short Dirk,,,NA,Bronze Age,p0gjgrs6qb2,D,"British Museum , 54,1, 18, 1","1854,1-18,1",,British Museum,"England, Greater London (Surrey), in Thames, near Richmond",,,river,Richmond,,England,Greater London,"Richmond, Richmond, Greater London, UK",51.4613531,-0.3032767,TQ 17 74,NA,NA,NA,223,See description,,56.7,-,"Bronze with dark brown stains, rather rough",3,"Lower left corner: ""Inacc. drawing""",,,"Width as: ""late 19, hilt plate 28""",,,Marla Walcott,https://farm9.staticflickr.com/8662/16255819387_bcf600b6b0_q.jpg,https://farm9.staticflickr.com/8662/16255819387_bcf600b6b0_b.jpg,https://www.flickr.com/photos/MicroPasts/16255819387,most detailed record,singleA18
BAI-28525,433,Short Dirk,,,NA,Bronze Age,p0gjgrs6qb2,D,"Alnwick Castle, No. 240",240,,Alnwick Castle,"England,Lincolnshire,South Kyme,Beneath a Bank,1820.",,,,South Kyme,,England,Lincolnshire,"South Kyme, Lincoln, Lincolnshire Ln4, UK",53.0315636,-0.2513272,,NA,NA,1820,267,14,,64.5,Bronze,Smooth,4,,,Found with Dirk no. 241.,,"B.A.V. Trump, 1962, No. 5, p. 96, 86",Trump's III Lisburn,Joellen McGann,https://farm9.staticflickr.com/8610/15864703149_7f413cc631_q.jpg,https://farm9.staticflickr.com/8610/15864703149_7f413cc631_b.jpg,https://www.flickr.com/photos/MicroPasts/15864703149,superuser,drawA10
BAI-28524,433,Short Dirk,Trapezoidal Plate,,NA,Bronze Age,p0gjgrs6qb2,C,"Alnwick Castle, No. 241,From Rev. R. Yerburgh's Collection.",241,,Alnwick Castle,"England,Lincolnshire,South Kyme,Beneath a bank.,1820",,,,South Kyme,,England,Lincolnshire,"South Kyme, Lincoln, Lincolnshire Ln4, UK",53.0315636,-0.2513272,,NA,NA,1820,188,18,,63.6,Bronze,Smooth,4,,,Found with Dirk 240.,,"B.A.V. Trump, P.P.S., 1962, No. 5, p. 96, 86",Trumps III Corrib.,Joellen McGann,https://farm8.staticflickr.com/7576/15864703019_7d3b75212f_q.jpg,https://farm8.staticflickr.com/7576/15864703019_7d3b75212f_b.jpg,https://www.flickr.com/photos/MicroPasts/15864703019,superuser,drawA10
BAI-28930,835,Short Dirk,,,NA,Bronze Age,p0gjgrs6qb2,D,"Collection of the Thames Conservancy, Reading Museum.",,,Reading Museum,"England, Surrey, Sunbury, Sunbury Lock Island., before February1933.",,,river,Sunbury-on-thames,,England,Surrey,,51.419187,-0.419155,,NA,NA,NA,244.5,20.5,,145,Black patina,,,"The site description appears to have ""Middlesex"" written before being crossed out and replaced with ""Surrey"". The word ""Thames"" also appears to have been written and later crossed out. The width measurement given is that of the blade.",Good condition,,,,,Nyree Powell,https://farm9.staticflickr.com/8604/16265065101_23c443bd24_q.jpg,https://farm9.staticflickr.com/8604/16265065101_23c443bd24_b.jpg,https://www.flickr.com/photos/MicroPasts/16265065101,most detailed record,dirkspart2
BAI-30217,873,Short Dirk,Trump's I,,NA,Bronze Age,p0gjgrs6qb2,C,"British Museum ,94,12   10,53","1894,12-10.53",,British Museum,"England.,BUCKINGHAMSHIRE,,Thames at Taplow",,,river,Taplow,,England,Buckinghamshire,"Taplow, Buckinghamshire, UK",51.5447992,-0.683089434829654,SU 91 82,NA,NA,NA,230,,,88.55,no,rough.  dark brown.   Two small perforations + 3 small pits.  Edge + hilt notched.,4.5,"Collection: numbers are aligned and when read as compass NESW points are  94   10   53   12,  Width entry reads ""hilt plate 48.    blade 21"",  Thickness entry is qualified with ""blade""",2 Rivet holes,,,B.A.V. Trump. P.P.S.  1962  No.5.  p.95.   No 7,Not quite accurate.,Jane Williams,https://farm8.staticflickr.com/7323/16439963241_6707894c7e_q.jpg,https://farm8.staticflickr.com/7323/16439963241_6707894c7e_b.jpg,https://www.flickr.com/photos/MicroPasts/16439963241,most detailed record,singleA18
BAI-28436,433,Short Dirk,Trapezoidal Plate,,NA,Bronze Age,p0gjgrs6qb2,D,"July 2, 1935, Thames Conservency to go later to Reading Museum,Now in Reading Museum",,,Reading Museum,"England,Berkshire,Windsor,Dredged from R. Thames at Old Windsor below Victoria Bridge, by dredger working in 8' of water.,June-July, 1935",,,"river,dredged",Windsor,Windsor And Maidenhead,England,Windsor And Maidenhead,"Windsor, Windsor, Windsor And Maidenhead Sl4, UK",51.48375775,-0.604096404184905,,NA,6,1935,275,30,,71,"Traces of a dark 'flaky' patina down the centre, with grass-green patina round the edge. On the edges themselves, and on the mid rib near the point, are traves of tone bronze colour. There are also traces of a rust colour, and a white lumpy encrustment.",Smooth generally with 'lumps' where white encrustment occurs.,4,,,,"Metal very rough all the way round the edges. The section is nearly flat near the hilt, the mid-rib becoming more and more pronounced towards the point.","B.A.V. Trump, P.P.S. 1926, No. 5, p. 95, 6",Trump's III Lisburn,Joellen McGann,https://farm8.staticflickr.com/7533/16024965676_8bd48e6f78_q.jpg,https://farm8.staticflickr.com/7533/16024965676_8bd48e6f78_b.jpg,https://www.flickr.com/photos/MicroPasts/16024965676,superuser,drawA10
BAI-30140,580,Short Dirk,,,NA,Bronze Age,p0gjgrs6qb2,D,"Trump's II Lisburn, British Museum 56 7 1 1360, purchased 1856, Roach Smith Collection","1856,7-1,1360",,British Museum,"England, R. Thames, No provenance",,,river,,,England,Greater London,,51.4123,-0.3007,,NA,NA,NA,268,hilt plate 27; blade 17,,,"dark brown, green patch on face. Upper part of reverse, bronze with black patches & lower half green.",,blade 4,,,,,"B.A.V. Trump, P.P.S. 1962, No. 5, p. 97, 187","Inacc. drawing, CI",Denis Antoine,https://farm9.staticflickr.com/8617/16439959631_f5a9db5c1f_q.jpg,https://farm9.staticflickr.com/8617/16439959631_f5a9db5c1f_b.jpg,https://www.flickr.com/photos/MicroPasts/16439959631,superuser,singleA18
BAI-28977,727,Short Dirk,,,NA,Bronze Age,p0gjgrs6qb2,D,"Manx Museum, Douglas, Isle of Man",,,Manx Museum,"Isle of Man, Braddan Parish, Douglas, found in pulling down the old post office, Athol Street, 1894",,,,,,Isle of Man,Isle of Man,Isle Of Man,54.1936805,-4.5591148,,NA,NA,NA,230,46.5,,99.2,,,5,,Bronze,,"Weight as: ""3 1/2 oz."", Copper        88.90%,  Tin     10.60,  Lead   trace,  Iron     trace,  Zink    0.25,  Sulfur  0.15,  Total =        99.90","List of Manx Antiquities, 1900, p. 18 (reprinted from Un Lioar Manninagh, Vol. III, pp. 153-193) described as “Sword”., Manx Museum Catalogue, Pt. I (prehistoric), 1924, p. 17, № 56.-1, Postcard of Bronze Implements.",,Marla Walcott,https://farm9.staticflickr.com/8635/16079537890_5d6d3a4b1f_q.jpg,https://farm9.staticflickr.com/8635/16079537890_5d6d3a4b1f_b.jpg,https://www.flickr.com/photos/MicroPasts/16079537890,most detailed record,dirkspart2
BAI-5940,433,Looped palstave,,,NA,Bronze Age,p0gjgrs6qb2,II1C,"British Museum,W.G. 1843",WG.1843,H_WG-1843,British Museum,"England, northumberland,acton and old felton,acton,1886",,,,Acton And Old Felton,,England,Northumberland,"Acton, Northumberland",55.3155449,-1.710704,,NA,NA,1886,173,26,51,535,Dark green,Corroded and pitted in places.,12,"Width: edge 51mm; middle 26mm; butt 26mm,Thickness: 12mm; 34mm,Weight: 534.81 gms",,,"Sides notched, rough from casting.",,Rather inaccurate.,Joellen McGann,https://farm8.staticflickr.com/7405/12675752743_eb492edc8b_q.jpg,https://farm8.staticflickr.com/7405/12675752743_eb492edc8b_b.jpg,http://www.flickr.com/photos/MicroPasts/12675752743,superuser,drawA9
BAI-5226,433,Looped palstave,,,NA,Bronze Age,p0gjgrs6qb2,IV1A,Doncaster Museum,,,Doncaster Museum,"England, south yorkshire,adwick-le-street (near),found in agricultural operations on dane's hill",,,hillside,Adwick-le-street,,England,South Yorkshire,"Adwick-le-street, Yorkshire",53.5720808,-1.1800228,,NA,NA,NA,168,41,45,482,,Brown where not rubbed.,36,"Length: 167.5mm; Width: edge 45mm; middle to loop 41mm; butt 24.5mm,Thickness: 36mm; 11mm",Bronze,,"Looped, condition good, but socket chipped.",,,Joellen McGann,https://farm8.staticflickr.com/7347/12674422924_872488a37c_q.jpg,https://farm8.staticflickr.com/7347/12674422924_872488a37c_b.jpg,http://www.flickr.com/photos/MicroPasts/12674422924,superuser,drawA9
BAI-44165,580,Looped Palstave,,,NA,Bronze Age,p0gjgrs6qb2,I 1 T,Warwick Museum,,,Warwick Museum,"Ireland,Kildare or King's Co.,Bog of Allan",,,bog,Allan,,Ireland,County Kildare,"Bog Of Allen, Co. Kildare, Ireland",53.27878485,-6.9422986046361,,NA,NA,NA,142,at edge 60,,355,Bronze color,smooth,,,Bronze,,,,One of eight presented by Dr. Lloyd,Denis Antoine,https://farm1.staticflickr.com/343/19728327823_32a05c3de6_q.jpg,https://farm1.staticflickr.com/343/19728327823_32a05c3de6_b.jpg,https://www.flickr.com/photos/115096994@N02/19728327823,superuser,IrishPalstavesPt1
