objectID,userID,objectType,classification,completeness,quantity,broadperiod,periodo,rightCorner,collection,museumID,collectionIdentifier,museumCollection,site,stolenStatus,hoard,discoveryContext,parish,district,country,county,toSearch,fourFigureLat,fourFigureLon,gridRef,dateDiscoveryDay,dateDiscoveryMonth,dateDiscoveryYear,length,width,edge,weight,patina,surface,thickness,other,composition,associations,description,publications,remarks,inputBy,thumbnail,imageURL,flickrURL,Processing,project
BAI-11087,543,Flanged Axe,,,NA,Bronze Age,p0gjgrs6qb2,,"Bucks. County Museum, Aylesbury,presented by Mr. A. E. Taplin of High Wycombe (1930),139.36",139.36,,Bucks County Museum,"England,Bucks.,High Wycombe,Hazlemere,in a ditch in a brick field, 1913",,,,Hazlemere,,England,Buckinghamshire,,51.651048,-0.710832,,NA,NA,1913,100,butt 16 *see transcribers comments below,51,158.76,perished,badly pitted,"centre 10,flange 12","Georef not working for me. Width of butt on diagram appears to be 26, rather than 16 as shown on front of card. Weight is given in grains, I have converted to grams. Bottom left of card says ""inacc.""",,,,"Records of Bucks. XI. 349, Pl. I.",See new index,Jane Fellows,https://farm4.staticflickr.com/3878/14975724751_01122b6f44_q.jpg,https://farm4.staticflickr.com/3878/14975724751_01122b6f44_b.jpg,https://www.flickr.com/photos/MicroPasts/14975724751,most detailed record,flangedAxesA1
BAI-11088,541,Flanged Axe,,,NA,Bronze Age,p0gjgrs6qb2,,139.36,,,Aylesbury Museum,"Bucks,High Wycombe,Hazlemere,""in a ditch in a brick-field""",,,,Hazlemere,,England,Buckinghamshire,"Hazlemere, Buckinghamshire, UK",51.6514325,-0.71033658254537,,NA,NA,1913,100,51,,,,badly pitted,,This appears to be a copy of the previous card,,,,"Records of Bucks, XI. 349, Pl.I",ND 74,Tim Mudie,https://farm6.staticflickr.com/5575/14792213278_1a509a38cb_q.jpg,https://farm6.staticflickr.com/5575/14792213278_1a509a38cb_b.jpg,https://www.flickr.com/photos/MicroPasts/14792213278,most detailed record,flangedAxesA1
BAI-11175,433,Flanged Axe,,,NA,Bronze Age,p0gjgrs6qb2,I1A,"The late Col. O. H. North DSO,Clifford Hall,Yealand Conyers,Nr. Carnforth, Lancs.,Now in Mrs. North's possession (Jan 1962). Following Mrs. North's death, in possession of Lt. Col. Brian North, same address.",,,Private Collection,"England,Cumbria (Westmoreland),Holmepark Quarries,Holme,Found in the debris after blasting.,27 June 1935",,,quarry,Holmepark,,England,Cumbria,"Holme Park Quarry, Burton-in-kendal, Carnforth, Cumbria La6 1nz, UK",54.203145,-2.717897,,27,6,1935,130,,83,340,,,,"Length: 5 1/10 ins. = 129.54mm,Width: Across cutting edge 3 1/4 ins. = 82.55mm,Weight: 12 oz. = 340.194 gms",,Found in peaty soil which had come down from the topsoil overlying the limstone rock.,This axe is in good condition with very slight damage to the cutting edge. Low stop-ridge. Wide and convex cutting edge.,"See Trans. Cumb. and West. Ant. and Arch. Soc. (N.S.), XXXVI.142.Fig.1 (This is a good photograph).,(Wringly shown in the title as being in Tulke House Museum, whereas they remained in Col. North's possession.)","Compiler: Clare C. Fell 16.1.62. I have not been again to see this axe which I saw shortly after Coloner North died, so cannot give the thickness.",Joellen McGann,https://farm6.staticflickr.com/5570/14792202788_69a1003a25_q.jpg,https://farm6.staticflickr.com/5570/14792202788_69a1003a25_b.jpg,https://www.flickr.com/photos/MicroPasts/14792202788,superuser,flangedAxesA1
BAI-11347,433,Flanged Axe,,,NA,Bronze Age,p0gjgrs6qb2,,Hull Museum,,,Hull Municipal Museum,"England,Hampshire,Hook",,,,Hook,,England,Hampshire,"Hook, Hook, Hampshire, UK",51.2798793,-0.9614163,,NA,NA,NA,123,22,65,283,Remains of dark olive green patina on one side where blade is hammered and towards the edge and near stop.,"Much pocked all over, although fairly smooth.",17,"Width: edge 65mm; near stop 22.5mm; butt 21.5mm,Thickness: 17mm; 10mm; 18.75mm; 12.25mm",,,,,"Label (torn) reads: Nr. Temple, Hook, near Basingstoke",Joellen McGann,https://farm4.staticflickr.com/3866/14793170389_4635fb8a2e_q.jpg,https://farm4.staticflickr.com/3866/14793170389_4635fb8a2e_b.jpg,https://www.flickr.com/photos/MicroPasts/14793170389,superuser,flangedAxesA1
BAI-11282,433,Flanged Axe,,,NA,Bronze Age,p0gjgrs6qb2,,"Hull,Formerly Private Collection, the late Rev. Canon Millard, D.D.,at Sotheby's 24.v.21, Lot 177",,,Hull Municipal Museum,"England,Hampshire,Hook",,,auction,Hook,,England,Hampshire,"Hook, Hook, Hampshire, UK",51.2798793,-0.9614163,,NA,NA,NA,123,22,65,283,Remains of dark green patina on one side where blade is hammered and towards the edge and near stop.,"Much pocked all over, although fairly smooth.",17,"Width: edge 65mm; near stop 22.5mm; butt 21.5mm,Thickness: 17mm; 10mm; 18 3/4mm; 12.25mm",,,,,"Label (torn) reads, Nr. Temple, Hook, near Basingstoke",Joellen McGann,https://farm6.staticflickr.com/5592/14792283058_762e5251f8_q.jpg,https://farm6.staticflickr.com/5592/14792283058_762e5251f8_b.jpg,https://www.flickr.com/photos/MicroPasts/14792283058,superuser,flangedAxesA1
BAI-11389,433,flanged Axe,Haft,,NA,Bronze Age,p0gjgrs6qb2,,"British Museum, WG 1880",WG.1880,H_WG-1880,British Museum,"England,Humberside (Yorkshire),Hotham",,,,Hotham,,England,Humberside,"Hotham, York, East Riding Of Yorkshire Yo43, UK",53.7963086,-0.6434871,SE 89 34,NA,NA,NA,127,26,48,308,Yellowish brown,Pitted,19,Width: butt 26mm; blade 48mm,Bronze,,"Slight stop ridges. Strong side flanges which are battered. End of butt bent over, one point of blade broken.",,"AOK,Does not belong to hoard.",Joellen McGann,https://farm6.staticflickr.com/5557/14976750721_b6e259a120_q.jpg,https://farm6.staticflickr.com/5557/14976750721_b6e259a120_b.jpg,https://www.flickr.com/photos/MicroPasts/14976750721,superuser,flangedAxesA1
BAI-11262,433,Flanged Axe,,,NA,Bronze Age,p0gjgrs6qb2,,"London, British Museum,W.G. 1730",WG.1730,H_WG-1730,British Museum,"England,Greater London,River Thames,Hammersmith,Hurlingham",,,river,Hurlingham,Hurlingham,England,Greater London,"Hurlingham Gardens, Hammersmith, London Sw6, UK",51.4681684,-0.2066467,TQ 24 76,NA,NA,NA,144,63,,,,Dull black patina; one wing broken off in antiquity; butt slightly damaged.,,,,,Herringbone hammered decoration on flange and blade ribs.,,MJR,Joellen McGann,https://farm4.staticflickr.com/3882/14955903916_26045c7b0e_q.jpg,https://farm4.staticflickr.com/3882/14955903916_26045c7b0e_b.jpg,https://www.flickr.com/photos/MicroPasts/14955903916,superuser,flangedAxesA1
BAI-11390,433,flanged Axe,Haft,,NA,Bronze Age,p0gjgrs6qb2,,"British Museum, WG 1832",WG.1832,H_WG-1832,British Museum,"England,Humberside,Hutton Cranswick,Cranswick Common",,,,Hutton Cranswick,,England,Humberside,"Hutton Cranswick, Driffield, East Riding Of Yorkshire Yo25, UK",53.9607355,-0.4402974,,NA,NA,NA,135,26,50,297,Golden,Smooth,32,Width: butt 26mm; blade 50mm,Bronze,,Fine patina. Strong broad side flanges. Well preserved.,,Too narrow.,Joellen McGann,https://farm4.staticflickr.com/3901/14979500892_1c2b9dd465_q.jpg,https://farm4.staticflickr.com/3901/14979500892_1c2b9dd465_b.jpg,https://www.flickr.com/photos/MicroPasts/14979500892,superuser,flangedAxesA1
BAI-11612,433,Flanged Axe,,,NA,Bronze Age,p0gjgrs6qb2,,"Ashmolean Museum, Oxford,1927.2374, Evans Collection",1927.2375,,Ashmolean Museum,"England,Suffolk,Icklingham,Canada Farm,1878",,,farm,Icklingham,,England,Suffolk,"Icklingham, Bury Saint Edmunds, Suffolk Ip28, UK",52.3240846,0.6040697,,NA,NA,1878,72,19,33,78,Fine blue-green patina.,,13,"Width: edge 33mm; butt 19mm,Weight: 78.37 gms",,,"Flanged, with stop ridge.",Not in ABI.,,Joellen McGann,https://farm4.staticflickr.com/3922/14980054922_aedd304a36_q.jpg,https://farm4.staticflickr.com/3922/14980054922_aedd304a36_b.jpg,https://www.flickr.com/photos/MicroPasts/14980054922,superuser,flangedAxesA1
BAI-11613,433,Flanged Axe,,,NA,Bronze Age,p0gjgrs6qb2,,"Museum of Archaeology, Cambridge,Baron A. von Hugel,89",89,,MAA Cambridge,"England,Suffolk,Icklingham (near),between Cavenham and Ickingham,1897",,,,Icklingham,,England,Suffolk,"Icklingham, Bury Saint Edmunds, Suffolk Ip28, UK",52.3240846,0.6040697,,NA,NA,1897,100,18,50,177,"Brown patina and metal showing through, one patch of bright green on blade.",Smooth,15,Width: edge 50mm; butt 17.5mm,,,Slight flanges.,,,Joellen McGann,https://farm4.staticflickr.com/3902/14980398145_605f90c9e2_q.jpg,https://farm4.staticflickr.com/3902/14980398145_605f90c9e2_b.jpg,https://www.flickr.com/photos/MicroPasts/14980398145,superuser,flangedAxesA1
BAI-11111,433,Flanged Axe,Decorated,,NA,Bronze Age,p0gjgrs6qb2,,"Alnwick Castle, No. 198",198,,Alnwick Castle,"England,Cambridgeshire,Ely,Grunty Fen",,,,Isle Of Ely,,England,Cambridgeshire,"Grunty Fen Catchwater, Cambridgeshire, UK",52.3681284,0.229611,,NA,NA,NA,161,22,84,378,"Bronze patina, grrn in pits.","Smooth, pitted slightly",21,"Width: edge 84mm; centre 26mm; butt 22mm,Thickness: centre 21mm; butt 11mm,Weight: 378.4 gms",,With celt 197.,,,,Joellen McGann,https://farm4.staticflickr.com/3860/14792142630_af3bf7bb3c_q.jpg,https://farm4.staticflickr.com/3860/14792142630_af3bf7bb3c_b.jpg,https://www.flickr.com/photos/MicroPasts/14792142630,superuser,flangedAxesA1
BAI-11107,433,Flanged Axe,"Bent,Haft-flanged Axe' in PPS 1959",,NA,Bronze Age,p0gjgrs6qb2,,"Museum of Archaeology and Ethnology, Cambridge,Cole Ambrose Collection",,,MAA Cambridge,"England,Cambridgeshire,Ely,Middle Fen, Stuntney",,,fenland,Isle Of Ely,,England,Cambridgeshire,"Stuntney, Cambridgeshire, UK",52.3781389,0.2822489,,NA,NA,NA,164,22,62,461,Dark brown matt,Smooth,26,"Width: edge 62mm; middle 26mm; butt 22mm,Thickness: 26mm; 8.5mm; 27.5mm; 14.5mm,Weight: 460.68 gms",,,,,,Joellen McGann,https://farm4.staticflickr.com/3865/14978806095_2088c7bf69_q.jpg,https://farm4.staticflickr.com/3865/14978806095_2088c7bf69_b.jpg,https://www.flickr.com/photos/MicroPasts/14978806095,superuser,flangedAxesA1
BAI-11108,433,Flanged Axe,Decorated,,NA,Bronze Age,p0gjgrs6qb2,,"Museum of Archaeology and Ethnology, Cambridge,535,Cole Ambrose Collection",535  Ambrose,,MAA Cambridge,"England,Cambridgeshire,near Ely,Fens",,,fenland,Isle Of Ely,,England,Cambridgeshire,"Ely, Ely, Cambridgeshire, UK",52.4011282,0.258636044449304,,NA,NA,NA,138,23,74,376,Matte patina dark brown,Smooth,19,"Length: 137.5mm,Width: edge 73.5mm; middle 29mm; butt 23mm,Thickness: 19mm; 11.5mm,Weight: 375.63 gms",,,,,,Joellen McGann,https://farm4.staticflickr.com/3919/14792211488_8e08702f34_q.jpg,https://farm4.staticflickr.com/3919/14792211488_8e08702f34_b.jpg,https://www.flickr.com/photos/MicroPasts/14792211488,superuser,flangedAxesA1
BAI-11105,433,flanged Axe,Haft,,NA,Bronze Age,p0gjgrs6qb2,,"C.A. Bradford Esq., FSA,Hemel Hempstead",,,Private Collection,"England,Cambridgeshire,near Ely,1907",,,,Isle Of Ely,,England,Cambridgeshire,"Ely, Ely, Cambridgeshire, UK",52.4011282,0.258636044449304,,NA,NA,1907,130,23,59,369,,"Smooth. Bronze colour, mostly golden with black stains and very tiny pittings all over.",13,"Width: edge 59mm; centre 26.5mm; butt 23mm,Thickness: 13mm; 25mm,Weight: 368.55 gms",Bronze,,Splendidly preserved with a good edge.,,,Joellen McGann,https://farm6.staticflickr.com/5558/14978806235_3c4df76f63_q.jpg,https://farm6.staticflickr.com/5558/14978806235_3c4df76f63_b.jpg,https://www.flickr.com/photos/MicroPasts/14978806235,superuser,flangedAxesA1
BAI-11253,433,Flanged Axe,"Haft-Flanged Axe"" in PPS 1959",,NA,Bronze Age,p0gjgrs6qb2,,"British Museum,WG 1731",WG.1731,H_WG-1731,British Museum,"England,Greater London,Thames,Isleworth",,,river,Isleworth,Hounslow,England,Greater London,"42 Byfield Road, Isleworth, Greater London Tw7 7af, UK",51.4675788,-0.3271493,TQ 16 75,NA,NA,NA,179,25,78,611,Brown,Smooth,27,Width: butt 25mm; blade 78mm,Bronze,,Strong side and stop ridges. End of butt and edge of blade broken. Slight horizontal rib on sides.,,"Inacc.,New drawing available.",Joellen McGann,https://farm6.staticflickr.com/5565/14978541222_596b6ab705_q.jpg,https://farm6.staticflickr.com/5565/14978541222_596b6ab705_b.jpg,https://www.flickr.com/photos/MicroPasts/14978541222,superuser,flangedAxesA1
BAI-11318,433,Flanged Axe,"Bent,Haft-flanged Axe' in PPS 1959",,NA,Bronze Age,p0gjgrs6qb2,,"British Museum, WG 1731",WG.1731,H_WG-1731,British Museum,"England,Greater London,Thames,Isleworth",,,river,Isleworth,Hounslow,England,Greater London,"Isleworth, Greater London, UK",51.4683558,-0.3263111,TQ 16 75,NA,NA,NA,179,25,78,611,Brown,Smooth,27,Width: butt 25mm; blade 78mm,Bronze,,Strong side and stop ridges. End of butt and edge of blade broken. Slight horizontal rib on sides.,,"Inacc.,New drawing available.",Joellen McGann,https://farm4.staticflickr.com/3857/14793180650_d993ff3e2c_q.jpg,https://farm4.staticflickr.com/3857/14793180650_d993ff3e2c_b.jpg,https://www.flickr.com/photos/MicroPasts/14793180650,superuser,flangedAxesA1
BAI-11319,433,Flanged Axe,,,NA,Bronze Age,p0gjgrs6qb2,,"In the possession of V. R. Pryer, Esq. 89 Petts Hill, Northolt, Middlesex,23/10/72",,,Private Collection,"England,Greater London,Found with metal detector at Isleworth,6"" down in the River bank (Thames)",,,"river, metal detector",Isleworth,Hounslow,England,Greater London,"Isleworth, Greater London, UK",51.4683558,-0.3263111,,NA,NA,NA,129,78,,,,,,,,,,,,Joellen McGann,https://farm4.staticflickr.com/3836/14793301727_9a662ce7fc_q.jpg,https://farm4.staticflickr.com/3836/14793301727_9a662ce7fc_b.jpg,https://www.flickr.com/photos/MicroPasts/14793301727,superuser,flangedAxesA1
BAI-11254,433,Flanged Axe,,,NA,Bronze Age,p0gjgrs6qb2,,"In the possession of: V. R. Pryer, Esq.,89 Petts Hill,Northolt,Middlesex,23/10/72",,,Private Collection,"England,Greater London,Isleworth,Found with metal detector at Isleworth,6"" down in the river bank,(Thames)",,,"river, metal detector",Isleworth,Hounslow,England,Greater London,"Isleworth, Greater London, UK",51.4683558,-0.3263111,,NA,NA,NA,129,78,,,,,,,,,,,,Joellen McGann,https://farm6.staticflickr.com/5591/14975796851_1b7dd396ae_q.jpg,https://farm6.staticflickr.com/5591/14975796851_1b7dd396ae_b.jpg,https://www.flickr.com/photos/MicroPasts/14975796851,superuser,flangedAxesA1
BAI-11804,433,Flanged Axe,,,NA,Bronze Age,p0gjgrs6qb2,,Keighley Museum,,,Keighley Museum,"England,West Yorkshire,Keighley",,,,Keighley,,England,West Yorkshire,"Keighley, Keighley, West Yorkshire, UK",53.867932,-1.9013628,,NA,NA,NA,136,24,71,,,"Worn green, black on other face, gold where rubbed",,Width: 24mm butt; 71mm edge,,,,,CB,Joellen McGann,https://farm4.staticflickr.com/3860/14793687719_c28d61da6d_q.jpg,https://farm4.staticflickr.com/3860/14793687719_c28d61da6d_b.jpg,https://www.flickr.com/photos/MicroPasts/14793687719,superuser,flangedAxesA1
BAI-11747,433,Flanged Axe,,,NA,Bronze Age,p0gjgrs6qb2,,"Keighley Museum,From the collection of the late Mr. Rosse Butterfield",,,Keighley Museum,"England,Yorkshire?,Keighley?",,,,Keighley,,England,West Yorkshire,"Keighley, Keighley, West Yorkshire, UK",53.867932,-1.9013628,,NA,NA,NA,135,70,,227,Slight.,"Smooth, well cast, with slight damage to blade.",8,"Length: 5 5/16"" = 134.9375mm,Width: 2 3/4"" = 69.85mm,Thickness: 3/10"" = 7.62mm,Weight: 8 oz. = 226.796 gms",Bronze,,,Nil.,"Thic axe was not registered, but bears an old label with the cryptic information ""Keighley (?)"". J. Ogden, Curator.",Joellen McGann,https://farm6.staticflickr.com/5583/14793824277_074909c9c9_q.jpg,https://farm6.staticflickr.com/5583/14793824277_074909c9c9_b.jpg,https://www.flickr.com/photos/MicroPasts/14793824277,superuser,flangedAxesA1
BAI-11748,433,Flanged Axe,,,NA,Bronze Age,p0gjgrs6qb2,,"Private Owner: Mr. Tom Shuttleworth, Brunthwaite, Silsden, Nr. Keighley, Yorkshire.",,,Private Collection,"England,Yorkshire,Keighley,Ghyll Grange",,,,Keighley,,England,West Yorkshire,"Keighley, Keighley, West Yorkshire, UK",53.867932,-1.9013628,,NA,NA,NA,178,104,,624,Slight,Smooth,11,"Length: 7"" = 177.8mm,Width: 4 1/10"" = 104.14mm,Thickness: 5/12"" = 10.59mm,Weight: 1lb 6 ozs = 623.69 gms",Bronze,Nil,,Nil.,"Keighley Museum has an exact replica in Bronze. J. Ogden, Curator.",Joellen McGann,https://farm6.staticflickr.com/5563/14793703460_aa7ded110e_q.jpg,https://farm6.staticflickr.com/5563/14793703460_aa7ded110e_b.jpg,https://www.flickr.com/photos/MicroPasts/14793703460,superuser,flangedAxesA1
BAI-11579,433,flanged Axe,Haft,,NA,Bronze Age,p0gjgrs6qb2,,"Smith Institute, Stirling,Cat. No. AJ1",AJ1,,"Smith Institute, Stirling","Scotland,Perthshire,Keillor Moss",,,,Keillor Moss,,Scotland,Perth And Kinross,"Keillor, Blairgowrie, Perth And Kinross Ph13, UK",56.54979215,-3.19076474096029,,NA,NA,1854,150,63,,454,Patches of green and brown.,Slightly corroded in places.,37,Weight: 1 lb. (approx) = 453.592 gms,Bronze,,Winged axe with slight stop ridge. Cutting edge sharp.,,"Label: ""Bronze celt or spear-head found in a moss near Methren, Perthshire,1854."" Presented by Alex Gibbons, Methren, Jan. 1891",Joellen McGann,https://farm4.staticflickr.com/3836/14980057742_a3fd9ac81a_q.jpg,https://farm4.staticflickr.com/3836/14980057742_a3fd9ac81a_b.jpg,https://www.flickr.com/photos/MicroPasts/14980057742,superuser,flangedAxesA1
BAI-11508,433,Flanged Axe,,,NA,Bronze Age,p0gjgrs6qb2,,"Provate (1991) - Womack, A.J. Mr.",,,Private Collection,"England,Norfolk,Keswick,Probably metal-detected by Mr. Womack",,,metal detector,Keswick,,England,Norfolk,"Keswick, Norwich, Norfolk Nr4, UK",54.6009281,-3.137609,TG 2119 0452,NA,NA,NA,166,,89,,,,,,,?,"Dimensions: L166mm; Blade widge 89mm; Flange height 0.75mm,Typology: Flat axe, with very slight flanges, slight stop bevel, sides diverge below stop to crescentic blade. Irregular herringbone pattern on sides, and on axe face below stop. Poss. grove doc at blade bevel - difficult to tell from drawing.,Condition: complete.",,,Joellen McGann,https://farm4.staticflickr.com/3886/14793856407_5e77840c51_q.jpg,https://farm4.staticflickr.com/3886/14793856407_5e77840c51_b.jpg,https://www.flickr.com/photos/MicroPasts/14793856407,superuser,flangedAxesA1
BAI-11321,433,flanged Axe,Haft,,NA,Bronze Age,p0gjgrs6qb2,,British Museum WG 1732,WG.1732,H_WG-1732,British Museum,"England,Greater London,R. Thames,Kew",,,river,Kew,,England,Greater London,"Kew, Richmond, Richmond, Greater London Tw9, UK",51.479449,-0.287773,TQ 19 77,NA,NA,NA,175,27,89,559,Light brown,Rough,27,Width: butt 27mm; blade 89mm,Bronze,,Strong side ridges. Slight stop ridges. Looped rib with centre rib below stop ridges. Horizontal rib on sides.,,"Too narrow.,New drawing available.",Joellen McGann,https://farm6.staticflickr.com/5591/14793301497_2ed8bc64a1_q.jpg,https://farm6.staticflickr.com/5591/14793301497_2ed8bc64a1_b.jpg,https://www.flickr.com/photos/MicroPasts/14793301497,superuser,flangedAxesA1
BAI-11256,433,Flanged Axe,,,NA,Bronze Age,p0gjgrs6qb2,,"British Museum,WG 1732",WG.1732,H_WG-1732,British Museum,"England,Greater London,River Thames,Kew",,,river,Kew,,England,Greater London,"Kew, Richmond, Richmond, Greater London Tw9, UK",51.479449,-0.287773,TQ 19 77,NA,NA,NA,175,27,89,559,Light brown,Rough,27,Width: butt 27mm; blade 89mm,Bronze,,Strong side ridges. Slight stop ridges. Looped rib with entire rib below stop ridges. Horizontal rib on sides.,,"Too narrow.,New drawing available.",Joellen McGann,https://farm6.staticflickr.com/5588/14792336017_b0567b18fe_q.jpg,https://farm6.staticflickr.com/5588/14792336017_b0567b18fe_b.jpg,https://www.flickr.com/photos/MicroPasts/14792336017,superuser,flangedAxesA1
BAI-11750,433,flanged Axe,Haft,,NA,Bronze Age,p0gjgrs6qb2,,Hull Municipal Museums,,,Hull Municipal Museum,"England,Yorkshire E.R.,Kilnwick,Found in fields of and by employees of the owner from whom Hull Mus. got it (1940).",,,farm,Kilnwick,,England,East Riding of Yorkshire,"Kilnwick, Driffield, East Riding Of Yorkshire Yo25, UK",53.9328707,-0.4784055,,NA,NA,NA,,,,,"Partion only green, + all smooth and good.","Good condition, clean, sharp.",,,,None,,"To be published in Hull Museum Br. Imlt. Cat. (1941?), q.v. for details.","See on the Tollingham Farm, Holme-on-Spalding moor example? Similar. ER Yorks. also. One cut in one wing.,Yes",Joellen McGann,https://farm4.staticflickr.com/3893/14980376305_a34714dc64_q.jpg,https://farm4.staticflickr.com/3893/14980376305_a34714dc64_b.jpg,https://www.flickr.com/photos/MicroPasts/14980376305,superuser,flangedAxesA1
BAI-11553,433,Flanged Axe,,,NA,Bronze Age,p0gjgrs6qb2,,"York Museum, 1110/1948",1110/1948,,York Museum,"England,North Yorkshire (Yorks ER),Kirby Grindalythe,Duggleby",,,,Kirby Grindalythe,,England,North Yorkshire,"Duggleby, Malton, North Yorkshire Yo17, UK",54.0915634,-0.6599539,,NA,NA,NA,102,21,52,,,Fine dull gold,,Width: butt 21mm; edge 52mm,,,,,CB,Joellen McGann,https://farm4.staticflickr.com/3912/14980403745_7c249ff3c5_q.jpg,https://farm4.staticflickr.com/3912/14980403745_7c249ff3c5_b.jpg,https://www.flickr.com/photos/MicroPasts/14980403745,superuser,flangedAxesA1
BAI-11751,433,Flanged Axe,"Bent,Haft-flanged Axe' in PPS 1959",,NA,Bronze Age,p0gjgrs6qb2,,Scarborough Museum,,,Scarborough Museum,"England,Yorkshire,Kirby Wiske,12 Jan. 1831",,,,Kirby Wiske,,England,North Yorkshire,"Kirby Wiske, Thirsk, North Yorkshire Yo7, UK",54.25847875,-1.43985462953911,,12,1,1831,130,26,61,,"Green where corroded elsewhere black, edge yellowish",Corroded and pitted.,,"Length: 129.5mm,Width: centre 26mm; edge 61mm",,,,,,Joellen McGann,https://farm4.staticflickr.com/3848/14793823547_988d3b82ed_q.jpg,https://farm4.staticflickr.com/3848/14793823547_988d3b82ed_b.jpg,https://www.flickr.com/photos/MicroPasts/14793823547,superuser,flangedAxesA1
BAI-11618,433,Flanged Axe,,,NA,Bronze Age,p0gjgrs6qb2,,"Ipswich Museum, 1920 55-4",1920 55-4,,Ipswich Museum,"Suffolk,Lakenheath,Undley Common",,,,Lakenheath,,England,Suffolk,"Undley, Lakenheath, Brandon, Suffolk Ip27, UK",52.405172,0.505589,,NA,NA,NA,173,72,,,,"Matt black, undamaged.",,,,,,,MJR,Joellen McGann,https://farm4.staticflickr.com/3842/14977306981_3a6649b233_q.jpg,https://farm4.staticflickr.com/3842/14977306981_3a6649b233_b.jpg,https://www.flickr.com/photos/MicroPasts/14977306981,superuser,flangedAxesA1
BAI-63193,433,Flanged Axe,,,NA,Bronze Age,p0gjgrs6qb2,,"British Museum, W.G. 1549",WG.1549,H_WG-1549,British Museum,"Ireland,Longford,Lanesborough",,,,Lanesborough,,Ireland,,"Lanesborough, Co. Longford, Ireland",53.6728533,-7.9895762,,NA,NA,NA,140,middle 30; butt 30,81,520.63,"Dark brown, golden bronze showing through.",Lightly pitted,29; 12,,,,Edge much worn. Top of butt widened. Ornament beneath stop is filled with short punched lines.,,,Joellen McGann,https://farm8.staticflickr.com/7574/28187723001_29bd52695d_q.jpg,https://farm8.staticflickr.com/7574/28187723001_29bd52695d_b.jpg,https://www.flickr.com/photos/115096994@N02/28187723001,superuser,IrishAxesB5
BAI-11707,433,Flanged Axe,,Fragment,NA,Bronze Age,p0gjgrs6qb2,,"Salisbury Museum,152/46",152/46,,Salisbury Museum,"England,Wiltshire,Laverstock Down,Picked up in a barrow (probably No.1) by Mr. William Shepherd",,,barrow,Laverstock Down,,England,Wiltshire,"Laverstock, Salisbury, Wiltshire, UK",51.08003275,-1.76838159276851,,NA,NA,NA,,,,,"Grey, smooth and slightly pitted one side.",,,,,,"Half a bronze celt, widely splayed blade. Slight flanges.","Arch. Journ. CIV (1948), 24, fig. 23",F. de Mallet Morgan,Joellen McGann,https://farm4.staticflickr.com/3872/14980039502_829a435041_q.jpg,https://farm4.staticflickr.com/3872/14980039502_829a435041_b.jpg,https://www.flickr.com/photos/MicroPasts/14980039502,superuser,flangedAxesA1
BAI-11166,528,Flanged Axe,,,NA,Bronze Age,p0gjgrs6qb2,,"Maclean of Ardgour,,  Windover,  Bursledon, Hants.",,,Private Collection,"England, Cumberland, Lazonby",,,,Lazonby,,England,Cumberland,"Lazonby, Cumbria",54.750013,-2.703072,,NA,NA,NA,121,47 at edge,,907.18474 including stone mounting,Dark brown with touches of green,Pitted with small holes,34 at wings,Weight on card is 2 lbs.,,,Slight stop ridge; flanges slightly hammered inwards; cutting edge has a number of small chips.  Butt turned over.,,"Drawn by hand in haste and with difficulty, owing toits being mounted on a large block of green serpentine.",Margaret Ellen Joy,https://farm6.staticflickr.com/5590/14955825496_dd0bd765c2_q.jpg,https://farm6.staticflickr.com/5590/14955825496_dd0bd765c2_b.jpg,https://www.flickr.com/photos/MicroPasts/14955825496,most detailed record,flangedAxesA1
BAI-11749,433,Flanged Axe,Short-Flanged),,NA,Bronze Age,p0gjgrs6qb2,Drawing Avail.,Yorkshire Mus.,,,York Museum,"England,Yorkshire,Lebberston Carr,Guisthorpe,LC Farm,366 yds West of,Surface find [private?] 50",,,farm,Lebberston Carr,,England,North Yorkshire,"Lebberston, Scarborough, North Yorkshire Yo11, UK",54.22663,-0.348291,"54 13' 1"" O 21' 52""",NA,NA,NA,201,,,,,,,,,,Slight stop-ridge; crescentic ridge between flange ends,Yks A. J. pt 152 (XXXVIII/4),,Joellen McGann,https://farm4.staticflickr.com/3921/14793703470_4b3b75b618_q.jpg,https://farm4.staticflickr.com/3921/14793703470_4b3b75b618_b.jpg,https://www.flickr.com/photos/MicroPasts/14793703470,superuser,flangedAxesA1
BAI-63576,433,Flanged Axe,,,NA,Bronze Age,p0gjgrs6qb2,,"British Museum, W.G. 1548,given to Mr. Disney of the Hyde by Lord Garvadh, Feby 7th 1822",WG.1548,H_WG-1548,British Museum,"Ireland,Co. Londonderry,Liscall (near Garvagh)",,,,Liscall,,Ireland,County Londonderry,"Liscall Rd, Garvagh, Coleraine Bt51 5er, UK",54.99498515,-6.72800606550457,,NA,NA,NA,139,butt 29,58,407.21,"Fine patina, dark green.","Flaked in places, especially at edge + butt.",13 (at stop),,,,Clear incised decoration and curved raised lines. Sides cable moulded and bound by lines.,,,Joellen McGann,https://farm8.staticflickr.com/7467/27650477403_dde24d7778_q.jpg,https://farm8.staticflickr.com/7467/27650477403_dde24d7778_b.jpg,https://www.flickr.com/photos/115096994@N02/27650477403,superuser,IrishAxesB5
