objectID,userID,objectType,classification,completeness,quantity,broadperiod,periodo,rightCorner,collection,museumID,collectionIdentifier,museumCollection,site,stolenStatus,hoard,discoveryContext,parish,district,country,county,toSearch,fourFigureLat,fourFigureLon,gridRef,dateDiscoveryDay,dateDiscoveryMonth,dateDiscoveryYear,length,width,edge,weight,patina,surface,thickness,other,composition,associations,description,publications,remarks,inputBy,thumbnail,imageURL,flickrURL,Processing,project
BAI-4569,433,Palstave,,,NA,Bronze Age,p0gjgrs6qb2,,"Herts County Museum, St. Albans, lent by Capt. J.H. Ball, RAF",,,Hertfordshire County Museum,Austria,,,,,,Austria,,Austria,47.59397,14.12456,,NA,NA,NA,98,21,32,128,dull light green,smooth,12,"Unspecified location in Austria - geolocation not accurate to 10 kms,  Length: 97.5,  Width: edge 32; middle 21; butt 16,  Thickness: 12; 10.5; 12.5",,,Well preserved. Edge and sides are filed.,,,Joellen McGann,https://farm8.staticflickr.com/7425/13306494363_ce3aa94bf9_q.jpg,https://farm8.staticflickr.com/7425/13306494363_ce3aa94bf9_b.jpg,http://www.flickr.com/photos/MicroPasts/13306494363,superuser,drawB8
BAI-4568,433,Palstave,,,NA,Bronze Age,p0gjgrs6qb2,,"Herts County Museum, St. Albans, Ball Collection",,,Hertfordshire County Museum,Austria,,,,,,Austria,,Austria,47.59397,14.12456,,NA,NA,NA,192,36,53,624,dark green matte,"smooth, slightly encrusted on one side",25,"Unspecified location in Austria - geolocation not accurate to 10 kms,  Width: edge 52.5; middle 36; butt 34,  Thickness: 25; 26.5; 12,  Weight: 623.7 gms",,,,,,Joellen McGann,https://farm3.staticflickr.com/2824/13306702594_27a974a8f6_q.jpg,https://farm3.staticflickr.com/2824/13306702594_27a974a8f6_b.jpg,http://www.flickr.com/photos/MicroPasts/13306702594,superuser,drawB8
BAI-4567,433,Palstave,,,NA,Bronze Age,p0gjgrs6qb2,,"Herts County Museum, St. Albans, Ball Collection",,,Hertfordshire County Museum,Austria,,,,,,Austria,,Austria,47.59397,14.12456,,NA,NA,NA,169,27,42,439,dark greeny brown,smooth,27,"Unspecified location in Austria - geolocation not accurate to 10 kms,  Width: edge 41.5; middle 27; butt 20,  Thickness: 27; 7; 33,  Weight: 439.42 gms",,,,,,Joellen McGann,https://farm4.staticflickr.com/3806/13306494753_04290cc232_q.jpg,https://farm4.staticflickr.com/3806/13306494753_04290cc232_b.jpg,http://www.flickr.com/photos/MicroPasts/13306494753,superuser,drawB8
BAI-4566,433,Palstave,,,NA,Bronze Age,p0gjgrs6qb2,,"Herts County Museum, St. Albans, Ball Collection",,,Hertfordshire County Museum,Austria,,,,,,Austria,,Austria,47.59397,14.12456,,NA,NA,NA,171,27,44,397,green with patches of bronze,rough,26,"Site: unspecified location in Austria - geolocation not accurate to 10 kms,  Width: edge 43.5; middle 27; butt 20,  Thickness: 26; 7; 27; 30,  Weight: 396.88 gms",,,,,,Joellen McGann,https://farm3.staticflickr.com/2817/13306495623_04c8184d0c_q.jpg,https://farm3.staticflickr.com/2817/13306495623_04c8184d0c_b.jpg,http://www.flickr.com/photos/MicroPasts/13306495623,superuser,drawB8
BAI-4594,433,Palstave,,,NA,Bronze Age,p0gjgrs6qb2,,"Private (in 1913), Louis Marsille",,,Private Collection,"France, brittany, morbihan, erdeven, near the town to south, about 1907",,,,,,France,,"Erdeven, France",47.6417056,-3.1557523,,NA,NA,1907,169,,,,,,,,,2 axes found,"The illustration in B.C.Pln. 1913, reprint p. 4 shows a well-developed stop-ridge and central rib on face below: the ornament on the sides in stated to be in relief (p.54).","Bull. Soc. Poly,. Morbihan, 1909 and 1913 (Reprint pp. 4-5, fig., and 54).",,Joellen McGann,https://farm8.staticflickr.com/7353/13306333025_45e8c135f8_q.jpg,https://farm8.staticflickr.com/7353/13306333025_45e8c135f8_b.jpg,http://www.flickr.com/photos/MicroPasts/13306333025,superuser,drawB8
BAI-4611,433,Palstave,,,NA,Bronze Age,p0gjgrs6qb2,,"Blackmoor Museum, 26 on face, WB 10 on side",26WB10,,Blackmoor Museum,"France, finistere, quimper",,,,,,France,,"Quimper, France",47.9960325,-4.1024782,,NA,NA,NA,140,22,62,299,dark green,,6,"Width: edge 62; middle 22; butt 20,  Thickness: 6; 22; 24,",,,,,,Joellen McGann,https://farm8.staticflickr.com/7271/13306688874_f4f137f30c_q.jpg,https://farm8.staticflickr.com/7271/13306688874_f4f137f30c_b.jpg,http://www.flickr.com/photos/MicroPasts/13306688874,superuser,drawB8
BAI-4604,433,Palstave,,,NA,Bronze Age,p0gjgrs6qb2,,"Fomerly M. de la Granciere, Sold at Sotheby's 23.vii. 30, Lot 20, No. 52",,,Private Collection,"France, brittany, morbihan, guern, fourdan, march 1898, 40 m depth",,,auction,,,France,,"Guern, France",48.0301574,-3.0913832,,NA,3,1898,111,24,35,,,,27,"Width: edge 35, butt 24,  Thickness: ridge 27",,Hoard: see No. 43.,"No loop, Midrib on faces.","Bull. Soc. Polym. Morbihan, 1898, p.158, Dechelette, Manuel II, Appendix, p.83, Hoard No. 564.",,Joellen McGann,https://farm8.staticflickr.com/7239/13306691514_66b84f5aa3_q.jpg,https://farm8.staticflickr.com/7239/13306691514_66b84f5aa3_b.jpg,http://www.flickr.com/photos/MicroPasts/13306691514,superuser,drawB8
BAI-4606,433,Palstave,,,NA,Bronze Age,p0gjgrs6qb2,,"Lukis Museum, Guernsey",,,Lukis Museum,"France, finistere, coloree",,,,,,France,,Finistere France,48.24511525,-4.04409024524174,,NA,5,1889,153,24,42,414,"From butt to centre, mostly green. rubbed here and there showing brown metal. Edge end a greenish brown rubbed to show bright yellow metal.",slightly pitted all over. some mud adhering.,10,"Width: edge 42, butt 24,  Thickness: 10, 34,  Weight: 413.51 gms",,Found with 3 others and 4 rings.,Edge is broken.,,"Found while digging, May 1889.",Joellen McGann,https://farm3.staticflickr.com/2828/13306483283_477323bbac_q.jpg,https://farm3.staticflickr.com/2828/13306483283_477323bbac_b.jpg,http://www.flickr.com/photos/MicroPasts/13306483283,superuser,drawB8
BAI-4645,433,Palstave,,,NA,Bronze Age,p0gjgrs6qb2,,Avranches Museum,,,Avranches Museum,"France, brittany",,,,,,France,,"Brittany, France",48.2640845,-2.9202408,,NA,NA,NA,115,,32,,,,40,"Site: unspecified location in Brittany, France - geolocation not accurate to 10 kms,  Thickness: 40 at ridge; stated to be 20 but drawn as 13",,,,,,Joellen McGann,https://farm4.staticflickr.com/3815/13306319015_3cd47eeae4_q.jpg,https://farm4.staticflickr.com/3815/13306319015_3cd47eeae4_b.jpg,http://www.flickr.com/photos/MicroPasts/13306319015,superuser,drawB8
BAI-4589,433,Palstave,,,NA,Bronze Age,p0gjgrs6qb2,,"Herts County Museum, St. Albans, Ball Collection",,,Hertfordshire County Museum,"France, brittany",,,,,,France,,"Brittany, France",48.2640845,-2.9202408,,NA,NA,NA,179,32,45,539,,,13,"Site: unspecified location in Brittany - geolocation not accurate 10 kms,  Width: edge 45; middle 31.5; butt 25,  Thickness: 13; 24; 8; 31,  Weight: 538.65 gms",,,,,,Joellen McGann,https://farm8.staticflickr.com/7002/13306488823_698bb35910_q.jpg,https://farm8.staticflickr.com/7002/13306488823_698bb35910_b.jpg,http://www.flickr.com/photos/MicroPasts/13306488823,superuser,drawB8
BAI-4586,433,Palstave,,,NA,Bronze Age,p0gjgrs6qb2,,"Pitt Rivers Museum, Oxford, J.W. Flower",,,Pitt Rivers Museum,"France, brittany",,,,,,France,,"Brittany, France",48.2640845,-2.9202408,,NA,NA,NA,154,34,39,,,corroded and a little worn,5,"Site: unspecified location in Brittany, France - geolocation not accurate to 10 kms,  Width: edge 39; middle 34; butt 27,  Thickness: 5, 23",,,,,,Joellen McGann,https://farm8.staticflickr.com/7238/13306697364_ed6b7e4bcc_q.jpg,https://farm8.staticflickr.com/7238/13306697364_ed6b7e4bcc_b.jpg,http://www.flickr.com/photos/MicroPasts/13306697364,superuser,drawB8
BAI-4587,433,Palstave,,,NA,Bronze Age,p0gjgrs6qb2,,"Private Collection, Sir B. Windle (1924) CCLXXVIII, St. Michael's College, Toronto, Cotton Collection Bronsgrove",,,Private Collection,"France, brittany",,,,,,France,,"Brittany, France",48.2640845,-2.9202408,,NA,NA,NA,175,27,48,418,powder green,small roughness and excrescenous adhering,8,"Site: unspecified location in Brittany, France - geolocation not accurate to 10 kms,  Width: edge 48; middle 27; butt 28,  Thickness 8; 30",,,Possibly a facsimile. Fresh from mould. Bad casting as 2 halves of mould were not opposite,,,Joellen McGann,https://farm8.staticflickr.com/7228/13306489223_51546fa1b3_q.jpg,https://farm8.staticflickr.com/7228/13306489223_51546fa1b3_b.jpg,http://www.flickr.com/photos/MicroPasts/13306489223,superuser,drawB8
BAI-4590,433,Palstave,,,NA,Bronze Age,p0gjgrs6qb2,,"The Priory, Prittlewell (Southend-on-Sea), 1/19",1/19,,"The Priory, Prittlewell","France, brittany",,,,,,France,,"Brittany, France",48.2640845,-2.9202408,,NA,NA,NA,152,28,44,305,"black, but covered with a very fine medium green encrustment (flat) and light soil",slightly rough,26,"Site: unspecified location in Brittany - geolocation not accurate to 10 kms,  Width: edge 44; middle 28; butt 25.5,  Thickness: 26; 7,  Weight: 304.76 gms",,,Prominent cast marks. The 2 halves of the mould were evidently not pitted well.,,,Joellen McGann,https://farm3.staticflickr.com/2884/13306487383_bee215183f_q.jpg,https://farm3.staticflickr.com/2884/13306487383_bee215183f_b.jpg,http://www.flickr.com/photos/MicroPasts/13306487383,superuser,drawB8
BAI-4608,433,Palstave,,,NA,Bronze Age,p0gjgrs6qb2,,"Lukis Museum, Guernsey",,,Lukis Museum,"France, finistere, collorec",,,,,,France,,"Collorec, France",48.2856391,-3.7750616,,NA,NA,NA,158,27,36,406,mostly bright green rubbed off here and there showing dark brown metal.,is all very pitted. Some mud adheres.,13,"Width: edge 36; middle 27; butt 24,  Thickness 13; 31,  Weight: 406.32 gms",,,"Edge rather blunt, broken at one corner.",,,Joellen McGann,https://farm8.staticflickr.com/7427/13306690354_83a8c7948a_q.jpg,https://farm8.staticflickr.com/7427/13306690354_83a8c7948a_b.jpg,http://www.flickr.com/photos/MicroPasts/13306690354,superuser,drawB8
BAI-4607,433,Palstave,,,NA,Bronze Age,p0gjgrs6qb2,,"Lukis Museum, Guernsey",,,Lukis Museum,"France, finistere, collorec",,,,,,France,,"Collorec, France",48.2856391,-3.7750616,,NA,NA,NA,178,30,45,501,Green and blue brown one side. The other sides green and grey green.,,16,"Width: edge 45; middle 30; butt 29,  Thickness: 16; 31.5,  Weight: 500.67 gms",,,One flange is damaged. A good deal of mud adhering. Edge badly notched. Butt slightly broken.,,,Joellen McGann,https://farm4.staticflickr.com/3787/13306690594_4dee8ff818_q.jpg,https://farm4.staticflickr.com/3787/13306690594_4dee8ff818_b.jpg,http://www.flickr.com/photos/MicroPasts/13306690594,superuser,drawB8
BAI-4610,433,Palstave,,,NA,Bronze Age,p0gjgrs6qb2,,"Lukis Museum, Guernsey",,,Lukis Museum,"France, finistere, poullaouen, montaigne de kerbol (kerpulven)",,,,,,France,,"Poullaouen, France",48.3403831,-3.6432302,,NA,NA,NA,159,28,41,494,"Green, rubbed off to show dark brown metal especially on one side.",very pitted all over and a good deal of mud adheres.,16,"Width: edge 41; middle 28; butt 30,  Thickness 16; 32,  Weight: 493.58 gms",,,Edge and butt are broken.,,,Joellen McGann,https://farm4.staticflickr.com/3762/13306328845_b12203735b_q.jpg,https://farm4.staticflickr.com/3762/13306328845_b12203735b_b.jpg,http://www.flickr.com/photos/MicroPasts/13306328845,superuser,drawB8
BAI-4609,433,Palstave,,,NA,Bronze Age,p0gjgrs6qb2,,"Lukis Museum, Guernsey",,,Lukis Museum,"France, finistere, poullaoen, montaigne de kerbot",,,,,,France,,"Poullaouen, France",48.3403831,-3.6432302,,NA,NA,NA,153,28,36,451,Mud adheres in several places.  Green and dark brownish green.,very pitted,16,"Width: edge 36; middle 28; butt 26,  Thickness: 16; 31,  Weight: 450.64 gms",,,The edge flanges and butt are damaged.,,,Joellen McGann,https://farm3.staticflickr.com/2822/13306690084_d4bf614abb_q.jpg,https://farm3.staticflickr.com/2822/13306690084_d4bf614abb_b.jpg,http://www.flickr.com/photos/MicroPasts/13306690084,superuser,drawB8
BAI-4593,433,Palstave,,,NA,Bronze Age,p0gjgrs6qb2,,"Pitt Rivers Museum, Oxford",,,Pitt Rivers Museum,"France, brittany, cotes-du-nord (current cotes d'armor), commune de calorguen (near dinan), grand bois, le desert, 1863",,,,,,France,,"Calorguen, France",48.4115439,-2.0288176,,NA,NA,1863,135,25,36,,,somewhat broken and rather roughly made,6,"Date of find recorded as both 1866 and 1863.,  Length: 134.5,  Width: edge 36; middle 24.5; butt 23,  Thickness 6, 26",,"Label: ""Part of find Commune de Colorguen. About 80 found in 1866, near Dinan. Part of a hoard of 160 palstaves according to some authorities 360 axes of various sizes.""",,"Dechelette; Manuel d'Archeologie, ii, App i, No 116,p. 25, Chantre, E., Age du Bronze III 26, Mem Soc. Arch d'Ille-et-Vilains (II.XI.65), p. 49, de Mortillet, G., Cachettes de l'Age du Bronze en France, BSA, 1894, p. 305, DAG I 220, Andre, A. Catalogue Musee Rennes, 1876, pp. 81-99, Tresor Archeologique, pl. XVI, 2, 3, 5, 6, 7",,Joellen McGann,https://farm8.staticflickr.com/7093/13306694444_a989900db1_q.jpg,https://farm8.staticflickr.com/7093/13306694444_a989900db1_b.jpg,http://www.flickr.com/photos/MicroPasts/13306694444,superuser,drawB8
BAI-4592,433,Palstave,,,NA,Bronze Age,p0gjgrs6qb2,,"Pitt Rivers Museum, Oxford",,,Pitt Rivers Museum,"France, brittany, calorguen (near dinan), 1863",,,,,,France,,"Calorguen, France",48.4115439,-2.0288176,,NA,NA,1863,156,33,40,,,rather a rough casting,24,"Width: edge 40; middle 32.5; butt 32,  Thickness: 24; 7",,,,"Joseph Dechelette. Manuel d'Archeologie, Vol. II, Appendice I, P, 25,,  E. Chantre. Age du Br. III. p. 26,,  G. de Mortillet. loc. cit. p.305, Daq I, p.220,,  A. Andre. Cat. Musee Rennes. 1876. p.81-99. Tresors archeol. pl. XVI, fig. 2, 3, 5, 6, 7,,  Mem. Soc. Arch. d'Ille-et-Vilaine. Seance du 11 novembre 1865: p. 49.","Label: ""Commune de Caloguen 2 lienes de Dinan, about 80 found in 1866.""",Joellen McGann,https://farm8.staticflickr.com/7266/13306694644_7d32657edb_q.jpg,https://farm8.staticflickr.com/7266/13306694644_7d32657edb_b.jpg,http://www.flickr.com/photos/MicroPasts/13306694644,superuser,drawB8
BAI-4591,433,Palstave,,,NA,Bronze Age,p0gjgrs6qb2,,"Pitt Rivers Museum, Oxford",,,Pitt Rivers Museum,"France, brittany, calorguen (near dinan)",,,,,,France,,"Calorguen, France",48.4115439,-2.0288176,,NA,NA,1863,160,30,45,,,rather rough,8,"Width: edge 45; middle 30; butt 28,  Thickness 8:30",,A hoard of 160,,"Joseph Dechelette, Manual d'Archeologie. VCol II Appendice I, p.25.,,  E. Chantre. Age du Br. III, P. 26,  G. de Mortillet, loc. cit, p. 305, Daq. 1. p. 220,,  A. Andre. Cat. Musee Rennes. 1876. p. 81-99. Tresors Acheol. pl. XVI. fig. 2,3,5,6,7.,  Mem. Soc. Arch d'Ile-et-Vilaine. seance du II novembre 1865, p. 49","Label: ""Commune de Caloguen""; 2 lienes de Dinan, about 80 found in 1866""",Joellen McGann,https://farm8.staticflickr.com/7257/13306694934_bce26502a2_q.jpg,https://farm8.staticflickr.com/7257/13306694934_bce26502a2_b.jpg,http://www.flickr.com/photos/MicroPasts/13306694934,superuser,drawB8
BAI-4646,433,Palstave,,,NA,Bronze Age,p0gjgrs6qb2,,"Blackmoor Museum, 9 on face; C18 on side",9C18,,Blackmoor Museum,"France, cotes du nord (cotes d'armor), dinan",,,,,,France,,"Dinan, France",48.4539775,-2.047687,,NA,NA,NA,222,41,111,254,green. bronze shows in places,,3,"Width: edge 111; middle 41; butt 28,  Thickness 3; 25,  Weight: 253.5 gms",,,,,,Joellen McGann,https://farm8.staticflickr.com/7189/13306679884_081816a544_q.jpg,https://farm8.staticflickr.com/7189/13306679884_081816a544_b.jpg,http://www.flickr.com/photos/MicroPasts/13306679884,superuser,drawB8
BAI-4847,433,Palstave,,,NA,Bronze Age,p0gjgrs6qb2,,Winchester Museum,,,Winchester Museum,"France,eure,mandres,found in a barrow",,,barrow,,,France,,"Mandres, France",48.7536219,0.8658482,,NA,NA,NA,163,24,65,319,"pale green patina, flaked off in places",,26,"Site: Appears to be Mandres, Eure rather than Manpas.,  Width: edge 65mm; middle 24mm; butt 22mm,  Thickness 26mm; 7mm,  Weight: 318.93 gms",,,Edge chipped.,,"Label: ""Celt found in a barrow near Manpas, Normandy""",Joellen McGann,https://farm4.staticflickr.com/3800/13306782504_1eb6974a4d_q.jpg,https://farm4.staticflickr.com/3800/13306782504_1eb6974a4d_b.jpg,http://www.flickr.com/photos/MicroPasts/13306782504,superuser,drawB8
BAI-3412,433,Palstave,,,NA,Bronze Age,p0gjgrs6qb2,III1C,"St. Peter Port,Lukis Museum, Guernsey",,,Lukis Museum,"Channel Islands, jersey",,,,,,Channel Islands,,Jersey,49.2214561,-2.1358386,,NA,NA,NA,159,26,41,384,,Thickly crusted over with green deposit.,13,"Site: Georeference does not appear to allow referencing for Channel Islands,Width: edge 41mm; middle 26mm; butt 23mm,Thickness: 13mm; 29mm,Weight: 383.76 gms",,,"A little mud adheres to sockets. The edge has been sharpened and cleaned, showing shiny yellow metal.",,,Joellen McGann,https://farm4.staticflickr.com/3744/13305062075_22823696aa_q.jpg,https://farm4.staticflickr.com/3744/13305062075_22823696aa_b.jpg,http://www.flickr.com/photos/MicroPasts/13305062075,superuser,drawB16
BAI-4648,433,Palstave,,,NA,Bronze Age,p0gjgrs6qb2,,"Pitt Rivers Museum, Oxford, J. Wickham Flower",,,Pitt Rivers Museum,"germany, bavaria, nuremberg",,,,,,Germany,,"Nuremberg, Germany",49.453872,11.077298,,NA,NA,NA,125,25,42,,,"smooth, well moulded",24,"Width: edge 42; middle 24.5; butt 20,  Thickness: 24; 10; 7",,,Good condition,,,Joellen McGann,https://farm4.staticflickr.com/3713/13306471353_3587c40d97_q.jpg,https://farm4.staticflickr.com/3713/13306471353_3587c40d97_b.jpg,http://www.flickr.com/photos/MicroPasts/13306471353,superuser,drawB8
BAI-4619,433,Palstave,,,NA,Bronze Age,p0gjgrs6qb2,,"Peabody Museum, Harvard University, Cambridge, Mass., 3331, Received by purchase 1868, collected by G. de Mortillet",3331,,Peabody Museum,"France, seine-inferieure (seine-maritime), gonfreville-l'orcher",,,,,,France,,"Gonfreville-l'orcher, France",49.5039262,0.2338372,,NA,NA,NA,154,27,48,,,"heavily encrusted, upper part is corroded",31,"Width: edge 48; middle 27; butt 25,  Thickness: middle 31",,,Drawing of septum is approximate as is longitudinal section. cast marks.,,,Joellen McGann,https://farm3.staticflickr.com/2842/13306325905_d4b901859d_q.jpg,https://farm3.staticflickr.com/2842/13306325905_d4b901859d_b.jpg,http://www.flickr.com/photos/MicroPasts/13306325905,superuser,drawB8
BAI-4618,433,Palstave,,,NA,Bronze Age,p0gjgrs6qb2,,"Salisbury S. Wills and Blackmoor Museum, 34 and B7 on face, WB II on side.",34B7,,Blackmoor Museum,"France, manche, near valognes",,,,,,France,,"Valognes, France",49.5089547,-1.4708174,,NA,NA,NA,190,34,46,618,dark green,,37,"Width: edge 46; middle 34; butt 32,  Thickness: 37; 8,  Weight: 617.5 gms",,,Flanges broken in places.,,,Joellen McGann,https://farm8.staticflickr.com/7235/13306326135_711756a610_q.jpg,https://farm8.staticflickr.com/7235/13306326135_711756a610_b.jpg,http://www.flickr.com/photos/MicroPasts/13306326135,superuser,drawB8
BAI-4647,433,Palstave,,,NA,Bronze Age,p0gjgrs6qb2,,"University of Wales Museum, Aberystwyth",,,"University College of Wales Museum, Aberystwyth","germany, langenlonsheimer wald",,,,,,Germany,,"Dorsheim, Germany",49.9250415,7.8736112,,16,3,1870,153,27,49,227,,encrusted and bright green,22,"Width: butt 27; edge 49,  Thickness: centre 22,",,,Butt chipped,,"Label: ""16 Marz 1870. No. 50""",Joellen McGann,https://farm3.staticflickr.com/2858/13306318625_bbd196ca32_q.jpg,https://farm3.staticflickr.com/2858/13306318625_bbd196ca32_b.jpg,http://www.flickr.com/photos/MicroPasts/13306318625,superuser,drawB8
BAI-4649,433,Palstave,,,NA,Bronze Age,p0gjgrs6qb2,,"Horniman Museum, Forest Hill SE, presented by Sir John Lubbock",,,Horniman Museum,"germany, hessen, mainz",,,,,,Germany,,"Mainz, Germany",50.0012314,8.2762513,,NA,NA,NA,146,28,44,354,bronze showing through a little green,very much corroded and rough,33,"Width: edge 44; butt 28,  Thickness: 33, thinnest part 11 mm,  Weight: 354.37 gms",,,,,,Joellen McGann,https://farm4.staticflickr.com/3695/13306678984_af3a62127a_q.jpg,https://farm4.staticflickr.com/3695/13306678984_af3a62127a_b.jpg,http://www.flickr.com/photos/MicroPasts/13306678984,superuser,drawB8
BAI-3434,433,Palstave,,,NA,Bronze Age,p0gjgrs6qb2,,"Sotheby's Sale, 30.vii.73",,,Private Collection,"England, cornwall",,,auction,,,England,Cornwall,Cornwall,50.416667,-4.75,,NA,NA,NA,,,,,,,,Site: unspecified location in Cornwall - georeference not accurate to 10 kms,,,,,,Joellen McGann,https://farm8.staticflickr.com/7422/13305225473_48451bcf55_q.jpg,https://farm8.staticflickr.com/7422/13305225473_48451bcf55_b.jpg,http://www.flickr.com/photos/MicroPasts/13305225473,superuser,drawB16
BAI-3478,64,PALSTAVE,,,NA,Bronze Age,p0gjgrs6qb2,,"EXETER, Royal Albert Memorial Museum, Rougemont House., 102/1970.",102/1970.,,Royal Albert Memorial Museum,"devon,,, ashburton,,, caton to stormsdown road, e. of ashburton., sx 770710",,,,,,England,Devon,Ashburton,50.5267352,-3.75598499118241,SX 770710,NA,NA,NA,,,,,,"Light green, pitted.",,,,,,"Devon Assoc. for the Advancement of Science, Literature and Art, 1971, vol. 103, p.241.","CF Bovey Tracey, Colyton, Week.",Hugh Fiske,https://farm8.staticflickr.com/7310/13305567374_da61981ea3_q.jpg,https://farm8.staticflickr.com/7310/13305567374_da61981ea3_b.jpg,http://www.flickr.com/photos/MicroPasts/13305567374,superuser,drawB16
BAI-51452,433,Palstave,,,NA,Bronze Age,p0gjgrs6qb2,,Ashmolean Museum,,,Ashmolean Museum,"Ashmolean Museum,Nr. Dorchester",,,,,,England,Dorset,"Dorchester, Dorchester, Dorset, UK",50.7085384,-2.42942142147568,,NA,NA,NA,,,,,,,,,,,,,JW - Unidentified cards from B.A. Index Drawer A20,Joellen McGann,https://farm2.staticflickr.com/1557/24520940195_6176678eb3_q.jpg,https://farm2.staticflickr.com/1557/24520940195_6176678eb3_b.jpg,https://www.flickr.com/photos/115096994@N02/24520940195,superuser,BitsandBobsPt1
BAI-51455,433,Palstave,,,NA,Bronze Age,p0gjgrs6qb2,,,,,,Near Dorchester,,,,,,England,Dorset,"Dorchester, Dorchester, Dorset, UK",50.7085384,-2.42942142147568,,NA,NA,NA,,,,,,,,,,,,,JW - Unidentified cards from BA Index Drawer A20,Joellen McGann,https://farm2.staticflickr.com/1457/24153173919_cd8aa2d301_q.jpg,https://farm2.staticflickr.com/1457/24153173919_cd8aa2d301_b.jpg,https://www.flickr.com/photos/115096994@N02/24153173919,superuser,BitsandBobsPt1
BAI-61555,433,Palstave,,,NA,Bronze Age,p0gjgrs6qb2,,"Exeter, Royal Albert Memorial Museum,Rougemont House, 66/1938.25",66/1938.25,,Royal Albert Memorial Museum,"Devon,found in 14' of clay in Bovey Basin",,,,,,England,Devon,"Devon, UK",50.7241405,-3.66077881614107,,NA,NA,NA,,,,,,,,,,,,,Lost Sept. 74,Joellen McGann,https://farm2.staticflickr.com/1651/26561849115_9eb1dd34cc_q.jpg,https://farm2.staticflickr.com/1651/26561849115_9eb1dd34cc_b.jpg,https://www.flickr.com/photos/115096994@N02/26561849115,superuser,BitandBobsA15
BAI-3557,243,Palstave,,,NA,Bronze Age,p0gjgrs6qb2,,"Dorchester Museum.,263.,Cunnington Collection.",263,,Dorchester Museum,exact site unknown,,,,,,England,Dorset,Dorset,50.75,-2.3333,,NA,NA,NA,137,,37,,"Dark green patina, much chipped showing light green patches",,,"No accuracy on geolocation, position set to ""Dorset"" based on adjacent card locations.,Palstave is somewhat lemon-shaped in top profile with stop almost exactly in middle at widest points then tapering slowly about halfway down blade and up septum before tapering rapidly to edge and butt.,Appears to be slight side ridges below stop?,Flange heavily damaged on one side, most missing with only a small portion attached to septum.,Edge crescent shaped, blade widens about halfway to edge, and is more narrow towards stop.,Butt rounded, somewhat worn.",,,Edge chipped showing copper-coloured metal; flanges broken.,,,Jeff Okazaki,https://farm4.staticflickr.com/3810/13305336593_dc7ce092b7_q.jpg,https://farm4.staticflickr.com/3810/13305336593_dc7ce092b7_b.jpg,http://www.flickr.com/photos/MicroPasts/13305336593,superuser,drawB16
BAI-5429,433,Palstave,,,NA,Bronze Age,p0gjgrs6qb2,,"Worthing Museum,3649,Source and date unknown; catalogued in Dec. 1950",3649,,Worthing Museum,"England, sussex",,,,,,England,East Sussex,Brighton,50.83891575,-0.126930542500747,,NA,NA,NA,170,19,71,,,"Grass green patina, much at corners etc. flaked to dull green-brown surface; filed patches of bright gold, and others gold-flecked - modern filing, rubbing, etc.",8,,,,"Dimensions: L 170mm; We 71mm; Wbt 19.2mm; max B. st 28.4mm; max T sep. 8.2mm,Typology: ""U""-shaped septum section; broad rounded stop crests, stops slightly overhung; trident rib decoration on blade faces - central rib becomes raised ridge below junction; slight thickening of blade towards its sides,Manufacture: traces of edge bevel; diagonal pmks lining central ridge - except on one side of one face - just few nearer vert. pmks; remains of cg. fl. under loop only; swallow hole in one septum end - just breaks through to revers septum which only has slight depression,Condition: edge mainly blunt, partly anc. or corrosion, partly medium interference; parts of reverse fgs broken off - corrosion damage?, and cut recently - bright gold, butt possibly corroded and damaged.,Context: 9, Undocumented",,"Labels/Markings: Rect. s/o label: '2797 DK SUSSEX', later addition '3649'",Joellen McGann,https://farm3.staticflickr.com/2816/12674689874_43977a65ab_q.jpg,https://farm3.staticflickr.com/2816/12674689874_43977a65ab_b.jpg,http://www.flickr.com/photos/MicroPasts/12674689874,superuser,drawA9
