objectID,userID,objectType,classification,completeness,quantity,broadperiod,periodo,rightCorner,collection,museumID,collectionIdentifier,museumCollection,site,stolenStatus,hoard,discoveryContext,parish,district,country,county,toSearch,fourFigureLat,fourFigureLon,gridRef,dateDiscoveryDay,dateDiscoveryMonth,dateDiscoveryYear,length,width,edge,weight,patina,surface,thickness,other,composition,associations,description,publications,remarks,inputBy,thumbnail,imageURL,flickrURL,Processing,project
BAI-11636,433,Flanged Axe,,,NA,Bronze Age,p0gjgrs6qb2,,"Moyses Hall Museum,Bury St. Edmunds,Access No. F82",F82,,Moyses Hall Museum,"England,Suffolk [Norfolk?],Thetford,no other details",,,,Thetford,,England,Norfolk,"Thetford, Norfolk, UK",52.4156001,0.748712,,NA,NA,NA,155,86,,539,Light brown,Good,30,"Site: Thetford is in Norfolk, near the border with Suffolk,Length: 6.1 ins = 154.94mm,Width: 3.4 ins. = 86.36mm,Thickness: 1.2 ins = 30.48mm,Weight: 19 oz = 538.641 gms",Bronze,,Excellent preservation.,,"B. Edwardson, Curator",Joellen McGann,https://farm4.staticflickr.com/3905/14980053052_1976191a29_q.jpg,https://farm4.staticflickr.com/3905/14980053052_1976191a29_b.jpg,https://www.flickr.com/photos/MicroPasts/14980053052,superuser,flangedAxesA1
BAI-11198,433,Flanged Axe,,,NA,Bronze Age,p0gjgrs6qb2,,"Exeter Museum,(No. 6158(,Presented by Mr. Richard Barnes,Sept. 1882",6158,,Exeter Museum,"England,Devonshire,Thorverton,In pulling down an old house in the village,about 1859",,,,Thorverton,,England,Devon,"Thorverton, Exeter, Devon Ex5, UK",50.6982412,-3.5164717,SS 9302,NA,NA,1859,152,20,55,342,Originally dark green but almost entirely removed.,,28,"Width: edge 55mm; butt 20mm,Thickness: 28mm; 23mm,Weight: 342.17 gms",,,,,Sound about 1859 in pulling down an old house.,Joellen McGann,https://farm6.staticflickr.com/5568/14978793795_82509a45a9_q.jpg,https://farm6.staticflickr.com/5568/14978793795_82509a45a9_b.jpg,https://www.flickr.com/photos/MicroPasts/14978793795,superuser,flangedAxesA1
BAI-11080,543,flanged Axe,Haft,,NA,Bronze Age,p0gjgrs6qb2,,"Private,G. Smith Esq. 1923",,,Private Collection,"England,Berks./Oxon,Tilehurst,Thames,opposite Roebuck",,,river,Tilehurst,,England,Berkshire,,51.458697,-1.042555,,NA,NA,NA,178,"middle 34,butt 25",80,637.85,Brown - green spots,,"13,28",Georef not working for me.,,,,,,Jane Fellows,https://farm6.staticflickr.com/5554/14975725411_0a1ffa03b5_q.jpg,https://farm6.staticflickr.com/5554/14975725411_0a1ffa03b5_b.jpg,https://www.flickr.com/photos/MicroPasts/14975725411,most detailed record,flangedAxesA1
BAI-11082,543,Flanged Axe,Haft-flanged Axe' in PPS 1959,,NA,Bronze Age,p0gjgrs6qb2,,Reading Museum S255:45; Smith Collection,S255:45,,Reading Museum,"THAMES,England,Berks.,Tilehurst,from the Thames",,,river,Tilehurst,,England,Berkshire,,51.458697,-1.042555,,NA,NA,NA,,,,,Dark brown,Very good,,"I included “England” in Site address to be consistent with other cards. Bottom left is signed ""J. Wymer""",Bronze,,Well-developed cast flanges and incipient stop ridges,,,Jane Fellows,https://farm6.staticflickr.com/5554/14975725141_eedc76cdd8_q.jpg,https://farm6.staticflickr.com/5554/14975725141_eedc76cdd8_b.jpg,https://www.flickr.com/photos/MicroPasts/14975725141,most detailed record,flangedAxesA1
BAI-11433,433,Flanged Axe,,,NA,Bronze Age,p0gjgrs6qb2,,Carisbrooke Castle,,,Carisbrooke Castle,"England,Isle of Wight,Totland,Moon's Hill,About 1/2-way between Freshwater Bay and Alum Bay, on the edge of Marshland,1942",,,hillside,Totland,Isle of Wight,England,Isle of Wight,"Moons Hill, Freshwater, Totland Bay, Isle Of Wight Po39, UK",50.672825,-1.534665,,NA,NA,1942,140,,,,,,,Length: 5 1/2 in. = 139.7mm,,3 spearheads; 3 daggers; 6 flanged axes.,"3, possibly more, org. faint ridges across blade at right angles to the flanges.","Antiquaries Journal XXII, 198-201.",,Joellen McGann,https://farm6.staticflickr.com/5581/14793156769_08918555c8_q.jpg,https://farm6.staticflickr.com/5581/14793156769_08918555c8_b.jpg,https://www.flickr.com/photos/MicroPasts/14793156769,superuser,flangedAxesA1
BAI-11432,433,Flanged Axe,,,NA,Bronze Age,p0gjgrs6qb2,,Carisbrooke Castle,,,Carisbrooke Castle,"England,Isle of Wight,Totland,Moon's Hill,(see 1st Card)",,,hillside,Totland,Isle of Wight,England,Isle of Wight,"Moons Hill, Freshwater, Totland Bay, Isle Of Wight Po39, UK",50.672825,-1.534665,,NA,NA,NA,127,,,,,,,Length: 5in = 127mm,,3 Spearheads; 3 Daggers; 6 Flanged Axes,"""A definite, but quite inefficient, ridge above the centre of the blade.""  Cable pattern on flanges.","Antiquaries Journal, XXII, 198-201.",,Joellen McGann,https://farm4.staticflickr.com/3889/14793285247_c807edf6e3_q.jpg,https://farm4.staticflickr.com/3889/14793285247_c807edf6e3_b.jpg,https://www.flickr.com/photos/MicroPasts/14793285247,superuser,flangedAxesA1
BAI-11431,433,Flanged Axe,,,NA,Bronze Age,p0gjgrs6qb2,,Carisbrooke Castle,,,Carisbrooke Castle,"England,Isle of Wight,Totland,Moon's Hill,(see 1st card)",,,hillside,Totland,Isle of Wight,England,Isle of Wight,"Moons Hill, Freshwater, Totland Bay, Isle Of Wight Po39, UK",50.672825,-1.534665,,NA,NA,NA,102,,,,,,,Length: 4 in. = 101.6mm,,3 Spearheads; 3 Daggars; 6 Flanged Axes,Very slight central ridge.,"Antiquaries Journ. XXII, 198-201.",,Joellen McGann,https://farm4.staticflickr.com/3912/14979494282_edd6604248_q.jpg,https://farm4.staticflickr.com/3912/14979494282_edd6604248_b.jpg,https://www.flickr.com/photos/MicroPasts/14979494282,superuser,flangedAxesA1
BAI-11430,433,Flanged Axe,,,NA,Bronze Age,p0gjgrs6qb2,,Carisbrooke Castle,,,Carisbrooke Castle,"England,Isle of Wight,Totland,Moon's Hill,(see 1st card)",,,hillside,Totland,Isle of Wight,England,Isle of Wight,"Moons Hill, Freshwater, Totland Bay, Isle Of Wight Po39, UK",50.672825,-1.534665,,NA,NA,NA,102,,,,,,,Length: 4 in. = 101.6mm,,"3 Spearheads, 3 Daggars, 6 Flanged Axes",Very slight central ridge.,"Antiquities Journal XXII, 198-201.",,Joellen McGann,https://farm4.staticflickr.com/3905/14793234858_8e8956ea81_q.jpg,https://farm4.staticflickr.com/3905/14793234858_8e8956ea81_b.jpg,https://www.flickr.com/photos/MicroPasts/14793234858,superuser,flangedAxesA1
BAI-11429,433,Flanged Axe,,,NA,Bronze Age,p0gjgrs6qb2,,Carisbrooke Castle,,,Carisbrooke Castle,"England,Isle of Wight,Totland,Moon's Hill,(see first card)",,,hillside,Totland,Isle of Wight,England,Isle of Wight,"Moons Hill, Freshwater, Totland Bay, Isle Of Wight Po39, UK",50.672825,-1.534665,,NA,NA,NA,83,,,,,Much corroded.,,"Length: 3 1/4"" = 82.55mm",,"3 Spearheads, 3 daggars, 6 Flanged Axes.",,"Antiquaries Journal XXII, 198-201.",,Joellen McGann,https://farm6.staticflickr.com/5565/14956853246_7960cf5307_q.jpg,https://farm6.staticflickr.com/5565/14956853246_7960cf5307_b.jpg,https://www.flickr.com/photos/MicroPasts/14956853246,superuser,flangedAxesA1
BAI-11428,433,Flanged Axe,,,NA,Bronze Age,p0gjgrs6qb2,,Carisbrooke Castle,,,Carisbrooke Castle,"England,Isle of Wight,Totland,Moon's Hill,1942,(see 1st card)",,,hillside,Totland,Isle of Wight,England,Isle of Wight,"Moons Hill, Freshwater, Totland Bay, Isle Of Wight Po39, UK",50.672825,-1.534665,,NA,NA,1942,102,,,,,Much corroded.,,Length: 4 in = 101.6mm,,"3 spearheads, 3 daggers, 6 flanged axes",Very slight central ridge.,"Antiquaries Journal XXII, 198-201",,Joellen McGann,https://farm4.staticflickr.com/3836/14793164270_5226f8cabf_q.jpg,https://farm4.staticflickr.com/3836/14793164270_5226f8cabf_b.jpg,https://www.flickr.com/photos/MicroPasts/14793164270,superuser,flangedAxesA1
BAI-11427,433,Flanged Axe,,,NA,Bronze Age,p0gjgrs6qb2,,Carisbrooke Castle,,,Carisbrooke Castle,"England,Isle of Wight,Totland,Moon's Hill,1942,(see 1st card)",,,hillside,Totland,Isle of Wight,England,Isle of Wight,"Moons Hill, Freshwater, Totland Bay, Isle Of Wight Po39, UK",50.672825,-1.534665,,NA,NA,1942,111,,,,,,,"Length: 4 3/8"" = 111.125mm",,"3 spearheads, 3 daggers, 6 flanged axes.","Slight, but definite, cental ridge. Traces of incized chevron pattern on one face. Longitudinal groove between flange-ends, round bevel.",,,Joellen McGann,https://farm6.staticflickr.com/5565/14793157819_2a9d217e62_q.jpg,https://farm6.staticflickr.com/5565/14793157819_2a9d217e62_b.jpg,https://www.flickr.com/photos/MicroPasts/14793157819,superuser,flangedAxesA1
BAI-11536,433,Flanged Axe,,,NA,Bronze Age,p0gjgrs6qb2,,"Maidstone Museum,(5) from The Charles Museum",5,,Maidstone Museum,"England,Northampton,Towcester,Whittlebury",,,,Towcester,,England,Northamptonshire,"Whittlebury, Towcester, Northamptonshire Nn12, UK",52.088948,-0.9912648,,NA,NA,NA,152,24,57,333,Dull light green patina.,"Smooth, dark bronze visible in places",6,"Width: edge 57mm; butt 24mm,Thickness: 6mm; 23mm,Weight: 333.11 gms",,,,,,Joellen McGann,https://farm4.staticflickr.com/3920/14977314841_95efc3bc44_q.jpg,https://farm4.staticflickr.com/3920/14977314841_95efc3bc44_b.jpg,https://www.flickr.com/photos/MicroPasts/14977314841,superuser,flangedAxesA1
BAI-11362,433,Flanged Axe,,,NA,Bronze Age,p0gjgrs6qb2,Frag.,"Winchester Museum,103.1",",103.1",,Winchester Museum,"England,Hampshire,Twyford,Colden Common",,,,Twyford,Winchester,England,Hampshire,"Colden Common, Hampshire, UK",50.9988195,-1.3171432,,NA,NA,NA,93,26,32,245,,,,Repeat card.,,Part of a founder's hoard.,Ridge faintly developed and placed just below mid-length of flanges.,,"Inacc.,See new index.",Joellen McGann,https://farm4.staticflickr.com/3855/14793245838_05506348cc_q.jpg,https://farm4.staticflickr.com/3855/14793245838_05506348cc_b.jpg,https://www.flickr.com/photos/MicroPasts/14793245838,superuser,flangedAxesA1
BAI-11297,433,Flanged Axe,,,NA,Bronze Age,p0gjgrs6qb2,Frag.,"Winchester Museum,No. 2,103.1","2,103.1",,Winchester Museum,"England,Hampshire,Twyford,Colden Common",,,,Twyford,Winchester,England,Hampshire,"Colden Common, Hampshire, UK",50.9988195,-1.3171432,,NA,NA,NA,93,26,32,245,,,,Width: 32mm; butt 26mm,,Part of a founder's hoard.,Ridge faintly developed and placed just below mid-length of flanges.,,"Inacc.,See new index.",Joellen McGann,https://farm4.staticflickr.com/3880/14975794771_dcc0eec1d4_q.jpg,https://farm4.staticflickr.com/3880/14975794771_dcc0eec1d4_b.jpg,https://www.flickr.com/photos/MicroPasts/14975794771,superuser,flangedAxesA1
BAI-11361,433,Flanged Axe,Butt,,NA,Bronze Age,p0gjgrs6qb2,,"Winchester, City Museum, 103.1,Given by Capt. H. W. Murray,Weeke Cottage, Winchester, 28/5/18,Old Museum no. 2.",103.1,,"Winchester, City Museum","England,Hampshire,Twyford,Colden Common",,,,Twyford,Winchester,England,Hampshire,"Colden Common, Hampshire, UK",50.9988195,-1.3171432,,NA,NA,NA,94,,,,,,,Repeat card.,,"Hoard of 13 pieces, 5 survive (rest stolen c. 1937). See also 103.2-5",,,ND75,Joellen McGann,https://farm4.staticflickr.com/3851/14793168739_e7a1735ba9_q.jpg,https://farm4.staticflickr.com/3851/14793168739_e7a1735ba9_b.jpg,https://www.flickr.com/photos/MicroPasts/14793168739,superuser,flangedAxesA1
BAI-11296,433,Flanged Axe,Butt,,NA,Bronze Age,p0gjgrs6qb2,,"Winchester, City Museum, 103.1,Given by Capt. H. W. Murray,Weeke Cottage, Winchester, 28/5/18,Old Museum no. 2.",103.1,,"Winchester, City Museum","England,Hampshire,Twyford,Colden Common",,,,Twyford,Winchester,England,Hampshire,"Colden Common, Hampshire, UK",50.9988195,-1.3171432,,NA,NA,NA,94,,,,,,,,,"Hoard of 13 pieces, 5 survive (rest stolen c. 1937) see also 103.2-5",,,ND 75,Joellen McGann,https://farm4.staticflickr.com/3912/14955902316_24dee293db_q.jpg,https://farm4.staticflickr.com/3912/14955902316_24dee293db_b.jpg,https://www.flickr.com/photos/MicroPasts/14955902316,superuser,flangedAxesA1
BAI-11789,433,Flanged Axe,,,NA,Bronze Age,p0gjgrs6qb2,,"Mr. Harry Robinson,Mortimer Collection Hull, Casts.",,,Private Collection,"England,Yorkshire,Ulrome,near Hornsey",,,,Ulrome,,England,East Riding of Yorkshire,"Ulrome, Driffield, East Riding Of Yorkshire Yo25, UK",53.995162,-0.220182,,NA,NA,NA,120,102,,595,Light brass colour patina,,26,Weight: 595.35 gms,,,Sharp cutting edge slightly serrated.,"Hull Museum Pub. No. 178, p. 27.",,Joellen McGann,https://farm4.staticflickr.com/3917/14793818237_3332a96ee1_q.jpg,https://farm4.staticflickr.com/3917/14793818237_3332a96ee1_b.jpg,https://www.flickr.com/photos/MicroPasts/14793818237,superuser,flangedAxesA1
BAI-11786,433,flanged Axe,Haft,,NA,Bronze Age,p0gjgrs6qb2,,"Bagle Gate, Bridlington",,,Private Collection,"England,Yorkshire,Ulrome,read Bridlington, South of Bridlington",,,,Ulrome,,England,East Riding of Yorkshire,"Ulrome, Driffield, East Riding Of Yorkshire Yo25, UK",53.995162,-0.220182,,NA,NA,NA,,,,454,,Hammer marks on wings.,,Weight: 16 oz = 453.592 gms,,,Broad Bronze celt. Hammered flanges. Very excellent condition. Blade very sharp.,,C. D. Pilling,Joellen McGann,https://farm6.staticflickr.com/5573/14980028672_6fc565239c_q.jpg,https://farm6.staticflickr.com/5573/14980028672_6fc565239c_b.jpg,https://www.flickr.com/photos/MicroPasts/14980028672,superuser,flangedAxesA1
BAI-11364,433,Flanged Axe,Cast,,NA,Bronze Age,p0gjgrs6qb2,,"Willis Museum, Basingstoke",,,Willis Museum Basingstoke,"England,Hampshire,Upton Grey Parish,Bidden Water,Found 1905-6 in marshy ground but later thrown back in.",,,marshland,Upton Grey,,England,Hampshire,"Upton Grey, Basingstoke, Hampshire Rg25, UK",51.228907,-0.9997455,"O.S. 6"" sheet XIX, SE",NA,NA,1905,142,,93,,,,,"Repeat card.,Length: 5.6 ins = 142.24mm,Width: 3.65 ins. (max) tip to tip of blade = 92.71mm",,,"Cast gives no clue to method used in forming the flanges, nor does it appear to have been decorated: definitely no stop ridge present.",,"Margaret C. Macfarlane, Assistant Curator.",Joellen McGann,https://farm6.staticflickr.com/5565/14793174840_bda80d7a4a_q.jpg,https://farm6.staticflickr.com/5565/14793174840_bda80d7a4a_b.jpg,https://www.flickr.com/photos/MicroPasts/14793174840,superuser,flangedAxesA1
BAI-11299,433,Flanged Axe,Cast,,NA,Bronze Age,p0gjgrs6qb2,,Willis Museum Basingstoke,,,Willis Museum Basingstoke,"Hampshire,Upton Grey Parish,Bidden Water,Found 1905-6 in marshy ground but later thrown back in.",,,,Upton Grey,,England,England,"Upton Grey, Basingstoke, Hampshire Rg25, UK",51.228907,-0.9997455,"O.S. 6"" sheed XIX, SE",NA,NA,NA,142,,93,,,,,"Length: 5.6 ins = 142.24mm,Width: 3.65 ins (max) tip to tip of blade) = 92.71mm",,,"Cast gives no clue to method used in forming the flanges, nor does it appear decorated: definitely no stop ridge present.",,"Margaret C. Macfarlane, Assistant Curator",Joellen McGann,https://farm6.staticflickr.com/5558/14978539072_121bd6ec26_q.jpg,https://farm6.staticflickr.com/5558/14978539072_121bd6ec26_b.jpg,https://www.flickr.com/photos/MicroPasts/14978539072,superuser,flangedAxesA1
BAI-11571,433,Flanged Axe,,,NA,Bronze Age,p0gjgrs6qb2,,"Smith, Mr. B.W. - private (1990), Wyncombe Hill, Fittleworth, W. Sussex, RH20 1HN,(Archaeology student at Newcastle!),Left to him in the will of an old collector, Gordon Mcpherson.",,,Private Collection,"England,Oxfordshire,River Thames,near Wallingford,Believed to be from bed of Thames near Wallingford, Oxfordshire - possibly on basis of accompanying label?",,,river,Wallingford,,England,Oxfordshire,"Wallingford, Wallingford, Oxfordshire Ox10, UK",51.600939,-1.1211164,,NA,NA,NA,137,28,87,407,,Thin dark brown patina survives patchily - rest dull greeny-brown.,14,,,Unknown,"Dimensions: L 136.5mm; We 86.8mm; Wst 33.5mm; Wbt 28mm; Tbt 2.2mm; Tst 13.5mm; maxHst 1.0 mm; Bfg 19.3; max H fg 3.8mm; Wt. 407.3 gms; T ebev 11.7mm; D e bev 24.5mm,Typology: stop of definite 'bump' form; reverse e. bev. nearly straight, obverse one more rounded and diffuse; no decoration on faces; parts of flange insides verging on overhanging.,Manufacture: Butt top flat, but slight traces of butt groove at corners; e. bevels sl. concave in profile,Condition: cutting edge intact and very sharp.,Attached Material: butt grainy deposits in flanges angles",,"Archive: PIF,Rec.: SN Dec. 90,Source: Sb.A",Joellen McGann,https://farm4.staticflickr.com/3916/14957410676_8784f3b546_q.jpg,https://farm4.staticflickr.com/3916/14957410676_8784f3b546_b.jpg,https://www.flickr.com/photos/MicroPasts/14957410676,superuser,flangedAxesA1
BAI-11392,433,Flanged Axe,Cast,,NA,Bronze Age,p0gjgrs6qb2,,"Hull Museum, 145,Original in Pexton Collection",145,,Hull Municipal Museum,"England,Humberside,Watton",,,,Watton,,England,Humberside,"Watton, Driffield, East Riding Of Yorkshire Yo25, UK",52.5699185,0.8253494,,NA,NA,NA,122,23,78,,,,,Width: 23mm butt; 78mm edge,,,,,CB,Joellen McGann,https://farm6.staticflickr.com/5592/14976750251_e38be4d974_q.jpg,https://farm6.staticflickr.com/5592/14976750251_e38be4d974_b.jpg,https://www.flickr.com/photos/MicroPasts/14976750251,superuser,flangedAxesA1
BAI-11794,433,Flanged Axe,x Cast Flanged,,NA,Bronze Age,p0gjgrs6qb2,,Hull Municipal Museum,,,Hull Municipal Museum,"England,Yorkshire E.R.,Watton Abbey",,,,Watton Abbey,,England,East Riding of Yorkshire,"Watton (e Yorks), Watton A164, Driffield, East Riding Of Yorkshire Yo25, UK",53.957484,-0.445078,,NA,NA,NA,,,,,Dull bronze-metal colour.,"Fair condition, but a good deal pitted.",,,,None.,,"To be published in Hull Mus. Br. Impt. Cat. (1941?), q.v. for details.",No decoration on flanges: straight forward - Late EBA type.,Joellen McGann,https://farm4.staticflickr.com/3904/14793696840_1abbb7b3a1_q.jpg,https://farm4.staticflickr.com/3904/14793696840_1abbb7b3a1_b.jpg,https://www.flickr.com/photos/MicroPasts/14793696840,superuser,flangedAxesA1
BAI-11795,433,Flanged Axe,"Bent,Haft-flanged Axe' in PPS 1959",,NA,Bronze Age,p0gjgrs6qb2,,Museum Leeds Phil + Lit. Society,,,Museum Leeds Phil. and Art Society,"England,Yorkshire,Weardley, near Leeds,1907",,,,Weardley,,England,West Yorkshire,"Weardley, Leeds, West Yorkshire Ls17, UK",53.8959131,-1.5497567,,NA,NA,1907,147,36,68,448,Green patina with patches of brown in places.,,30,Width: edge 68mm; centre 35.5mm,,,"Without stop-ridge, low, broad midrib down centre of blade, double curvature of sides from ridge below wings, straight butt.",,,Joellen McGann,https://farm4.staticflickr.com/3921/14793769428_cd23fa0eaa_q.jpg,https://farm4.staticflickr.com/3921/14793769428_cd23fa0eaa_b.jpg,https://www.flickr.com/photos/MicroPasts/14793769428,superuser,flangedAxesA1
BAI-11604,433,flanged Axe,Haft,,NA,Bronze Age,p0gjgrs6qb2,I4F,"Taunton Castle Museum,Deposited by Mrs. C. H. Fox 1912",,,Taunton Castle Museum,"England,Somerset,Wellington,Odand's Meadow",,,,Wellington,,England,Somerset,"Wellington, Wellington, Somerset Ta21, UK",50.97856,-3.224499,,NA,NA,NA,155,24,70,411,,,7,"Width: edge 70mm; middle 26mm; butt 24mm,Thickness: 6.5mm; 27mm",,,,"Proc. Som. A. + N.H.S. LVIII, part I, p. 108",,Joellen McGann,https://farm4.staticflickr.com/3883/14980399185_f0aa97307a_q.jpg,https://farm4.staticflickr.com/3883/14980399185_f0aa97307a_b.jpg,https://www.flickr.com/photos/MicroPasts/14980399185,superuser,flangedAxesA1
BAI-11491,433,Flanged Axe,Haft Flanged Axe in PPS 1959,,NA,Bronze Age,p0gjgrs6qb2,3,"City and County Museum, Lincoln,from the Collection of the Late Ed. Peacock, Esq, FSA, and presented by the family to the museum June 1915.,Ref. No. 297.15",,,City & County Museum,"England,Lincolnshire,West Butterwick,?1840",,,,West Butterwick,,England,Lincolnshire,"West Butterwick, Scunthorpe, North Lincolnshire Dn17, UK",53.5428481,-0.7409949,,NA,NA,1840,162,27,75,567,Reddu brown flakes over brassy green.,,29,"Width: edge 75mm; butt 27mm; 30mm,Thickness: 29mm; 9.5mm",,,Stop ridge is shallow and is beaten in and not cast.,"A label on blade states: ""West Butterwick Arc. 1840"". Does this refer to Archaeologia for that year? NO.","A paper label, stuck to the blade reads ""West Butterwick, arc 1840"", this is probably: ""West Butterwick, circ. 1840""",Joellen McGann,https://farm6.staticflickr.com/5581/14793731579_d50e0bfd77_q.jpg,https://farm6.staticflickr.com/5581/14793731579_d50e0bfd77_b.jpg,https://www.flickr.com/photos/MicroPasts/14793731579,superuser,flangedAxesA1
BAI-11656,433,Flanged Axe,,,NA,Bronze Age,p0gjgrs6qb2,,"Newbury Museum, OA 324",OA 324,,Newbury Museum,"England,Surrey,River Wey at Weybridge",,,river,Weybridge,,England,Surrey,"Weybridge, Surrey, UK",51.3727175,-0.4549297,,NA,NA,NA,140,45,,,,Matt black; undamaged.,,,,,,"PSA XXXIII (   ), 91",MJR,Joellen McGann,https://farm4.staticflickr.com/3846/14980391015_f336d88e7e_q.jpg,https://farm4.staticflickr.com/3846/14980391015_f336d88e7e_b.jpg,https://www.flickr.com/photos/MicroPasts/14980391015,superuser,flangedAxesA1
BAI-11659,433,Flanged Axe,,,NA,Bronze Age,p0gjgrs6qb2,,"(Collection G. Simmons Esq, Addlestone, Surrey),Newbury Museum, given by Mr. Alan Simmons 1932, Purchased in Weybridge,Inv. no. OA 324,Also cast in Weybridge Museum (Surrey Arch. Coll. 64, 1967, 33, fig. 5,1)",,,Private Collection,"England,Surrey,Weybridge,Dredged from the Wey, 1901 at Wey Weir",,,"river,dredged",Weybridge,,England,Surrey,"Weybridge, Surrey, UK",51.3727175,-0.4549297,,NA,NA,1901,160,27,65,433,Brown,,28,Width: butt 27mm; blade 65mm,,,,"Proc. Soc. Antiq. 2. xxxiii, 91 (1920)",,Joellen McGann,https://farm4.staticflickr.com/3887/14980047382_30bee1521a_q.jpg,https://farm4.staticflickr.com/3887/14980047382_30bee1521a_b.jpg,https://www.flickr.com/photos/MicroPasts/14980047382,superuser,flangedAxesA1
BAI-11698,433,Flanged Axe,"Bent,Haft-flanged Axe' in PPS 1959",,NA,Bronze Age,p0gjgrs6qb2,,"Private Collection,T. Sanders,Westown, Castle Road, Kenilsworth, 1930.",,,Private Collection,"England,Warwickshire,Whitley,(2 miles SE of Coventry),500 yards SW of Roman Catholic Chapel at Whitley Abbey at a depth of 3 ft,1930",,,,Whitley,,England,Warwickshire,"Whitley, Coventry, Coventry, West Midlands Cv3, UK",52.389621,-1.486899,,NA,NA,1930,149,25,64,411,,Badly pitted and covered with a thick deposit of iron oxide.,16,"Width: butt 25mm; centre 30mm; edge 64mm,Thickness: centre 16mm,Weight: 14 1/2 oz exact = 411.0681gms",,,Slight shoulders: thin stop-ridge.,,"The surface soil at the site is stony and sandy and the palstave was found close to the base of it, on Kenper Sandstone. The ground at this spot is low-lying and flat, and there is a stream a short distance away.",Joellen McGann,https://farm6.staticflickr.com/5569/14793704409_fa00966fd2_q.jpg,https://farm6.staticflickr.com/5569/14793704409_fa00966fd2_b.jpg,https://www.flickr.com/photos/MicroPasts/14793704409,superuser,flangedAxesA1
BAI-11535,433,Flanged Axe,,,NA,Bronze Age,p0gjgrs6qb2,,"Northampton Central Mus.,U.M.R. Case 6A 153,purchased",6A 153,,Northampton Central Museum,"England,Northamptonshire,Whittlebury",,,,Whittlebury,,England,Northamptonshire,"Whittlebury, Towcester, Northamptonshire Nn12, UK",52.088948,-0.9912648,,NA,NA,NA,133,21,73,276,Dark green patina,Smooth,9,"Width: edge 73mm; middle 28mm; butt 21mm,Weight: 275.5 gms",Bronze,,Good condition. Edge slightly chipped. Stop ridge has been ground away.,,,Joellen McGann,https://farm4.staticflickr.com/3837/14977315071_944a790b40_q.jpg,https://farm4.staticflickr.com/3837/14977315071_944a790b40_b.jpg,https://www.flickr.com/photos/MicroPasts/14977315071,superuser,flangedAxesA1
BAI-11123,433,Flanged Axe,,,NA,Bronze Age,p0gjgrs6qb2,,"Peterborough Museum,Donor J. Lawrence Esq.",,,Peterborough Museum,"England,Cambridgeshire,Whittlesea Mere",,,,Whittlesey,,England,Cambridgeshire,"Whittlesey, Peterborough, Cambridgeshire Pe7, UK",52.55812,-0.130081,,NA,NA,NA,97,21,51,,No patina,A yellow bronze colour with black stains.,10,"Width: edge 51mm; butt 21mm,Thickness: 10mm; 15mm",,,In perfect condition.,,Ask C. Fox ?still inaccurate,Joellen McGann,https://farm4.staticflickr.com/3870/14955831526_6c01f1bf7b_q.jpg,https://farm4.staticflickr.com/3870/14955831526_6c01f1bf7b_b.jpg,https://www.flickr.com/photos/MicroPasts/14955831526,superuser,flangedAxesA1
BAI-11125,433,Flanged Axe,,,NA,Bronze Age,p0gjgrs6qb2,,"Museum of Archaeology, Cambridge",,,MAA Cambridge,"England,Cambridgeshire,Wicken Fen,1870",,,fenland,Wicken,,England,Cambridgeshire,"Wicken Fen National Nature Reserve, Lode Lane, Wicken, Ely, Cambridgeshire Cb7 5xp, UK",52.30696895,0.277155052522493,,NA,NA,1870,151,24,67,343,,,26,"Width: edge 67mm; butt 24mm; middle 29mm,Thickness: 26mm; 18.5mm; 9mm",,,Broad flanges and low stop ridge. Indication of shield shaped ornament below the stop. Base damaged and blade chipped.,,,Joellen McGann,https://farm6.staticflickr.com/5566/14975721801_3d8c0459e2_q.jpg,https://farm6.staticflickr.com/5566/14975721801_3d8c0459e2_b.jpg,https://www.flickr.com/photos/MicroPasts/14975721801,superuser,flangedAxesA1
BAI-11124,433,Flanged Axe,,,NA,Bronze Age,p0gjgrs6qb2,,"Cambridge, University Museum, found 1870",,,MAA Cambridge,"England,Cambridgeshire,Wicken Fen",,,fenland,Wicken,,England,Cambridgeshire,"Wicken Fen National Nature Reserve, Lode Lane, Wicken, Ely, Cambridgeshire Cb7 5xp, UK",52.30696895,0.277155052522493,,NA,NA,1870,152,68,,,,"Light greeny-brown patina; edge slightly damaged, butt with notch",,,,,,,MJR,Joellen McGann,https://farm4.staticflickr.com/3881/14955831556_2a1f8cc04b_q.jpg,https://farm4.staticflickr.com/3881/14955831556_2a1f8cc04b_b.jpg,https://www.flickr.com/photos/MicroPasts/14955831556,superuser,flangedAxesA1
BAI-11559,433,Flanged Axe,,,NA,Bronze Age,p0gjgrs6qb2,,"York Museum, 1106/1948",1106/1948,,York Museum,"England,North Yorkshire (Yorks ER),Willerby,Staxton",,,,Willerby,,England,North Yorkshire,"Staxton, Scarborough, North Yorkshire Yo12, UK",54.1993785,-0.4441521,,NA,NA,NA,117,23,62,,,"Good, smooth and brown, some green encrustation and flaking; smooth brown patina; pattern on side worn",,Width: butt 23mm; edge 62mm,,,,,,Joellen McGann,https://farm6.staticflickr.com/5562/14793729670_098dea798a_q.jpg,https://farm6.staticflickr.com/5562/14793729670_098dea798a_b.jpg,https://www.flickr.com/photos/MicroPasts/14793729670,only good record,flangedAxesA1
