objectID,userID,objectType,classification,completeness,quantity,broadperiod,periodo,rightCorner,collection,museumID,collectionIdentifier,museumCollection,site,stolenStatus,hoard,discoveryContext,parish,district,country,county,toSearch,fourFigureLat,fourFigureLon,gridRef,dateDiscoveryDay,dateDiscoveryMonth,dateDiscoveryYear,length,width,edge,weight,patina,surface,thickness,other,composition,associations,description,publications,remarks,inputBy,thumbnail,imageURL,flickrURL,Processing,project
BAI-62253,433,Wire Torque,,,NA,Bronze Age,p0gjgrs6qb2,,"National Museum of Science and Art, Dublin,Plate XIII, 113, W188",W188,,"National Museum of Science & Art, Dublin",Ireland,,,,,,Ireland,,Ireland,50.8953905,-1.34809649079544,,NA,NA,NA,55.5,,,8.725,,,,,Gold,,Fragment with an ornamented collar. Made of four wires twisted together.,,,Joellen McGann,https://farm8.staticflickr.com/7336/27075981705_1e6db03a31_q.jpg,https://farm8.staticflickr.com/7336/27075981705_1e6db03a31_b.jpg,https://www.flickr.com/photos/115096994@N02/27075981705,superuser,DubiousBA
BAI-61551,580,Iron Rivet,,,NA,Bronze Age,p0gjgrs6qb2,,"London, British Museum WG 2046",WG.2046,H_WG-2046,British Museum,"Somerset,Taunton",,,,,,England,Somerset,"Taunton, Taunton, Somerset, United Kingdom",51.0147895,-3.1029086,,NA,NA,NA,,,,,,,,,,,,,Circumstances: in spearhead of bronze,Denis Antoine,https://farm2.staticflickr.com/1551/26535833306_fa19e21f1d_q.jpg,https://farm2.staticflickr.com/1551/26535833306_fa19e21f1d_b.jpg,https://www.flickr.com/photos/115096994@N02/26535833306,superuser,BitandBobsA15
BAI-14006,433,Sperhead,,,NA,Bronze Age,p0gjgrs6qb2,,"Clark, Mr. M - private,7 London Drive, Farnham Royal, Bucks,bought from Mr. Lambor, a Brighton dealer.,Formerly in the Society of Antiquaries Collection, London (apparently unnumbered) - U2,Presented 1860 by S. Roots, from the Collection of William Roots, no. 9.",,,Private Collection,"Greater London,River Thames,Kingston-upon-Thames,b) it is earlier and therefore more likely correct,""Found very near the same spot on Kingston Hill where the iron spears [no. 27] and middle hatched of bronze [no. 4] were taken up by the gravel diggers"" (a),""Bronze spearhead found May 1844 in the bed of the Thames at Kingston, 15 ft below the bed of the river, and lodged in the blue clay, at the same spot where other weapons (supposed Roman) have been found. Dr. Roots. F.S.A. Surbiton."" (b)",,,river,,Kingston upon Thames,England,Greater London,"Kingston Upon Thames, Greater London, UK",51.4096275,-0.3062621,TQ 17 69,NA,5,1844,192,25,43,,,Traces of dark brown surface - poss. original; much gold sur. - possibly due to rubbing/cleaning; odd traces of dull green. Darker brown band round socket - possibly from an old label.,,,,9 Undocumented,"Dimensions: L 191.5mm; Wbl 43; Wm 24.5; Bm 25; Ds 135,Typology: socket v. slightly elliptical,Manufacture: very slight suggestions of cg. fl. along socket sides; good edge bevel mainly,Condition: edges very sharp; part 'honed' down - probably largely modern interference,Attached Material: small patch light brown soil (?) on socket side.","a) P.S.A. 2 I (1859-61) 83 no. 9,b) Way, A. Mss. - Soc. of Antiquaries MS 700, Vol III","Labels/Markings: typed label accompanied this and another spearhead whilst in Lambor's possession: ""found Whitechurch, Salop, 1846 or 1856."",Archive: PIF,PRBAF: DF (C/S) (Soc. of Ant.); SI,Ext.: CI,Rec.: SN April 78,Source: Sb. A.,Old Cards: 1,Sub. Inf.: Clark - 13.4.78",Joellen McGann,https://farm4.staticflickr.com/3889/15003850867_440e325259_q.jpg,https://farm4.staticflickr.com/3889/15003850867_440e325259_b.jpg,https://www.flickr.com/photos/MicroPasts/15003850867,superuser,SpearHeadsA2
BAI-30072,817,Soketed Celt,,,NA,Bronze Age,p0gjgrs6qb2,UII3,"British Museum,Given by A.W. Franks Esqr.,1893.2-5.8",1893.2-5.8,,British Museum,"England.,Kent.,(Rochester (near)), Stoke, Hoo",,,,,,England,Kent,"Upper Stoke, Rochester, Medway Me3, UK",51.4235191,0.5591944,TQ8275,NA,NA,NA,98,38,,200,yellowish,corroded,34,Sizes on card shown in cm; converted here to mm.,,"Founder’s hoard,Hoard of 12 socketed celts and 9 fragments, 5 fragments of swords and 3 cakes of Metal.,1–23,2 socketed gouges, fragment of Mould, jet,",,,"Almost OK,C1",JP OConnor,https://farm8.staticflickr.com/7440/16255475309_60f8fe269e_q.jpg,https://farm8.staticflickr.com/7440/16255475309_60f8fe269e_b.jpg,https://www.flickr.com/photos/MicroPasts/16255475309,most detailed record,singleA18
BAI-29681,658,CURVED KNIFE,tanged,,NA,Bronze Age,p0gjgrs6qb2,,"British Museum, WG 1775",WG.1775,H_WG-1775,British Museum,"GREATER LONDON,R. Thames, Wandsworth",,,river,,Wandsworth,England,Greater London,"London Borough Of Wandsworth, Greater London, UK",51.45190115,-0.19950823955687,"TQ 25,74",NA,NA,NA,,,,,,,,No drawing of artifact attached.,,,,,,Susan Magyarody,https://farm8.staticflickr.com/7375/15821648073_77956b5229_q.jpg,https://farm8.staticflickr.com/7375/15821648073_77956b5229_b.jpg,https://www.flickr.com/photos/MicroPasts/15821648073,only good record,singleA18
BAI-30204,727,Rapier/Sword,,,NA,Bronze Age,p0gjgrs6qb2,,BM.  WG  1689,WG.1689,H_WG-1689,British Museum,"Greater London, R. Thames, Wandsworth, Putney",,,river,,,England,Greater London,"Putney, London Sw15, UK",51.4625524,-0.2167462,"TQ, 23, 75",NA,NA,NA,,,,,,,,,,,,,,Marla Walcott,https://farm8.staticflickr.com/7297/16254066848_b4708824d0_q.jpg,https://farm8.staticflickr.com/7297/16254066848_b4708824d0_b.jpg,https://www.flickr.com/photos/MicroPasts/16254066848,most detailed record,singleA18
BAI-28913,835,Ribbed Dagger,,,NA,Bronze Age,p0gjgrs6qb2,,"GLASGOW University. The Hunterian Museum., A. Henderson Bishop Esq., bought at Christie and Manson's from Collection Dr. Root.",,,Private Collection,"England, Surrey, dredged from the Thames., THAMES.",,,"river,dredged",,,England,Greater London,River Thames,51.4627612,-0.3171966,,NA,NA,NA,236,"57, 28",,106.31,grey green - worn off in places: very brittle.,,5,"The object type has ""[...]"" written above it. The collection description has ""P[...]"" and ""1913"" written above it, both of which have later been crossed out. In the middle of the collection description is written ""Th[...] Hall La[...]shire"" which has also been crossed out later on. There were two width measurements given. The first was for the width of the hilt and the second for the blade.",Hilt end damaged. evidence of 4 rivet holes. Edge worn. point nearly perfect,,,,"Label: Dredged from Thames, bought Dr Root's sale, at Christie and Manson's",Nyree Powell,https://farm9.staticflickr.com/8564/16079503240_c60948a142_q.jpg,https://farm9.staticflickr.com/8564/16079503240_c60948a142_b.jpg,https://www.flickr.com/photos/MicroPasts/16079503240,most detailed record,dirkspart2
BAI-59218,580,Socketed Chisel?,,,NA,Bronze Age,p0gjgrs6qb2,,,,,,"No locality, Thames?",,,river,,,England,,,51.4886,-0.1207,,NA,NA,NA,,,,,,,,,,,,,JW - Unidentified cards from BA index drawer A20.,Denis Antoine,https://farm2.staticflickr.com/1520/25071089695_441084e4a4_q.jpg,https://farm2.staticflickr.com/1520/25071089695_441084e4a4_b.jpg,https://www.flickr.com/photos/115096994@N02/25071089695,superuser,BitsandBobsPt2
BAI-59212,580,Knife/Rapier,,,NA,Bronze Age,p0gjgrs6qb2,,,,,,"Thames, London",,,river,,,England,Greater London,"Londres, United Kingdom",51.5073219,-0.1276474,,NA,NA,NA,,,,,,,,,,,,,JW - Unidentified cards from BA index drawer A20.,Denis Antoine,https://farm2.staticflickr.com/1560/24440435744_50fd9e87ef_q.jpg,https://farm2.staticflickr.com/1560/24440435744_50fd9e87ef_b.jpg,https://www.flickr.com/photos/115096994@N02/24440435744,superuser,BitsandBobsPt2
BAI-27445,433,Armlet ,,Fragment,NA,Bronze Age,p0gjgrs6qb2,Frag.,"London Museum, C.912,(From Corner Collection)",C.912,,Museum of London,"England,Greater London,Stepney?,Said to be from Limehouse",,,,,,England,Greater London,"Stepney, London E1, UK",51.5174023,-0.0462189,,NA,NA,NA,70,24,,36.4,Brown patina,Smooth,3,,,,,,"?[Shotbury] type,Inacc.",Joellen McGann,https://farm9.staticflickr.com/8634/15318716883_b98f2192fb_q.jpg,https://farm9.staticflickr.com/8634/15318716883_b98f2192fb_b.jpg,https://www.flickr.com/photos/MicroPasts/15318716883,superuser,ornamentsA15
BAI-31219,580,Horn,,,NA,Bronze Age,p0gjgrs6qb2,,BM. 54. 12-27. 46.,1854.12-27. 46.,,British Museum,"Ireland, Co. Cork, Dunmanway",,,,,,Ireland,County Cork,"Dunmanway, Co. Cork, Ireland",51.7636085,-9.07962628196258,,NA,NA,NA,,,,,,,,,,,,,,Denis Antoine,https://farm9.staticflickr.com/8600/16660657411_7b6f59fa97_q.jpg,https://farm9.staticflickr.com/8600/16660657411_7b6f59fa97_b.jpg,https://www.flickr.com/photos/MicroPasts/16660657411,superuser,irishB10
BAI-31266,580,Horn,End. blown,,NA,Bronze Age,p0gjgrs6qb2,II,Alnwick Castle No. 445.,445,,Alnwick Castle,Ireland,,,,,,Ireland,,Ireland,NA,NA,,NA,NA,NA,444,Dia. mouth 91; Upper end 45,,906.6,brown,Smooth,,,,,Ornamented with 6 projecting bosses. Upper end broken.,"JH.M. Coles, P.P.S. 1963, Vol. XXIX, No. 11, p. 356.",,Denis Antoine,https://farm9.staticflickr.com/8606/16042118713_96e2150341_q.jpg,https://farm9.staticflickr.com/8606/16042118713_96e2150341_b.jpg,https://www.flickr.com/photos/MicroPasts/16042118713,superuser,irishB10
BAI-31265,580,Horn,,Fragment,NA,Bronze Age,p0gjgrs6qb2,Frag.,Alnwick Castle. No. 446,446,,Alnwick Castle,Ireland,,,,,,Ireland,,Ireland,NA,NA,,NA,NA,NA,276,40,,382.5,bright green,fairly smooth,,,,,"Very much broken, has been compressed laterally","J.M. Coles, P.P.S. 1963, Vol. XXIX, No. 11, p. 356",,Denis Antoine,https://farm9.staticflickr.com/8631/16474632810_440b42beda_q.jpg,https://farm9.staticflickr.com/8631/16474632810_440b42beda_b.jpg,https://www.flickr.com/photos/MicroPasts/16474632810,superuser,irishB10
BAI-31264,580,Horn,End blown,,NA,Bronze Age,p0gjgrs6qb2,II,Alnwick Castle No. 447.,447,,Alnwick Castle,Ireland,,,,,,Ireland,,Ireland,NA,NA,,NA,NA,NA,408,Diameter of mouth 73; of upper end 48,,678,green & brown.,very much pitted,,,,,Has five holes round upper end. Has been broken & patched.,"J.M. Coles. P.P.S. 1963, Vol. XXIX, No. 11, p. 356",,Denis Antoine,https://farm9.staticflickr.com/8625/16660653581_d4b7c7c8af_q.jpg,https://farm9.staticflickr.com/8625/16660653581_d4b7c7c8af_b.jpg,https://www.flickr.com/photos/MicroPasts/16660653581,superuser,irishB10
BAI-27097,433,Harness Ornament,,,NA,Bronze Age,p0gjgrs6qb2,,"Private Collection,V.B. Crowther Beynon,14 Park Road, Beckenham, 4.6.20",,,Private Collection,Locality unknown,,,,,,,,,52.1307,-3.7837,,NA,NA,NA,53,,,35,Light green patina.,Smooth,10,Weight: 35.43 gms,Roman bronze.,,,,,Joellen McGann,https://farm8.staticflickr.com/7492/15750966318_b26c517096_q.jpg,https://farm8.staticflickr.com/7492/15750966318_b26c517096_b.jpg,https://www.flickr.com/photos/MicroPasts/15750966318,superuser,ornamentsA15
BAI-62359,433,Cauldron foot,,Fragment,NA,Medieval,p0gjgrsxwzx,,"Worcester Museum,Pres. by Canon A. H. Winnington Ingram",,,Worcester Museum,"England,Worcestershire,Knowle Hill",,,hillside,,,England,Worcestershire,"Worcestershire, UK",52.2109495,-2.15695551324222,,NA,NA,NA,58,30; 45,,,,,18,,,,,,,Joellen McGann,https://farm8.staticflickr.com/7197/27007600591_6457af6706_q.jpg,https://farm8.staticflickr.com/7197/27007600591_6457af6706_b.jpg,https://www.flickr.com/photos/115096994@N02/27007600591,superuser,DubiousBA
BAI-34721,580,Gorget,,,NA,Bronze Age,p0gjgrs6qb2,,"National Museum of Science & Art, Dublin, No. 46, Pl. X., Purchased from a dealer in 1856, Mus. No. W 18 (Wilde's Cat.)","No. 46, Pl. X., Purchased from a dealer in 1856, Mus. No. W 18 (Wilde's Cat.)",,"National Museum of Science & Art, Dublin","Ireland, Co Limerick, Croom, Toryhill",,,hillside,,,Ireland,Limerick,"Toryhill, Co. Limerick, Ireland",52.5365228,-8.69385997496586,,NA,NA,NA,,,,98.94,,,,,gold,,Outside edge is broken & both discs are missing. When purchased it was in 2 pieces.,,,Denis Antoine,https://farm9.staticflickr.com/8754/16819093962_dec9e4961e_q.jpg,https://farm9.staticflickr.com/8754/16819093962_dec9e4961e_b.jpg,https://www.flickr.com/photos/115096994@N02/16819093962,superuser,irishGold
BAI-63862,580,Gorget,,,NA,Bronze Age,p0gjgrs6qb2,,"National Museum of Science & Art, Dublin, Plate XI, 66, W 25. (Great Clare Find)","Plate XI, 66, W 25",,"National Museum of Science & Art, Dublin","Ireland, Co Clare, Ballykilty (dug up), 1854",,,,,,Ireland,County Clare,"Ballykilty, Co. Clare, Ireland",52.80282845,-8.86825165354268,,NA,NA,1854,,177 x 185,,203.87,,,19.5 (cup end),,Gold,,"The cup ends are hollowed, the necks of the gorget are ornamented with engraved herring-bone ornament, edged with fillets.",,,Denis Antoine,https://farm8.staticflickr.com/7398/27650298864_657be3c065_q.jpg,https://farm8.staticflickr.com/7398/27650298864_657be3c065_b.jpg,https://www.flickr.com/photos/115096994@N02/27650298864,only good record,IrishAxesB5
BAI-63823,580,Gorget,,,NA,Bronze Age,p0gjgrs6qb2,,"National Museum of Science & Art, Dublin, Plate XI, 69, W 22. (Great Clare Find)","Plate XI, 69, W 22",,"National Museum of Science & Art, Dublin","Ireland, Co Clare, Ballykilty (dug up), 1854.",,,,,,Ireland,County Clare,"Ballykilty, Co. Clare, Ireland",52.80282845,-8.86825165354268,,NA,NA,1854,152,152; 25 wide,,64.07,,,,,gold,,"Unornamented, one of the terminals has been cut off at some distance from the end; as the other terminal seems very small, a portion of it may also have been removed. A hole has been drilled through this end.",,,Denis Antoine,https://farm8.staticflickr.com/7506/28231699936_98bfd61d73_q.jpg,https://farm8.staticflickr.com/7506/28231699936_98bfd61d73_b.jpg,https://www.flickr.com/photos/115096994@N02/28231699936,only good record,IrishAxesB5
BAI-63822,580,Gorget,,,NA,Bronze Age,p0gjgrs6qb2,,"National Museum of Science & Art, Dublin, Plate XI, 74, W 23. (Great Clare Find)","Plate XI, 74, W 23",,"National Museum of Science & Art, Dublin","Ireland, Co Clare, Ballykilty (dug up), 1854.",,,,,,Ireland,County Clare,"Ballykilty, Co. Clare, Ireland",52.80282845,-8.86825165354268,,NA,NA,1854,161,160,,119.6,,,6.5,,gold,,Unornamented,,,Denis Antoine,https://farm8.staticflickr.com/7511/27650312154_cd55e8d705_q.jpg,https://farm8.staticflickr.com/7511/27650312154_cd55e8d705_b.jpg,https://www.flickr.com/photos/115096994@N02/27650312154,only good record,IrishAxesB5
BAI-63821,580,Gorget,,,NA,Bronze Age,p0gjgrs6qb2,,"National Museum of Science & Art, Dublin, Plate XI, 70, W 26. (Great Clare Find).","Plate XI, 70, W 26",,"National Museum of Science & Art, Dublin","Ireland, Co Clare, Ballykilty (dug up), 1854.",,,,,,Ireland,County Clare,"Ballykilty, Co. Clare, Ireland",52.80282845,-8.86825165354268,,NA,NA,1854,169.5,160; 30 wide,,183.6,,,12,,gold,,Terminal ends decorated with plain horizontal & perpendicular incised lines. The upper edge of the central portion is ornamented with 7 half-triangles filled with lines.,,,Denis Antoine,https://farm9.staticflickr.com/8826/28231700336_74dbed013f_q.jpg,https://farm9.staticflickr.com/8826/28231700336_74dbed013f_b.jpg,https://www.flickr.com/photos/115096994@N02/28231700336,only good record,IrishAxesB5
BAI-63820,580,Gorget,,,NA,Bronze Age,p0gjgrs6qb2,,"National Museum of Science & Art, Dublin, Plate XI, 78, W 24. (Great Clare Find).","Plate XI, 78, W 24",,"National Museum of Science & Art, Dublin","Ireland, Co Clare, Ballykilty (dug up), 1854.",,,,,,Ireland,County Clare,"Ballykilty, Co. Clare, Ireland",52.80282845,-8.86825165354268,,NA,NA,1854,,138 x 132,,70.14,,,,,gold,,Unornamented,,,Denis Antoine,https://farm9.staticflickr.com/8686/28162069592_31267cb27a_q.jpg,https://farm9.staticflickr.com/8686/28162069592_31267cb27a_b.jpg,https://www.flickr.com/photos/115096994@N02/28162069592,only good record,IrishAxesB5
BAI-34957,433,Gorget,,,NA,Bronze Age,p0gjgrs6qb2,,"National Museum of Science and Art, Dublin,No. 44 Pl. IX,Wilde's Cat. 21,(Formerly in Collection of Major H. C. Sirr)","No. 44 Pl. IX,Wilde's Cat. 21,(Formerly in Collection of Major H. C. Sirr)",,"National Museum of Science & Art, Dublin","Ireland,Co. Clare (said to have been found here)",,,,,,Ireland,County Clare,"Co. Clare, Ireland",52.85725745,-8.93743592599454,,NA,NA,NA,,,,553.6,,,,,Gold,,,,,Joellen McGann,https://farm9.staticflickr.com/8722/16632963340_c5dde0edb8_q.jpg,https://farm9.staticflickr.com/8722/16632963340_c5dde0edb8_b.jpg,https://www.flickr.com/photos/115096994@N02/16632963340,superuser,irishGold
BAI-34669,580,Gorget,,,NA,Bronze Age,p0gjgrs6qb2,,"National Museum of Science & Art, Dublin, No. 45, Pl. IX, Wilde's Cat. 17, This was formerly in the Collection of Dean H.R. Dawson.","No. 45, Pl. IX, Wilde's Cat. 17, This was formerly in the Collection of Dean H.R. Dawson.",,"National Museum of Science & Art, Dublin","Ireland, Co Tipperary, Benduff Mountain, (lying on the gravel 4 ft. deep beneath the surface of a bog at Borrisnoe on the eastern side of the Mountain), 1836.",,,bog,,,Ireland,County Tipperary,"Borrisnoe, Co. Tipperary, Ireland",52.86658485,-7.91312303003015,,NA,NA,1836,,,,126.83,,,,,gold,,,,,Denis Antoine,https://farm9.staticflickr.com/8701/16634053829_1bbf09c8e7_q.jpg,https://farm9.staticflickr.com/8701/16634053829_1bbf09c8e7_b.jpg,https://www.flickr.com/photos/115096994@N02/16634053829,superuser,irishGold
BAI-34668,580,Gorget,,,NA,Bronze Age,p0gjgrs6qb2,,"National Museum of Science & Art, Dublin, Plate VIII, 41, W 16.","Plate VIII, 41, W 16.",,"National Museum of Science & Art, Dublin","Ireland, Co Tipperary, near Nenagh, Ardcrony, found a spade's depth under the surface of a bog,",,,,,,Ireland,County Tipperary,"Ardcrony, Co. Tipperary, Ireland",52.92320505,-8.16211629392626,,NA,NA,NA,,247 x 244.5,,121.465,,,,,gold,,"The upper plate of one of the terminal bosses is missing. Decorated with 7 unornamented ribs, between which are bars decorated with rope work. The complete terminal boss has its upper surface decorated with a central spike, & 14 small knobs surrounded by concentric circles. The lower plate of the terminal discs are decorated with 5 rows of circular knobs, each row being divided by rope work. The end of the gorget was passed into a slit at the back of the lower disc, where it was attached by a corrugated line burnished into a corresponding one in the collar. The wire stitchings now to be seen, do not appear to be ancient.",,,Denis Antoine,https://farm8.staticflickr.com/7612/16632603428_b0104159ba_q.jpg,https://farm8.staticflickr.com/7612/16632603428_b0104159ba_b.jpg,https://www.flickr.com/photos/115096994@N02/16632603428,superuser,irishGold
BAI-34815,580,Gorget,,,NA,Bronze Age,p0gjgrs6qb2,,"National Museum of Science & Art, Dublin, Plate VIII, 40, W 20., formerly in the Collection of Dean H.R. Dawson.","Plate VIII, 40, W 20., formerly in the Collection of Dean H.R. Dawson.",,"National Museum of Science & Art, Dublin",locality unknown,,,,,,,,,NA,NA,,NA,NA,NA,,,,212.075,,,,,gold,,"Terminal discs are imperfect, & the upper plate of one is missing. Decorated with 5 raised bands divided by roped fillets; the upper plate of the remaining disc is ornamented with knobs encircled by concentric circles, the backs of the discs are ribbed.",,,Denis Antoine,https://farm9.staticflickr.com/8665/16612965937_683dd9e219_q.jpg,https://farm9.staticflickr.com/8665/16612965937_683dd9e219_b.jpg,https://www.flickr.com/photos/115096994@N02/16612965937,superuser,irishGold
BAI-59167,580,Chisel or Awl Blade,,,NA,Bronze Age,p0gjgrs6qb2,,,,,,"Swaffham,Norfolk",,,,,,England,Norfolk,"Swaffham, Norfolk, United Kingdom",52.6481171,0.6909259,,NA,NA,NA,,,,,,,,,,,,,JW - Unidentified cards from BA index drawer A20.,Denis Antoine,https://farm2.staticflickr.com/1593/24703452319_b980f8b758_q.jpg,https://farm2.staticflickr.com/1593/24703452319_b980f8b758_b.jpg,https://www.flickr.com/photos/115096994@N02/24703452319,superuser,BitsandBobsPt2
BAI-34720,580,Hair-ring,hollow of A section,,NA,Bronze Age,p0gjgrs6qb2,,"National Museum of Science & Art, Dublin, Plate XVIII, 407, 62, 1880., purchased from Mr. Maurice Linahen","Plate XVIII, 407, 62, 1880., purchased from Mr. Maurice Linahen",,"National Museum of Science & Art, Dublin","Ireland, Co Limerick, Limerick (said to have been found near)",,,,,,Ireland,County Limerick,"Limerick, Ireland",52.661252,-8.6301239,,NA,NA,NA,,48,,15.055,,,,,gold,This & No. 408 form a pair (Plate XVIII),"Ornamented with concentric circles round the upper & lower discs, & with a band of diagonal lines on each side of the opening.",,,Denis Antoine,https://farm9.staticflickr.com/8748/16197863344_2243f4462d_q.jpg,https://farm9.staticflickr.com/8748/16197863344_2243f4462d_b.jpg,https://www.flickr.com/photos/115096994@N02/16197863344,superuser,irishGold
BAI-34719,580,Hair-ring,hollow of A section,,NA,Bronze Age,p0gjgrs6qb2,,"National Museum of Science & Art, Dublin, Plate XVIII, 408, 62, 1880., purchased from Mr. Maurice Linahen.","Plate XVIII, 408, 62, 1880., purchased from Mr. Maurice Linahen.",,"National Museum of Science & Art, Dublin","Ireland, Co Limerick, Limerick (said to have been found near)",,,,,,Ireland,County Limerick,"Limerick, Ireland",52.661252,-8.6301239,,NA,NA,NA,,48,,12.985,,,,,gold,,Ornamented with concentric circles round the upper & lower discs & with a band of diagonal lines on each side of the opening.,,This & No. 407 form a pair (Plate XVIII),Denis Antoine,https://farm8.staticflickr.com/7608/16197862824_55900c6b8d_q.jpg,https://farm8.staticflickr.com/7608/16197862824_55900c6b8d_b.jpg,https://www.flickr.com/photos/115096994@N02/16197862824,superuser,irishGold
BAI-34763,580,Hair-ring,hollow of A section,,NA,Bronze Age,p0gjgrs6qb2,,"National Museum of Science & Art, Dublin, Plate XVIII, 401, 97, 1881, purchased from Mrs. Perry.","Plate XVIII, 401, 97, 1881, purchased from Mrs. Perry.",,"National Museum of Science & Art, Dublin","Ireland, locality unknown",,,,,,Ireland,,Ireland,NA,NA,,NA,NA,NA,,32,,4.075,,,,,gold,,"incomplete, ornamented",,,Denis Antoine,https://farm8.staticflickr.com/7611/16634114979_60611bd9e7_q.jpg,https://farm8.staticflickr.com/7611/16634114979_60611bd9e7_b.jpg,https://www.flickr.com/photos/115096994@N02/16634114979,superuser,irishGold
BAI-34762,580,Hair-ring,hollow of A section,,NA,Bronze Age,p0gjgrs6qb2,,"National Museum of Science & Art, Dublin, Plate XVIII, 402, 96, 1881, purchased from Mrs. Perry.","Plate XVIII, 402, 96, 1881, purchased from Mrs. Perry.",,"National Museum of Science & Art, Dublin","Ireland, locality unknown",,,,,,Ireland,,Ireland,NA,NA,,NA,NA,NA,,34.5,,6.2,,,,,gold,,Ornamented.,,,Denis Antoine,https://farm9.staticflickr.com/8582/16819118372_40f4aa0aaa_q.jpg,https://farm9.staticflickr.com/8582/16819118372_40f4aa0aaa_b.jpg,https://www.flickr.com/photos/115096994@N02/16819118372,superuser,irishGold
BAI-34761,580,Hair-ring,hollow of A section,,NA,Bronze Age,p0gjgrs6qb2,,"National Museum of Science & Art, Dublin, Plate XVIII, 403, W 50.","Plate XVIII, 403, W 50.",,"National Museum of Science & Art, Dublin","Ireland, locality unknown",,,,,,Ireland,,Ireland,NA,NA,,NA,NA,NA,,36,,7.88,,,,,gold,,Ornamented,,,Denis Antoine,https://farm8.staticflickr.com/7585/16632665988_ddb03a9d07_q.jpg,https://farm8.staticflickr.com/7585/16632665988_ddb03a9d07_b.jpg,https://www.flickr.com/photos/115096994@N02/16632665988,superuser,irishGold
BAI-34760,580,Hair-ring,hollow of A section,,NA,Bronze Age,p0gjgrs6qb2,,"National Museum of Science & Art, Dublin, Plate XVIII, 404, W 48., purchased from Mr. Donegan.","Plate XVIII, 404, W 48., purchased from Mr. Donegan.",,"National Museum of Science & Art, Dublin","Ireland, locality unknown",,,,,,Ireland,,Ireland,NA,NA,,NA,NA,NA,,36.5,,4.975,,,,,gold,,Composed of two thin conical plates held together by an overlapping rim. Decorated with concentric circles on its outer surfaces. incomplete.,"Proc. Royal Irish Academy, VII, pp. 131-132",,Denis Antoine,https://farm9.staticflickr.com/8646/16819116902_e0a92ce1fa_q.jpg,https://farm9.staticflickr.com/8646/16819116902_e0a92ce1fa_b.jpg,https://www.flickr.com/photos/115096994@N02/16819116902,superuser,irishGold
BAI-34759,580,Hair-ring,hollow of A section,,NA,Bronze Age,p0gjgrs6qb2,,"National Museum of Science & Art, Dublin, Plate XVIII. 405. 406., 79 1881, It formed portion of the Ray bequest.","Plate XVIII. 405. 406., 79 1881, It formed portion of the Ray bequest.",,"National Museum of Science & Art, Dublin","Ireland, locality unknown",,,,,,Ireland,,Ireland,NA,NA,,NA,NA,NA,,"No. 406: 35, No. 405: 36.5",,4.91,,,"No. 406: 19.5, No. 405: 20",,,,"The two halves are separated, the central tube is missing, as is also the over-lapping rim.",,,Denis Antoine,https://farm9.staticflickr.com/8580/16197885514_733e32d24c_q.jpg,https://farm9.staticflickr.com/8580/16197885514_733e32d24c_b.jpg,https://www.flickr.com/photos/115096994@N02/16197885514,superuser,irishGold
BAI-34758,580,Hair-ring,hollow of A section,,NA,Bronze Age,p0gjgrs6qb2,,"National Museum of Science & Art, Dublin, Plate XVIII, 409, 95, 1881., purchased from Mrs. Perry.","Plate XVIII, 409, 95, 1881., purchased from Mrs. Perry.",,"National Museum of Science & Art, Dublin","Ireland, locality unknown",,,,,,Ireland,,Ireland,NA,NA,,NA,NA,NA,,56,,21.7,,,,,gold,,Ornamented.,,,Denis Antoine,https://farm8.staticflickr.com/7604/16612928647_ef2d8c8848_q.jpg,https://farm8.staticflickr.com/7604/16612928647_ef2d8c8848_b.jpg,https://www.flickr.com/photos/115096994@N02/16612928647,superuser,irishGold
BAI-34757,580,Hair-ring,hollow of A section,,NA,Bronze Age,p0gjgrs6qb2,,"National Museum of Science & Art, Dublin, Plate XVIII, 410, 94, 1881., purchased with a number of other antiquities from Mrs. Perry.","Plate XVIII, 410, 94, 1881., purchased with a number of other antiquities from Mrs. Perry.",,"National Museum of Science & Art, Dublin","Ireland, locality unknown",,,,,,Ireland,,Ireland,NA,NA,,NA,NA,NA,,57.5,,23.25,,,,,gold,,Ornamented.,,,Denis Antoine,https://farm9.staticflickr.com/8581/16820220015_d0561095e3_q.jpg,https://farm9.staticflickr.com/8581/16820220015_d0561095e3_b.jpg,https://www.flickr.com/photos/115096994@N02/16820220015,superuser,irishGold
