PASID,objectType,broadperiod,periodFromName,periodToName,fromdate,todate,description,notes,workflow,materialTerm,secondaryMaterialTerm,subsequentActionTerm,discoveryMethod,datefound1,datefound2,TID,rallyName,weight,height,diameter,thickness,length,quantity,identifier,recorder,regionName,county,district,parish,fourFigure,gridSource,fourFigureLat,fourFigureLon,objectID,knownas,filename,imageLabel,imageCopyrightHolder,imageLicense,imageURL,thumbnail
62704,Axehead,Bronze Age,Bronze Age,BRONZE AGE,-1500,-800,"A fragment of a bronze axehead. Only the blade portion of the axe remains. The terminal opposite the blade is a broken edge, however, this break is not recent. The axe measures from the blade edge to the broken edge 38.2mm long, and is 38.1mm wide across the blade edge. At the break the axe is 15.7mm thick. 


   
   The side corners of the bladed edge taper outwards very slightly. The edge of the blade is asymmetrical. However the axe has lost its original surface, only a small trace of a heavy patina remains on one face. This patch of patina is a dark brown/green colour. Otherwise the surface is pitted and rough.",,3,,,Returned to finder,Metal detector,2004-01-26T00:00:00Z,2004-01-26T00:00:00Z,,,81.34,,,15.7,38.2,1,Angie Bolton,,West Midlands,Shropshire,Shropshire,Cleobury Mortimer,SO6876,From finder,52.381092,-2.471544,WAW-9C48F4,,WAW-9C48F4.jpg,Two views in plan and a profile view of a Bronze Age axe.,Birmingham Museums Trust,Attribution-ShareAlike License,https://finds.org.uk/images/abolton/WAW-9C48F4.jpg,https://finds.org.uk/images/thumbnails/21112.jpg
63280,Chisel,Bronze Age,Bronze Age,,-1150,-800,"Late Bronze Age Socketed chisel, double moulding at socketed end, large hole in body (damage) flaring to cutting edge, 22 x 57mm.",,4,Copper alloy,,Returned to finder,Metal detector,2004-01-01T00:00:00Z,,,,,,,,57,1,Steven Ashley,,Eastern,Suffolk,St. Edmundsbury,Horringer,,,,,NMS-1961B6,,1961B6_BA_ChiselA.jpg,Late Bronze Age chisel,Norfolk County Council,Attribution-ShareAlike License,https://finds.org.uk/images/edarch/1961B6_BA_ChiselA.jpg,https://finds.org.uk/images/thumbnails/550958.jpg
63423,Socketed Axehead,Bronze Age,Bronze Age,BRONZE AGE,-1000,-800,"
Three ribbed South Wales Type socketed axe of cast bronze. One upper face and most of the mouth top has broken away, whilst the loop is broken. This medium sized axe is slender in form, with slightly divergent sides, widening near the blade end to form an expanded blade with slight recurving at the edges. The casting seams down each side of the axe remain prominent, though seem to have been blunted and rounded, possibly through hammering. The axe has a rectangular cross section, though the face edges are slightly curved. Three well-defined longitudinal ribs extend from the underside of a prominent outsplayed mouth moulding, converging slightly towards the blade end. The blade edge has entirely corroded away, although hammer marks and striations on the blade bevel, parallel to the blade edge, indicate that the axe blade was prepared and sharpened for use. The axe has minor casting blemishes upon the inner socket surfaces and on one outer face, though not serious enough to affect it functioning as an axe, whilst the socket base is flat and deep. The mouth, break edges and blade edge are severely corroded, light green and powdery. When reported for identification there were a number of additional corroded small fragments, which had detached themselves from the axe. Most of the axe surfaces are original and have a good dark-brown to black patina.
","
Inside the socket of the axe were found well mineralised plant fragments, possibly grass stems, which were removed for study. These may have been within the socket when it was deposited within the ground.
",3,Copper alloy,,Returned to finder,Metal detector,2003-05-31T23:00:00Z,,,,161.6,,,,96.7,1,Adam Gwilt,,Wales,Rhondda Cynon Taf,Rhondda Cynon Taf,Ferndale,SS9897,From a paper map,51.662493,-3.476113,NMGW-2AA743,,DSCN2234.JPG,Less complete face,The Portable Antiquities Scheme,Attribution-ShareAlike License,https://finds.org.uk/images/mlodwick/DSCN2234.JPG,https://finds.org.uk/images/thumbnails/21642.jpg
63682,Flat Axehead,Bronze Age,Bronze Age,BRONZE AGE,-1950,-1750,"This is a large developed flat axe of bronze dating to the Early Bronze Age. The butt is modestly rounded, though with angular corners. The sides are straight, but slightly divergent for just under three quarters of the length of the axe, curving out suddenly just above the blade to a widely expanded and deeply crescentic cutting edge. All of the original blade edges have been removed by erosion, thereby preventing accurate calculation of the original width and recurve of the blade edge. Approximately 57mm from the butt end is a straight stop-ridge across the axe. The margins of the septum are defined by shallow flanges, which appear to have been hammered up, rather than being cast. The axe sides are faceted: each has an angled mid-ridge, each facet being covered with hammer marks. These tend to be aligned at a consistent diagonal angle across both facets, with no apparent pattern. Nevertheless, they provide some decorative quality to the axe sides. On one upper septum face, there are feint linear dashes or scratches running longitudinally, possibly decorative rain-drop decoration, now barely visible. On each upper blade margin there is a distinct, shallow, hammered crescentic groove, defining the edge of the blade bevel. Striations are visible on each blade bevel, indicating that the blade was prepared and sharpened. Original surfaces survive over most of the axe and these have dark brown patination. However, original surfaces have been lost on the butt, down one lower side, in patches over one blade bevel and around the blade edge. Here, the bronze has a light green patina.","This axe can be classed as Type Bandon (following Schmidt and Burgess 1981) or a probable Class 4 (follow Needham 1983; forthcoming), dating to Periods 3-4 of the Early Bronze Age (c.1950-1500 BC) (Needham 1996). Class 4 axes straddle the boundary between Periods 2 and 3, but this axe can be confidently assigned to Period 3, probably falling within the late Aylesford to Willerby metalworking phases (c.1950-1750 BC) (Needham et al. 1997). At the time of writing (Aug 2017) 27 Class 4 axes dating to this period are currently known from across Wales, the vast majority being single finds.",3,Copper alloy,,Returned to finder,Metal detector,2004-02-01T00:00:00Z,,,,319.3,,,14.9,132.1,1,Adam Gwilt,,Wales,Wrexham,Wrexham,Overton,SJ4044,From a paper map,52.989957,-2.895274,NMGW-4596D8,,,,,,,
63727,Axe,Bronze Age,Bronze Age,BRONZE AGE,-1500,-700,Fragment of a cast copper alloy axe blade of Middle to Late Bronze Age date. It is not possible to establish whether it is from a palstave or a socketed axe because there only 20mm remains of the length.,,4,,,Returned to finder,Metal detector,,,,,,,,,49.54,1,Ciorstaidh Hayward Trevarthen,Elaine Howard-Jones,South West,Dorset,West Dorset,,,,,,SOMDOR-7F8A33,,,,,,,
65225,Gouge,Bronze Age,Bronze Age,BRONZE AGE,-950,-750,"Late Bronze Age socketed gouge, probably of Ewart Park (c. 950 - 750 BC) metalworking tradition. The gouge is of circular mouth section and has a low-raised collar, which is very slightly concave and is 10mm deep from the mouth. The casting seams are prominent on both sides and are likely to have been finished by hammering. The sides are straight and diverge slightly at the blade. Sharpening striations are visible on both of the blade faces. The striations are angled across the blade, towards the sides on the front (gouged) face, and are positioned along the blade circumference on the (circular) back face. Inside the socket at the mouth are two incised or possibly cast lines; one on the rim and the other 2.5mm into the socket. The gouge is in good condition, with only a little damage to the blade edge, and has a dark brown patina.","David Coombs (1971, 251ff.; 2001, 288) presented a four category typology based on the shape and style of socketed gouges in south east England. This gouge might be most accurately placed within his Class IIa category, which is characterised by a deep collar and narrow blade. Classes of gouges are difficult to distinguish chronologically, but can be broadly dated to the Late Bronze Age, particularly the Wilburton-Ewart Park metalworking phases (c.1150-750 BC), though different forms continue in use into the Early Iron Age. Needham et al's (1997) recent study of Bronze Age chronology dated a similar collared socketed gouge from the Bodwrog Hoard, Anglesey to 2720 +- 45 BP (DoB No 3, OxA-4652, p68).",3,Copper alloy,,Returned to finder,Metal detector,2004-02-01T00:00:00Z,,,,45.6,,17.5,,75.2,1,Mark Lodwick,,Wales,the Vale of Glamorgan,the Vale of Glamorgan,Cowbridge with Llanblethian,,,,,NMGW-52C2A3,,dscn2255.JPG,Socketed gouge,The Portable Antiquities Scheme,Attribution-ShareAlike License,https://finds.org.uk/images/mlodwick/dscn2255.JPG,https://finds.org.uk/images/thumbnails/23344.jpg
65234,Palstave,Bronze Age,Bronze Age,BRONZE AGE,-1350,-1150,"Middle Bronze Age Transitional palstave of Type Shelf, (midribbed variant), dating to the end of the Middle Bronze Age. The palstave is of the Penard metalworking tradition, falling into the later part of Needham's (1996) Period 5 (c. 1500 - 1150BC). Characteristically for the type, the palstave is slender with a narrow blade, low-flanges and was looped (now broken). The butt is slightly angled and is irregular, possibly through damage. The septum is concave and the stop is straight with right angles to the flanges. The sides are straight and parallel above the stop and the flanges are rounded, forming an elipse with the blade faces. Uncharacteristically for the type, the flanges reach their apex before the stop; this variation in the flange line may be seen as an influence of later (Irish) or earlier (primary / low-flanged) palstaves. The blade sides are subtly curved and gradually diverge to an unexpanded edge, resulting in weak blade corners. The blade edge is only slightly rounded. The blade faces are convex near the stop and are decorated with a weak midrib or ridge. There is no discernible blade facet. The casting seams are visible on the sides, and have been neatly finished.",,3,Copper alloy,,Returned to finder,Metal detector,2004-02-01T00:00:00Z,,,,347,,,30.6,139,1,Mark Lodwick,,Eastern,Norfolk,North Norfolk,Briston,TG0831,From a paper map,52.836342,1.086578,NMGW-53F626,,DSCN2271.JPG,Palstace (front),The Portable Antiquities Scheme,Attribution-ShareAlike License,https://finds.org.uk/images/mlodwick/DSCN2271.JPG,https://finds.org.uk/images/thumbnails/23012.jpg
65236,Palstave,Bronze Age,Bronze Age,BRONZE AGE,-1300,-1000,"
Single-looped, narrow-bladed and slender palstave of cast bronze. Part of the butt-end of the palstave is missing, whilst the loop has broken off in antiquity. This narrow palstave form exhibits waisting below the stop, the upper sides above the stop being very slightly convex. The sides below the stop are slightly concave and curve outwards into a moderately expanding, but narrow cutting edge. The cutting edge is now blunted, but moderately crescentic in plan. A prominent midrib or mid-ridge descends from the stop on each face, whilst the face edges are rounded. This gives the palstave a lozenge shaped cross-section immediately beneath the stop. The flanges of the palstave are heavily eroded near to the stop, therefore obscuring the characteristic side view of this axe form, which appears as an elongated lozenge. In side view, the stop curves outward gradually, rather than as an angular overhang. Most of the original surfaces of the palstave are lost, with local original surface patches above the stop on each side and on one upper face. The palstave is thus heavily eroded, with extensive pitting visible along the lower blade end. The palstave has a dark green to brown patination.
","Transitional palstaves may be dated to the Middle-Late Bronze Age, specifically the Penard-Wilburton metalworking phases (c.1300-1000 BC) (Schmidt and Burgess 1981). This palstave may be classed within Schmidt and Burgess' (1981, 149-151) Type Roundhay, midribbed variant.",3,Copper alloy,,Returned to finder,Metal detector,2003-11-23T00:00:00Z,,,,177.5,,,26.8,131,1,Adam Gwilt,,Wales,Carmarthenshire,Carmarthenshire,Llandybie,SN6213,From finder,51.79857,-4.002651,NMGW-543D28,,palstave200464.jpg,Bronze Age palstave,The Portable Antiquities Scheme,Attribution-ShareAlike License,https://finds.org.uk/images/mknight21/palstave200464.jpg,https://finds.org.uk/images/thumbnails/626243.jpg
65420,Spear,Bronze Age,Bronze Age,,-2150,-800,"Bronze age copper alloy side looped socketed spearhead, 129mm long and 20mm wide. The object consists of a conical socket which is 16mm in diameter, and has two intact side loops, 10mm long. The spearhead is 60mm long, it is missing its tip and is slightly bent (discarded after it was damaged?) it also has damage to its edges. The object has a brown patina with rust coloured patches and has some corrosion.",,4,Copper alloy,,Returned to finder,Metal detector,2003-11-12T00:00:00Z,,,,,,16,,129,1,Wendy Scott,,East Midlands,Leicestershire,Blaby,Sapcote,SP4893,Centred on village (which isn't a parish),52.532759,-1.293823,LEIC-CED7F1,,CED7F1.JPG,CED7F1 Bronze age spearhead,The Portable Antiquities Scheme,Attribution-ShareAlike License,https://finds.org.uk/images/wscott/CED7F1.JPG,https://finds.org.uk/images/thumbnails/63535.jpg
65421,Awl,Bronze Age,Bronze Age,,,,"Bronze Age awl, 41.5mm in length and almost square in section at the centre (5x5.5mm).
From the centre, all four side of the awl narrow to one end, which is also square in section (2x2mm), but rounded. The tip appears to have been broken (oldish break, but not worn). 
In the opposite direction, two opposing sides also narrow while the other two opposing sides flatten. At a point c.4mm from the end, the flattening sides 'drop' while the narrowing sides narrow steeply, meeting at the end still 5.5mm wide but at a point c.0.2mm thick.
Weighs 7.57g",,4,Copper alloy,,Returned to finder,Metal detector,2004-03-06T00:00:00Z,,,,7.57,,,5.5,41.5,1,Katie Hinds,,South West,Wiltshire,Wiltshire,Stapleford,ST0538,From a paper map,51.133367,-3.359125,WILT-CED146,,BAawl.jpg,Bronze Age awl,The Portable Antiquities Scheme,Attribution-ShareAlike License,https://finds.org.uk/images/khinds/BAawl.jpg,https://finds.org.uk/images/thumbnails/23951.jpg
65424,Socketed Axehead,Bronze Age,Bronze Age,,-1000,-800,Fragment from the mouth and haft end of a Late Bronze Age socketed axe of South-Eastern type. There is a double mouth moulding and the face has two opposing curving 'hour glass' mouldings. On the interior is a prominent casting rib.,The moulded crescents are common on socketed axes and are thought to relate to contemporary winged axes.,3,,,Returned to finder,Metal detector,2004-03-31T23:00:00Z,,,,19.36,,,,37.5,1,David W Williams,,South East,Surrey,Mole Valley,Betchworth,TQ2050,From a paper map,51.236573,-0.28248,SUR-CE50F5,,03.655b.jpg,"03/655 Socketed axe fragment, interior",Surrey County Council,Attribution-ShareAlike License,https://finds.org.uk/images/dwilliams/03.655b.jpg,https://finds.org.uk/images/thumbnails/23378.jpg
65494,Spear,Bronze Age,Bronze Age,BRONZE AGE,-1600,-1100,"Socket fragment from a Middle Bronze Age side-looped spearhead, possibly falling with the Taunton-Penard metalworking phases (c.1400-1100 BC). The spearhead is represented by the socket only and none of the blade survives, making a typological classification difficult. The socket tapers gradually to the break. The two side loops (c. 19. x 6 mm) are low and flat with a roughly lozenge-shaped plate. Casting seams are clear on both sides below the loops, and have been neatly finished by filing. The striations from the filing survive around the loops. The base of the spearhead is slightly thinner, with a gentle step 5mm from the base. The casting seams have been removed before the step. The surface of the fragment has survived well with a dark brown patina.","The low, flat nature of the side loops indicate this was probably part of Davis' (2012) Group 6 (developed side-looped spearhead), which dates to the Taunton-Penard phases as defined by Needham et al. (1997). However, similar side loops can be observed on earlier spearheads dating to the preceding Acton Park 2 phase (c.1600-1400 BC), which are defined instead by the blade shape so exact dating is not possible.



This spearhead socket was not recorded by Davis (2012).",3,Copper alloy,,Returned to finder,Metal detector,2004-03-01T00:00:00Z,,,,21.3,,16,,55.6,1,Mark Lodwick,,South West,Gloucestershire,Forest of Dean,Dymock,SO6934,From finder,52.003565,-2.452997,NMGW-E250E6,,DSCN2319.JPG,Spearhead socket (side),The Portable Antiquities Scheme,Attribution-ShareAlike License,https://finds.org.uk/images/mlodwick/DSCN2319.JPG,https://finds.org.uk/images/thumbnails/23901.jpg
65713,Dirk,Bronze Age,Bronze Age,,-2200,-800,"Possible fragment of a Bronze Age weapon, possibly a dirk. This fragment is subtriangular in plan and oval in section. It is 27.28mm long, 15.58mm wide, 6.42mm thick and weighs 7.41g. It appears that this fragment could  represent part of the rib of the weapon, from which the wings of the blade flare out to either side. This object is heavily abraded and damaged with a mid green patina.",,4,Copper alloy,,Returned to finder,Unknown,,,,,7.41,,,6.42,27.28,1,Caroline McDonald,,Eastern,Essex,,,,,,,ESS-FCE930,,DSCN0808.JPG,Fragment of Bronze Age weapon reverse view,Colchester Museums,Attribution-ShareAlike License,https://finds.org.uk/images/cmcdonald/DSCN0808.JPG,https://finds.org.uk/images/thumbnails/24243.jpg
65779,Flanged Axehead,Bronze Age,Bronze Age,BRONZE AGE,-2000,-1700,"Bronze Age flanged axe head, 102mm in length, 50mm wide and 13mm thick. The object is quite corroded with patches of surface missing and a pitted surface. The axe has a rounded end with flanged sides. The axe becomes thicker towards the middle of its length, before narrowing and spalying out to form the blade whic is quite curved.",Very old record-Dec 03,3,Copper alloy,,Returned to finder,Metal detector,2003-12-14T00:00:00Z,,,,,,,13,102,1,Wendy Scott,,East Midlands,Leicestershire,Harborough,Lubenham,SP7288,From finder,52.48517862,-0.94115373,LEIC-10B3B0,,10B3B0.JPG,10B3B0 bronze age flanged axe head,The Portable Antiquities Scheme,Attribution-ShareAlike License,https://finds.org.uk/images/wscott/10B3B0.JPG,https://finds.org.uk/images/thumbnails/51033.jpg
65950,Vessel,Bronze Age,Bronze Age,IRON AGE,-1100,-800,"One small pottery body sherd, possibly from a collared urn. Hand-made and thick-walled. Largely black, reduced fabric with an oxidised brownish layer on the external surface. The fabric is tempered with fine sand with some larger pieces of grog, flint and other stone (up to 3mm). The exterior surface retains a band of vertical thumb impressed decoration (4 impressions on this small sherd). Very little abrasion.",,3,,,Returned to finder,Chance find during metal detecting,2004-01-14T00:00:00Z,,,,6.47,,,9.38,,1,Ciorstaidh Hayward Trevarthen,,South West,Dorset,North Dorset,Compton Abbas,ST8618,,50.961251,-2.200718,SOMDOR-7EEA46,,7EEA46b.jpg,Bronze Age pottery. Back,Somerset County Council,Attribution-ShareAlike License,https://finds.org.uk/images/caht/7EEA46b.jpg,https://finds.org.uk/images/thumbnails/28189.jpg
66599,Mount,Bronze Age,Bronze Age,ROMAN,-300,200,"Late iron age or Roman?? copper alloy and enamel rectangular mount, 25mm long and 19mm wide. The object is 2.5 mm thick and has no obvious fixing points, but it does have an area of iron staining in the centre of its upper surface. It is decorated with a raised line which forms a single loop which is shaped like two crescents flanking a 'diamond' area. There are traces of eneamel, now red in between.",,4,Copper alloy,Enamel,Returned to finder,Metal detector,2004-03-01T00:00:00Z,2004-05-09T23:00:00Z,,,7.79,,,2.5,25,1,Wendy Scott,Wendy Scott,South West,Gloucestershire,Tewkesbury,Tewkesbury,SO8932,Centred on village (which isn't a parish),51.986345,-2.161588,LEIC-268550,,268550.jpg,268550  roman mount,Leicestershire County Council,Attribution-ShareAlike License,https://finds.org.uk/images/wscott/268550.jpg,https://finds.org.uk/images/thumbnails/25135.jpg
66753,Flat Axehead,Bronze Age,Bronze Age,,,,"A copper alloy probable axehead, dating to the Bronze Age. The object is triangular and slightly wedge shaped in section. The edges of the axehead are rounded. The object measures 125mm in length and has a width of between 21mm and 45mm. The surface of the axe is pitted and severely corroded.",,4,Copper alloy,,Returned to finder,Metal detector,2004-05-15T23:00:00Z,,,,,,,,125,1,Philippa Walton,Philippa Walton,North East,County Durham,County Durham,Bolam,NZ1923,From finder,54.601821,-1.707408,NCL-8D0A91,,clynesaxe.jpg,Bronze Age flat axe head,The Portable Antiquities Scheme,Attribution-ShareAlike License,https://finds.org.uk/images/pwalton/clynesaxe.jpg,https://finds.org.uk/images/thumbnails/25550.jpg
66893,Flat Axehead,Bronze Age,Bronze Age,,-2150,-2000,An Early Bronze Age flat axe. The axe is in poor condition with active corrosion and with only a small area of its original surface surviving. There are no traces of either decoration or of sharpening striations. The original extent of the blade is unclear. At one point the underlying metal has been exposed in a recent gouge and this appears as a copper colour.,"Flat axes are important finds and the findspot of this example, in the northwestern fringes of the Weald, shows exploitation of this area at an early date.",3,Copper alloy,,,Metal detector,2003-01-01T00:00:00Z,,,,155,,,,100,1,David W Williams,David W Williams,South East,West Sussex,Chichester,Northchapel,SU9529,From a paper map,51.052499,-0.645997,SUR-DBBC54,,SUR_DBBC54dwg.tif,Early Bronze Age flat axe. ,Suffolk County Council,Attribution-ShareAlike License,https://finds.org.uk/images/dpett/SUR_DBBC54dwg.tif,https://finds.org.uk/images/thumbnails/55692.jpg
67186,Socketed Axehead,Bronze Age,Bronze Age,,-1000,-800,"Fragment of a late Bronze age socketed axehead, of the Ewart Park tradition and dating to c.1000-800 BC.  The object is the blade end of a looped and socketed axehead. Both blade tips, the cutting edge and a small portion of the sides and faces of the axehead are present.  It is possible that the axehead has been deliberatly broken or 'ritually killed'. It weighs 38.08g and measures 46.91mm in width and 30.55mm in length.",,3,,,Returned to finder,Metal detector,1990-01-01T00:00:00Z,,,,38.08,,,,30.55,1,Anna Marshall,Anna Marshall,Yorkshire and the Humber,Wakefield,Wakefield,South Elmsall,SE4711,Centred on village (which isn't a parish),53.593477,-1.291374,SWYOR-475FC2,,brokeaxehead.jpg,Bronze Age axehead,West Yorkshire Archaeology Service,Attribution-ShareAlike License,https://finds.org.uk/images/amarshall/brokeaxehead.jpg,https://finds.org.uk/images/thumbnails/27259.jpg
67190,Chisel,Bronze Age,Bronze Age,,-1150,-800,"Copper alloy object, possibly a Late Bronze Age chisel.  The object is solid and is broken off at one end where it is rectangular 	in section.  From this break there is a short length of the rectangular sectioned shaft surviving (L. c. 3mm.  W. 5.4mm.  Th. 4.3mm) before the object expands sharply to a larger rectangular shoulder.  From here the object tapers before expanding and becoming thinner terminating in a slightly flared, slightly convex blade  (L. 29.3mm.  W. 10.1-4.9-12.9mm.  Th. 6.9-4.3-0.6mm",,4,Copper alloy,,Returned to finder,Metal detector,2003-10-03T23:00:00Z,,,,5.46,,,6.9,32.3,1,Jodi Puls,Jodi Puls,South East,Hampshire,Test Valley,Nether Wallop,SU2936,From finder,51.122555,-1.587013,HAMP-488F45,,Hamp 488F45b.tif,?Late Bronze Age Chisel,Winchester Museum Service,Attribution-ShareAlike License,https://finds.org.uk/images/aedgoose/Hamp 488F45b.tif,https://finds.org.uk/images/thumbnails/26366.jpg
67226,Flat Axehead,Bronze Age,Bronze Age,,-2150,-800,A copper alloy flat axehead dating to the Bronze Age. The axehead is wedge shaped with a rounded cutting edge which has worn irregularly. The surface of the axehead is pitted. It measures 92mm in length and has a maximum width of 33mm. it has a maximum thickness of 5mm.,,4,Copper alloy,,Returned to finder,Metal detector,2004-01-01T00:00:00Z,,,,,,,5,92,1,Philippa Walton,Philippa Walton,North East,County Durham,County Durham,Witton Gilbert,NZ1530,From a paper map,54.664861,-1.768969,NCL-4BB675,,,,,,,
67442,Flanged Axehead,Bronze Age,Bronze Age,,-2150,-1500,"Copper-(?alloy) flanged axe of probable early Bronze Age date. The object is long and narrow, measuring 94.2mm long, by 13.8mm wide at the attachment end, and widening gradually to a maximum width of 25.9mm at the blade. The maximum thickness is towards the middle, where it is 11.3mm. From here it tapers gradually towards the blade. The flanges of the axe are 41.2mm long and only 2.5mm deep. There is a smooth break between the flanges and the main body of the axe. There is no stop ridge. There is slight damage to the blade and the object is heavily corroded. Weight = 84.28g.",Object underwent conservation at Verulamium museum.,4,Copper alloy,,Returned to finder,Metal detector,2004-03-10T00:00:00Z,,,,84.28,,,11.3,94.2,1,Julian Watters,Julian Watters,South East,Hampshire,Winchester,Bishops Waltham,SU5517,Centred on village (which isn't a parish),50.949819,-1.218419,BH-75AF41,,axe 0475 - all.jpg,Bronze Age flanged axe,The Portable Antiquities Scheme,Attribution-ShareAlike License,https://finds.org.uk/images/jwatters/axe 0475 - all.jpg,https://finds.org.uk/images/thumbnails/26603.jpg
