PASID,objectType,broadperiod,periodFromName,periodToName,fromdate,todate,description,notes,workflow,materialTerm,secondaryMaterialTerm,subsequentActionTerm,discoveryMethod,datefound1,datefound2,TID,rallyName,weight,height,diameter,thickness,length,quantity,identifier,recorder,regionName,county,district,parish,fourFigure,gridSource,fourFigureLat,fourFigureLon,objectID,knownas,filename,imageLabel,imageCopyrightHolder,imageLicense,imageURL,thumbnail
101149,Socketed Axehead,Bronze Age,Bronze Age,,-1000,-800,A fragment of a Late Bronze Age bronze socketed axe. Only the lower blade end is intact. The blade is slightly expanded and most of the cutting edge is intact. Light hammer rippling on the lower blade. The break is straight. The fragment is 36mm in length and is 57mm wide.,,3,Copper alloy,,Returned to finder,Metal detector,2005-05-31T23:00:00Z,,,,,,,,36,1,Nick Herepath,Nick Herepath,North West,Cheshire West and Chester,Cheshire West and Chester,Acton Bridge,SJ5875,,53.270315,-2.63122,LVPL-BB4B01,,lvplBB4B01a.jpg,Late Bronze Age bronze socketed axe,The Portable Antiquities Scheme,Attribution-ShareAlike License,https://finds.org.uk/images/alexw/lvplBB4B01a.jpg,https://finds.org.uk/images/thumbnails/642419.jpg
101274,Socketed Axehead,Bronze Age,Bronze Age,,-1300,-800,"An incomplete cast copper-alloy socketed axehead. The body and blade is all that survives of the axehead. The mouth and loop are missing. Most of the original brown patina is damaged and only remains in patches on the back. The remaining light green surface is slightly pitted. The body of the axe is rectangular in plan with gently flaring sides that expand slightly into the lower blade and cutting edge. Most of the front face is missing, making the inside of the socket visible. Packed tightly inside the socket end are possibly the remains of a wooden shaft. 
  The surviving length is 87.0mm, the width midway down the body is 27.0mm and the maximum thickness is 20.2mm. The width from each blade tip is 35.0mm and the weight is 104.26g.",,4,Copper alloy,,Returned to finder,Metal detector,2005-04-30T23:00:00Z,,,,104.26,,,20.2,87,1,Lisa Staves,Lisa Staves,East Midlands,Lincolnshire,West Lindsey,Gainsborough,SK8388,From a paper map,53.382337,-0.753653,NLM-D3A6B4,,NLM09258.jpg,Bronze Age axehead,North Lincolnshire Museum,Attribution-ShareAlike License,https://finds.org.uk/images/lstaves/NLM09258.jpg,https://finds.org.uk/images/thumbnails/69009.jpg
101505,Spear,Bronze Age,Bronze Age,BRONZE AGE,-1500,-800,"The object is possibly the tip of a Bronze Age spearhead. The heavy brown patina that is pitted suggests a prehistoric date. The section, which is an elongated lozenge suggests a projectile, probably a spearhead. 


  
  The object in plan is triangular with a broken lower edge. This break is not recent. In section is an elongated lozenge. 


  
  The tip measures 29.89mm long, 10.35mm wide and 3.44mm thick. It weighs 3.1g.",,4,Copper alloy,,Returned to finder,Metal detector,2003-09-23T23:00:00Z,,,,3.1,,,3.44,29.89,1,Angie Bolton,Angie Bolton,West Midlands,Warwickshire,Stratford-on-Avon,Brailes,SP3141,GPS (from the finder),52.066511,-1.549192,WAW-3A7BA3,,WAW-3A7BA3.jpg,Single view of a possible Bronze Age spearhead.,Birmingham Museums Trust,Attribution-ShareAlike License,https://finds.org.uk/images/abolton/WAW-3A7BA3.jpg,https://finds.org.uk/images/thumbnails/68883.jpg
101508,Socketed Axehead,Bronze Age,Bronze Age,,,,,,4,,,Returned to finder,Metal detector,2005-05-09T23:00:00Z,,,,21.89,,,11.7,26.15,1,Jodi Puls,Jodi Puls,South West,Wiltshire,Wiltshire,Teffont,ST9832,GPS (from the finder),51.087311,-2.029932,HAMP-3AC365,,Hamp 3AC365.tif,Late Bronze Age socketed axe<br>Hamp 3AC365,Winchester Museum Service,Attribution-ShareAlike License,https://finds.org.uk/images/jmccrohan/Hamp 3AC365.tif,https://finds.org.uk/images/thumbnails/75864.jpg
101891,Flat Axehead,Bronze Age,Bronze Age,BRONZE AGE,-2200,-1450,"A slightly incomplete cast copper early Bronze Age flat axe head, dating to between c. 2,200-1,450 BC (length: 151mm; width at blade: 60.7mm; thickness: 13.1mm; weight: exceeds weight limit of scales).  A large and heavy axe with much of the metal still existing, the butt is the thinnest point of the artefact and the width tapers outwards towards the blade which is slightly worn and broken.  Overall, the axehead is in a worn and poor condition with a pitted surface and no original surface still existing.",,4,Copper alloy,,Returned to finder,Metal detector,2005-05-31T23:00:00Z,,,,,,,13.1,151,1,Caroline Johnson,Caroline Johnson,East Midlands,Derbyshire,Derbyshire Dales,Atlow,SK2249,From a paper map,53.037827,-1.673355,WMID-B69B57,,M Jones - axe head 3.jpg,"A early Bronze Age copper axe head, dating from c. 2200-1450 BC.",Birmingham Museums Trust,Attribution-ShareAlike License,https://finds.org.uk/images/cjohnson/M Jones - axe head 3.jpg,https://finds.org.uk/images/thumbnails/69284.jpg
102542,Blade,Bronze Age,Bronze Age,MEDIEVAL,-2200,1500,"An incomplete cast bronze probable blade fragment, of an uncertain date from the Bronze Age to the Medieval period (length: 84mm; width: 28.8mm; thickness: 3.2mm; weight: 31.21g).  There is an incomplete probable rivet hole at one end, but no rivet remains.  All edges of the fragment are corroded and incomplete.  The artefact is in a worn but fair condition with a dark green patina and pitted surface.",,4,,,Returned to finder,Metal detector,2005-06-27T23:00:00Z,,,,31.21,,,3.2,84,1,Caroline Johnson,Caroline Johnson,West Midlands,Shropshire,Shropshire,Worfield,SO7294,From finder,52.543128,-2.414298,WMID-645FA6,,WMID-645FA6.jpg,"An incomplete probable blade fragment, of an uncertain date between the Bronze Age to the Medival period.",Birmingham Museums Trust,Attribution-ShareAlike License,https://finds.org.uk/images/cjohnson/WMID-645FA6.jpg,https://finds.org.uk/images/thumbnails/70254.jpg
103013,Flat Axehead,Bronze Age,Bronze Age,,-2000,,Early Bronze Age narrow-butted flat axe with expanded cutting edge. One side has raised flanges that appear to be cast rather than hammered. ,,4,Copper alloy,,Returned to finder,Metal detector,2005-05-28T23:00:00Z,,,,,,,7,97,1,Nick Herepath,Nick Herepath,North West,Cheshire West and Chester,Cheshire West and Chester,Little Budworth,SJ5664,From a paper map,53.171282,-2.659685,LVPL-E3C9F1,,LVPLE3C9F1a.jpg,,The Portable Antiquities Scheme,Attribution-ShareAlike License,https://finds.org.uk/images/alexw/LVPLE3C9F1a.jpg,https://finds.org.uk/images/thumbnails/561439.jpg
103406,Bead,Bronze Age,Bronze Age,BRONZE AGE,-2150,-800,"Bronze Age copper alloy bead fragment, 24mm in diamter and 8mm thick. It is circular in shape, with a central hole. Only half the item remains. It is an unusual find and its indentification is not definite.","
Pre P.A.S. Interpretation
",4,Copper alloy,,Returned to finder,Metal detector,2005-05-31T23:00:00Z,,,,,,24,8,,1,Richard Knox,Wendy Scott,East Midlands,Leicestershire,Blaby,Thurlaston,SP4998,From finder,52.577616,-1.278345,LEIC-22AD73,,22AD73.jpg,22AD73 Bronze Age copper alloy bead,The Portable Antiquities Scheme,Attribution-ShareAlike License,https://finds.org.uk/images/wscott/22AD73.jpg,https://finds.org.uk/images/thumbnails/71530.jpg
103563,Axe,Bronze Age,Bronze Age,BRONZE AGE,-2150,-800,"Bronze Age copper alloy axe fragment, 16mm long, 17mm wide and 5mm thick. The object is sub rectangular in form and triangular in section and probably represents the edge of an axe.","
Pre-PAS Identification
",3,Copper alloy,,Returned to finder,Metal detector,1998-08-13T23:00:00Z,,,,,,,5,16,1,Richard Knox,Wendy Scott,East Midlands,Leicestershire,Charnwood,Barkby Thorpe,SK6308,From finder,52.666063,-1.069872,LEIC-3796E7,,37A3A5.JPG,"
butt end of copper alloy bronze age axe


",,Attribution-ShareAlike License,https://finds.org.uk/images/wscott/37A3A5.JPG,https://finds.org.uk/images/thumbnails/179809.jpg
103565,Palstave,Bronze Age,Bronze Age,BRONZE AGE,-2150,-800,"Bronze Age copper alloy palstave?(butt end only), 22mm long and 24mm wide. The object is roughly rectangular in section and form and has a raised edge along two sides.","
Pre-PAS Identification
",4,Copper alloy,,Returned to finder,Metal detector,1998-08-13T23:00:00Z,,,,,,,,22,1,Richard Knox,Wendy Scott,East Midlands,Leicestershire,Charnwood,Barkby Thorpe,SK6308,From finder,52.666063,-1.069872,LEIC-37A3A5,,CAD448d.jpg,Bronze Age axe fragment,All rights reserved,Attribution-ShareAlike License,https://finds.org.uk/images/philharding/CAD448d.jpg,https://finds.org.uk/images/thumbnails/319290.jpg
103885,Chisel,Bronze Age,Bronze Age,,-2150,-750,Cast copper alloy rectangular-sectioned object with flared terminal. Both ends have a worn break. Possibly a Bronze Age chisel. The form and patina (which is an un-even green brown) possibly indicates an eastern Mediterranean origin. ,,4,Copper alloy,,Returned to finder,Metal detector,2005-07-08T23:00:00Z,,,,47.33,,,5.21,103.1,1,Andrew Richardson,Andrew Richardson,South East,Kent,Maidstone,Thurnham,TQ7957,From a paper map,51.284011,0.56539,KENT-8C2D91,,PAK150-018.JPG,KENT-8C2D91. Bronze Age chisel. Reverse.,The Portable Antiquities Scheme,Attribution-ShareAlike License,https://finds.org.uk/images/arichardson/PAK150-018.JPG,https://finds.org.uk/images/thumbnails/78857.jpg
103913,Dirk,Bronze Age,Bronze Age,BRONZE AGE,-1350,-1000,"Cast copper alloy Middle Bronze Age dirk or rapier blade. The blade narrows just below a trapzoidal shaped hilt, becoming parallel-sided, and is bent just before a worn transverse break. The hilt has two rivet holes, of 7.25mm diameter. One of these is incomplete, but the other retains a cylindrical copper alloy rivet, length 13mm by diameter 8.2mm. These rivets would have attached the handle, which would have been of an organic material such as wood or horn.



Based on the line drawing this fragment has been reidentified as a group IV dirk or rapier, and not a dagger as previously suggested. This allows the dating to be revised to being of either Middle or Late Bronze Age date most probably from the Penard metalworking industry dated to c. 1350 – 1000BC",This record has been updated by Peter Reavill (4/5/21) following information provided by Dr Brendan O'Connor.,3,Copper alloy,,Returned to finder,Metal detector,2005-08-06T23:00:00Z,,,,65.93,,,6.61,81.31,1,Andrew Richardson,Andrew Richardson,South East,Kent,Tonbridge and Malling,Aylesford,TQ7358,From a paper map,51.294847,0.479925,KENT-8D3476,,PAK150-010.JPG,KENT-8D3476. Bronze Age dagger blade.,The Portable Antiquities Scheme,Attribution-ShareAlike License,https://finds.org.uk/images/arichardson/PAK150-010.JPG,https://finds.org.uk/images/thumbnails/78848.jpg
104145,Bead,Bronze Age,Bronze Age,ROMAN,-2300,-700,"
A small diametered, thick, sub-circular sectioned cast bronze ring. These are seen from the Bronze Age onwards although in Richard Knox's opinion mostly from this early period. It is almost bead-like but presumably was designed to take some weight.
","
Pre P.A.S. Identification
",4,Copper alloy,,Returned to finder,Metal detector,2001-12-31T00:00:00Z,,,,,,21,13,,1,Richard Knox,Wendy Scott,East Midlands,Leicestershire,Charnwood,Queniborough,SK6412,From finder,52.701899,-1.054311,LEIC-B6FB92,,B6FB92.jpg,B6FB92 Medieval lead spindle whorl,The Portable Antiquities Scheme,Attribution-ShareAlike License,https://finds.org.uk/images/wscott/B6FB92.jpg,https://finds.org.uk/images/thumbnails/72190.jpg
104320,Spear,Bronze Age,Bronze Age,BRONZE AGE,-2150,-800,"Bronze Age copper alloy spear fragment, 42mm long, 15mm wide and 7mm thick. The object is sub traingular in form and lozenge shaped in section. The object is badly damaged and has semi-circular in section. It tapers in width towards the narrower tip. The object is probably part of a spear head.","
Pre P.A.S. Identification
",3,Copper alloy,,Returned to finder,Metal detector,2002-01-31T00:00:00Z,,,,,,,7,42,1,Richard Knox,Wendy Scott,East Midlands,Leicestershire,Charnwood,Barkby Thorpe,SK6208,From finder,52.666178,-1.084657,LEIC-069F75,,069F75.JPG,"069F75

bronze age spear",,Attribution-ShareAlike License,https://finds.org.uk/images/wscott/069F75.JPG,https://finds.org.uk/images/thumbnails/179763.jpg
104418,Blade,Bronze Age,Bronze Age,BRONZE AGE,-2150,-800,"Bronze Age copper alloy incomplete blade point, measuring 165mm long, 20mm wide and 6mm thick.  The blade is long and slim, with a diamond shaped cross-section which bends up at the wider end.",Pre P.A.S Identification,4,Copper alloy,,Returned to finder,Metal detector,1990-06-29T23:00:00Z,,,,,,,6,165,1,Richard Knox,Wendy Scott,East Midlands,Leicestershire,Charnwood,Thurcaston and Cropston,SK5510,From a paper map,52.684909,-1.187819,LEIC-0B3711,,0B3711.jpg,0B3711 Bronze Age copper alloy blade,The Portable Antiquities Scheme,Attribution-ShareAlike License,https://finds.org.uk/images/wscott/0B3711.jpg,https://finds.org.uk/images/thumbnails/72491.jpg
104582,Socketed Axehead,Bronze Age,Bronze Age,,-1000,-800,"Late Bronze age socketed axe of South-eastern class D. The axe has faceted body angles and a slim body. The mouth is oval and the body has 10 facets. The upper edge of the shallow collar at the mouth is damaged. On each side of the casting ridge there are two ridges that begin 7mm apart and sweep down towards the edge of the blade where they meet. This produces a clean flat blade. The axe has one side loop 21mm long and 7mm in diameter. The axe is 106mm long and the blade edge is 43mm wide. T he object is in fair condtion having quite extensive bronze disease (developed since its discovery) but otherwise has a good brown patina.  The axe is a very fine example of Bronze age casting.,",,3,Copper alloy,,Returned to finder,Metal detector,1999-01-01T00:00:00Z,,,,190,,,27,106,1,Wendy Scott,Wendy Scott,East Midlands,Leicestershire,Harborough,Slawston,SP7794,From a paper map,52.538426,-0.866152,LEIC-20A946,,20A946.JPG,20A946 late Bronze Age socketed axe,The Portable Antiquities Scheme,Attribution-ShareAlike License,https://finds.org.uk/images/wscott/20A946.JPG,https://finds.org.uk/images/thumbnails/72630.jpg
104584,Socketed Axehead,Bronze Age,Bronze Age,BRONZE AGE,-1150,-800,"Late Bronze age faceted socketed axe, 69mm long and 41mm wide. The object is in fair condition with a brown patina and some green corrosion. The axe has a circular collared socket and a body which begins with a square section and tapers down to a rectangular section 33mm long and 17mm wide. At this point the axe has snapped. The axe has prominent casting ridges down each side and one side loop, 24mm long and 10mm wide.",,4,Copper alloy,,Returned to finder,Metal detector,1999-01-01T00:00:00Z,,,,130,,,30,69,1,Wendy Scott,Wendy Scott,East Midlands,Leicestershire,Harborough,Slawston,SP7794,From a paper map,52.538426,-0.866152,LEIC-2104C3,,2104C3 b.JPG,2104C3 b Late Bronze Age socketed axe,The Portable Antiquities Scheme,Attribution-ShareAlike License,https://finds.org.uk/images/wscott/2104C3 b.JPG,https://finds.org.uk/images/thumbnails/72632.jpg
104614,Axe,Bronze Age,Bronze Age,,-2150,-1500,"Early Bronze age copper alloy flat axe, 89mm long and 42mm wide. The axe is in fair condition with a brown/green patina and weighs 95grams. The axe has a narrow and long body which begins 17mm wide and 3mm thick. It tapers gradually and reaches its thickest just under half way along its length where it is 10mm thick and 21mm wide. From this point the axe widens slightly and becomes gradually thinner until it fans out to a blade 42mm wide and 1.5mm thick.",,4,Copper alloy,,Returned to finder,Metal detector,2000-01-01T00:00:00Z,,,,95,,,10,89,1,Wendy Scott,Wendy Scott,East Midlands,Leicestershire,Charnwood,Thurcaston and Cropston,SK5510,,52.684909,-1.187819,LEIC-2EBC45,,2EBC45.JPG,2EBC45 Flat axe,The Portable Antiquities Scheme,Attribution-ShareAlike License,https://finds.org.uk/images/wscott/2EBC45.JPG,https://finds.org.uk/images/thumbnails/72633.jpg
104623,Socketed Axehead,Bronze Age,Bronze Age,BRONZE AGE,-1500,-800,"Bronze age copper alloy socketed axe fragment, 50mm long and 37mm wide. The axe is in fair condition with a green patina and weighs 50.98 grams. The axe has a rectangular section and is 20mm thick and 27mm wide where it has broken. It has a casting ridge running down the inside of its widest edge and one visible on the outer side where there is also the remains of a side loop. The blade fans out quite steeply and has clear signs of use with lipping on one side and scratch marks running from its edge.",,4,Copper alloy,,Returned to finder,Metal detector,2000-01-01T00:00:00Z,,,,50.98,,,20,50,1,Wendy Scott,Wendy Scott,East Midlands,Leicestershire,Blaby,Glenfields,SK5305,From a paper map,52.640164,-1.218204,LEIC-2F2824,,2F2824.JPG,2F2824 socketed axe,The Portable Antiquities Scheme,Attribution-ShareAlike License,https://finds.org.uk/images/wscott/2F2824.JPG,https://finds.org.uk/images/thumbnails/72634.jpg
104637,Gouge,Bronze Age,Bronze Age,,-1150,-800,"Bronze age copper alloy socketed gouge, 47mm long and 12mm in diameter. The object is in quite poor condition with a damaged upper edge. It has a brown patina and weighs 13.96grams. The object is sub-rectangular in form and sub-circular in section, tapering slightly becoming 2mm narrower at the tip. The Gouge blade is formed of a V shaped recess 29mm long which begins in teh centre of the object at 1.5mm wide, expanding to 10mm wide at the rounded flat tip.",,4,Copper alloy,,Returned to finder,Metal detector,2000-01-01T00:00:00Z,,,,13.96,,12,,47,1,Wendy Scott,Wendy Scott,East Midlands,Leicestershire,Blaby,Glenfields,SK5406,Centred on village (which isn't a parish),52.649054,-1.203264,LEIC-2F5366,,2F5366 .JPG,2F5366 socketed gouge,The Portable Antiquities Scheme,Attribution-ShareAlike License,https://finds.org.uk/images/wscott/2F5366 .JPG,https://finds.org.uk/images/thumbnails/72635.jpg
104935,Axe,Bronze Age,Bronze Age,BRONZE AGE,-1250,-800,"Bronze Age copper alloy axe butt, 27mm long, 24mm wide and 12mm thick. Only the tip survives. In section this is triangular.",Pre PAS Identification,4,Copper alloy,,Returned to finder,Metal detector,2004-12-31T00:00:00Z,,,,,,,12,27,1,Richard Knox,Wendy Scott,East Midlands,Leicestershire,Charnwood,Thurcaston and Cropston,SK5611,From a paper map,52.693796,-1.172858,LEIC-4782D7,,4782D7.jpg,4782D7 Bronze Age copper alloy axe,The Portable Antiquities Scheme,Attribution-ShareAlike License,https://finds.org.uk/images/wscott/4782D7.jpg,https://finds.org.uk/images/thumbnails/72754.jpg
105109,Spear,Bronze Age,Bronze Age,,-1500,-701,"Fragment of Middle/ Late Bronze Age bronze socketed spearhead, probably from (quite a large) flame- or leaf- shaped spearhead (possibly Greenwell & Brewis Type IV). The breaks are ancient and the fragment now very worn, although some knocks are recent. It is broken horizontally across the socket. The edges of the blade are worn although the bevelling is still visible.
The fragment is from near the tip and has broken across the socket to one side and the solid spear tip to the other. The spearhead is pointed oval in section with a broad flat mid-rib (socket 9xc.6mm).
The fragment measures 28x28x8mm and weighs 16.48g.
Spearheads of the Middle Bronze Age tend to be well crafted and survive well in the ground. I am leaning more to a Late Bronze Age date for this fragment.",,4,,,Returned to finder,Metal detector,2005-06-29T23:00:00Z,,,,16.48,,,8,28,1,Katie Hinds,Katie Hinds,South West,Wiltshire,Wiltshire,Melksham,ST9064,Centred on parish,51.37496504,-2.14505634,WILT-5DBFF5,,DCspear.jpg,Fragment of Bronze Age spearhead,Wiltshire Archaeological and Natural History Society,Attribution-ShareAlike License,https://finds.org.uk/images/khinds/DCspear.jpg,https://finds.org.uk/images/thumbnails/72914.jpg
105260,Flat Axehead,Bronze Age,Bronze Age,,-2000,-1900,"Fragment of Early Bronze Age flat axe. This fragment represents the lower body and blade of the axe. When complete it would have been a flattened lentoid in profile. The remains of the body of the axe flare broadly into the crescentic blade. The cutting edge and blade tips are now heavily worn. To either side of the body of the axe are barely perceptible, low flanges that diminish before reaching the blade. The surface of the axe is heavily pitted. The original surface has a mid green patina, but exposed lower surfaces are light green and bright green. The upper body and butt of the axe are missing. The break is almost horizontal and well worn, suggesting damage occurred in antiquity. The regular break may suggest that it was deliberately broken, perhaps for inclusion in a scrap hoard. The axe is 50.54mm long, 44.82mm wide from blade tip to tip, has a maximum thickness of 7.98mm and weighs 77.55g. It probably dates to the Aylesford phase, c.2000-1900BC.",,4,Copper alloy,,Returned to finder,Metal detector,,,,,77.55,,,7.98,50.54,1,Caroline McDonald,Caroline McDonald,Eastern,Essex,Colchester,Great Horkesley,,,,,ESS-9CA9C4,,Bowyer falt axe.jpg,Early Bronze Age flat axe,Colchester Museums,Attribution-ShareAlike License,https://finds.org.uk/images/cmcdonald/Bowyer falt axe.jpg,https://finds.org.uk/images/thumbnails/72976.jpg
105284,Weapon,Bronze Age,Bronze Age,BRONZE AGE,-1500,-800,"Fragment of copper alloy middle to late Bronze Age blade. This fragment is subsquare in plan and a flattened lentoid in section. There is no median rib or ridge. It is 31.26mm long, 37.54mm wide, 5.18mm thick and weighs 28.08g. The two cutting edges and one has a significant nick to one corner. The break edges are regular and worn. This might suggest that the blade was deliberately cut in antiquity, perhaps for inclusion in a scrap or ‘founders’ hoard. Some of the original surface survives with a mid green patina, but the mostly exposed lower surface is light green. There is a significant patch of brown corrosion to one side.",,4,Copper alloy,,Returned to finder,Metal detector,,,,,28.08,,,5.18,31.26,1,Caroline McDonald,Caroline McDonald,Eastern,Essex,Uttlesford,Hatfield Broad Oak,,,,,ESS-9E4D12,,moss blade frag.jpg,Fragment of Bronze Age bladed weapon,Colchester Museums,Attribution-ShareAlike License,https://finds.org.uk/images/cmcdonald/moss blade frag.jpg,https://finds.org.uk/images/thumbnails/72991.jpg
105455,Palstave,Bronze Age,Bronze Age,,-1500,-1300,"Cast copper alloy unlooped middle Bronze Age palstave axehead. The blade has a wide cresent shaped cutting edge that is corroded and chipped with no evidence of the original sharp edge. There is a triangular shaped recess below the stop ridge (blade end) on one side, while corrosion obscures this on the other side. The stop ridge is rectangular in plan, and diamond shaped in profile. There is an old break at the butt end. Casting scars are found down the length of both sides. Mainly dark green in colour with lighter green pitting caused by corrosion. The original polished dark brown patina is only seen in the sockets. ",,4,Copper alloy,,Returned to finder,Metal detector,2005-08-20T23:00:00Z,,,,385,,,27.49,142.62,1,Andrew Richardson,Andrew Richardson,South East,Kent,Canterbury,,TR1555,From a paper map,51.253616,1.079678,KENT-D91AF6,,PAK150-002.JPG,KENT-D91AF6. Bronze Age Palstave Axehead.,The Portable Antiquities Scheme,Attribution-ShareAlike License,https://finds.org.uk/images/arichardson/PAK150-002.JPG,https://finds.org.uk/images/thumbnails/78842.jpg
105456,Flat Axehead,Bronze Age,Bronze Age,BRONZE AGE,-1725,-1500,"Complete copper alloy low-flanged axe of Early Bronze Age date. The axe belongs to Type Arreton (following Schmidt and Burgess 1981) or Class 5 (following Needham 1983; forthcoming). It can be dated to the Arreton metalworking phase (1725-1500 cal. BC), falling within the later half of Period 4 (Needham 1996; Needham et al. 1997).



The axehead has an overall length of 122.7mm and weighs 270.7g. The butt is rounded and has a width of 20mm. The septum gradually thickens to the curved and prominent median bevel, positioned 55mm from the butt. The sides are comparatively straight and diverge slightly towards the blade, with a width at the median of 26.5mm and a width of 29mm before the sides expand to the blade. The sides are curved across their thickness. The flanges are lozenge-shaped and are longer at the rear. The flanges come to a point at the butt and because the butt is convex, it is visible as the characteristic 'projecting tongue' when viewed from the side. The flanges have a maximum breadth at the position of the median of 21.6mm. The blade side expands to produce a deep crescentic blade edge with a width of 69.6mm. Blade facets are evident c. 14mm from the blade edge and may have been highlighted by a low step upwards running across the blade which is discernible on both faces. There are striations running across the width of the axe positioned on the blade between the beginning of the flange and the stop, these may possibly be only evident here because of better surface preservation. The striations may have been intended as crude decoration. The axe has been recently treated with an applied coating. The surface, where it survives, has a dark green to black patina (exaggerated by the applied coating) and has a silvery tint, probably because of surface tin enrichment.",,3,Copper alloy,,Returned to finder,Metal detector,2005-03-01T00:00:00Z,,,,270.7,,,21.6,122.7,1,Mark Lodwick,Ruth Battye,West Midlands,Shropshire,Shropshire,Market Drayton,,,,,NMGW-D8EEE6,,2005.49.jpg,"Developed flat axe, probably Type Arreton and Early Bronze Age III date or metalworking stage five or Needham's Period 3, c. 2000-1700BC.",The Portable Antiquities Scheme,Attribution-ShareAlike License,https://finds.org.uk/images/rbattye/2005.49.jpg,https://finds.org.uk/images/thumbnails/75342.jpg
