PASID,objectType,broadperiod,periodFromName,periodToName,fromdate,todate,description,notes,workflow,materialTerm,secondaryMaterialTerm,subsequentActionTerm,discoveryMethod,datefound1,datefound2,TID,rallyName,weight,height,diameter,thickness,length,quantity,identifier,recorder,regionName,county,district,parish,fourFigure,gridSource,fourFigureLat,fourFigureLon,objectID,knownas,filename,imageLabel,imageCopyrightHolder,imageLicense,imageURL,thumbnail
795779,Hammer,Bronze Age,Bronze Age,BRONZE AGE,-800,-700,"Late Bronze Age date (c. 800 - 700 BC) socketed hammer: The cast copper alloy hammer has a rectangular mouth on the interior edge of the socket, but the exterior edge is a sub-oval. The upper edge of the mouth is damaged and incomplete, but the damage is not recent as the patina matches the side faces. The mouth, on the exterior, has a high-relief lip and high-relief band below the lip. Co-joined to the band along the edge there is a high-relief elongated triangle platform as decoration on each wide face. The interior of the mouth measures 10.96mm long and 7.73mm wide and the socket is 26.82mm deep. There is no residual material present inside the socket and the socket is slightly angled compared to the exterior edge of the mouth. The hammer, when viewed in plan, is rectangular below the band, and towards the terminal flares outwards slightly, is also slightly obliquely angled through use and is slightly convex. This terminal, when viewed from the base, is rectangular with rounded terminals. Along the sides there is a trace of a casting seam along the length of the hammer but some finishing has occurred as the seam is rounded. The surface of the hammer has an incomplete mid brown matte patina which has a slight shiny greyness to it where it has been more recently scuffed, otherwise it is abraded.



The hammer measures 51.95mm in length, 23.11mm in width, 19.34mm thickness and weighs 84.3g.



Hammers often have a higher tin content in the bronze (Evans; 1881) compared to contemporary axes. It has not been possible to metallurgically analyse this example but on the record for NMGW-475C27, a comparable example in dimensions and weight to this hammer, the recorder comments the weight may suggest a high proportion of lead, rather than tin.



The Bronze Age Guide on the PAS website (https://finds.org.uk/guides/bronzeage/objects/hammers) comments that the ""socketed hammer is only rarely found in Middle Bronze Age contexts and is a more defined feature of Late Bronze Age hoards. Rowlands (1976: 45) states that, for this very reason, 'it would be unwise to date stray finds to the MBA' With regard to decoration, they are found with or without a single rib band, and in the case of a few hoards in Britanny, some hammers were found with chevron decoration."" Another example on the PAS database with decoration to this example is NMGW-475C27.



The YORYM-ABCCE1 record for another hammer discusses the dating of socketed hammers stating that 'early examples tend to be plain with no collar, whereas later examples have collars and moulding'. With this in mind and the potential high proportion of lead, the Worcestershire hammer probably dates to the Late Bronze Age possibly dating to the Ewart-Park Phase (c. 800 - 700 BC), a phase characterised by a higher volume of leaded bronze artefacts.



Bronze Age socketed hammers are not frequently reported, with just over 40 certain examples recorded on the PAS database at the time of writing (August 2016), including CAM-5B410A, SOM-B048D1, YORYM-86F1B4, DEV-A7DFBD, SF-40FAAD, YORYM-ABCCE1, FAKL-9C9543, LVPL-5A7954, SWYOR-D13642, NMGW-475C27, LVPL766, LVPL1167, NMS1243, SF-2CF092, LVPL-89D1D3, LVPL-89D1D3, LVPL-5A7954, LVPL-5A6D83, IOW-A05DE6, HAMP-8CB626, NARC-F543D2, HAMP-2CB8E2, NMS-23EF85, SUSS-2D5992, SF-50F922, NMS-4D3FD2, LANCUM-2C7E41, HAMP-1F3730, BH-5A09F0, SF-86C4F5, IOW-8B13A7, SF-B89096, WAW-75FD95, NMGW-46A3A3, SF-F4C804, SOM-9AAFF3, LON-80850F, NMS-9B7964, NMS-03BA13, IOW-B9E2E2, and KENT-FDBC44.



This hammer and WAW-75FD95 are the only two examples on the PAS database from the West Midlands at the time of writing. The distribution for these axes on the PAS database tend to be below a line stretching from the north Norfolk coast across to St.David's in Wales and above a line stretching through Crewe to Hull. There is a narrow band across the Midlands which is, at the moment, devoid of these hammers on the database. 



Evans, J. 1881, The Ancient Bronze Implements, Weapons and Ornaments of Great Britain and Ireland Longmans, Green and Co.: London



Rowlands, M.J. 1976, The Production and Distribution of Metalwork in the Middle Bronze Age in Southern Britain: Part ii. Oxford: British Archaeological Reports.",,4,Copper alloy,,Donated to a museum,Metal detector,1943-12-31T23:00:00Z,1985-12-31T00:00:00Z,,,84.3,,,19.34,51.95,1,Angie Bolton,Angie Bolton,West Midlands,Worcestershire,Wychavon,Beckford,SO9737,From finder,52.0314004,-2.04514052,WAW-762B82,,WAW762B82.jpg,"Bronze Age Hammer (terminal, plan, profile, plan, and terminal).",Birmingham Museums Trust,Attribution License,https://finds.org.uk/images/abolton/WAW762B82.jpg,https://finds.org.uk/images/thumbnails/579430.jpg
795784,Socketed Axehead,Bronze Age,Bronze Age,BRONZE AGE,-950,-800,"Bronze Age (c. 950 to 800 BC) socketed axe: The blade portion of the copper alloy axe remains with the broken edge traversing the axe revealing a short portion of the socket. The blade has straight sides and only slightly flared blade tips. The cutting edge is blunt, and is slightly convex. The casting seam is visible on the sides, forming a slight triangular profile. One face of the axe has three parallel ribs visible, the other face has traces of these ribs, but they are not as clear. The socket is rectangular with rounded corners, but is off-centre therefore making the wall on one face very thin.



The surface of the axe has been over cleaned and has what are through to be recent scratches across the surface. There are two small patches of a heavy dark brown coloured patina, whereas the remaining surface is a mottled mid to dark green and brown colour. Despite the over-cleaning the axe is in a stable condition.



The axe measures 48.38mm in length, 41.79mm in width and 16.05mm at the thickest point, and weighs 93.5g.



The axe dates to the Ewart Park phase, and, due to the three parallel ribs extending to the blade face, is possibly a South Welsh or South Western type dating to c. 950 - 800 BC. Similarly decorated axes are illustrated in Savory (1980, Figure 25).



Savory, H.N. 1980 Guide Catalogue of the Bronze Age Collections National Museum of Wales: Cardiff",,4,Copper alloy,,Returned to finder,Metal detector,1943-12-31T23:00:00Z,1985-12-31T00:00:00Z,,,93.5,,,16.05,48.38,1,Angie Bolton,Carina Hughes,West Midlands,Worcestershire,Wychavon,Beckford,SO9737,From finder,52.0314004,-2.04514052,WAW-764F84,,WAW764F84.jpg,"Bronze Age socketed axe (plan, profile, plan and profile).",Birmingham Museums Trust,Attribution License,https://finds.org.uk/images/abolton/WAW764F84.jpg,https://finds.org.uk/images/thumbnails/586002.jpg
795789,Spear,Bronze Age,Bronze Age,BRONZE AGE,-1500,-800,"Middle or Late Bronze Age date (1500 - 800BC) socketed spear (spearhead): The copper alloy spearhead consists of the upper portion of the spear, being with only 11.24mm of the socket remaining. In section the spearhead is has a sub-circular tube with short, abraded triangular facets, one on opposite sides which are the abraded blades. The tip is missing and here the spear is a sub-square in section. The spearhead fragment is broadly sub-triangular in plan. The lower portion of the spearhead has been lost and the break is too high to include the cast side loops. The break at the base of the spearhead includes the top of the socket which is circular. The break at this point is not recent. There are no visible areas of cast or incised decoration on the spearhead. The surface of the spearhead has traces of a dark green patina, otherwise the surface is pitted and heavily abraded. 



The spearhead measures 42.78mm in length, 6.40mm in width, and weighs 7.8g.



It is likely that the spearhead can be attributed to the Middle Bronze Age; specifically the second phase of Acton Park (2), Taunton (Cemmaes) or Pennard metalworking traditions. These phases correspond with Needham's Period 5 (c. 1500 - 1150BC). However, many of the diagnostic characteristics (such as loops, peg holes and blade shape) have been lost and so a wider date range is suggested above.",,4,Copper alloy,,Returned to finder,Metal detector,1943-12-31T23:00:00Z,1985-12-31T00:00:00Z,,,7.8,,,,42.78,1,Angie Bolton,Carina Hughes,West Midlands,Worcestershire,Wychavon,Beckford,SO9737,From finder,52.0314004,-2.04514052,WAW-76615B,,WAW76615B.jpg,"Bronze Age spearhead (plan, plan and terminals).",Birmingham Museums Trust,Attribution License,https://finds.org.uk/images/abolton/WAW76615B.jpg,https://finds.org.uk/images/thumbnails/586017.jpg
795808,Spear,Bronze Age,Bronze Age,BRONZE AGE,-1500,-1150,"Middle or Late Bronze Age date (1500 - 1150 BC) socketed spear (spearhead): The copper alloy spearhead consists of two fragments of the lower half of the spearhead. The socket is incomplete, but tapers towards the blade. The socket is broken into two portions and has further fragments which are missing. On the exterior surface there is a trace of a side loop, the loop on the other side is completely missing. There is a fragment of the blade on either side of the socket, but the upper edge is broken, and this break is not recent, but the surface of the break does not have the same patina as the outer surface of the spear. There are no visible areas of cast or incised decoration on the spearhead. The surface of the spearhead has a dark shiny brown coloured patina.



The spearhead fragments measure 47.15mm in length and 12.16mm width/thickness. The second smaller piece measures 24.43mm in length and 12.12mm in width. The spearhead weighs 16.2g combined. Combined length is 71.58mm.



Similar looped spearheads have been classified by Margaret Ehrenberg as Class IV dated to the Middle Bronze Age specifically the second phase of Acton Park (2), Taunton (Cemmaes) or Pennard metalworking traditions. These phases correspond with Needham's Period 5 (c. 1500 - 1150 BC).",,4,Copper alloy,,Returned to finder,Metal detector,1943-12-31T23:00:00Z,1985-12-31T00:00:00Z,,,16.2,,,,71.58,1,Angie Bolton,Carina Hughes,West Midlands,Worcestershire,Wychavon,Beckford,SO9737,From finder,52.0314004,-2.04514052,WAW-76B07A,,WAW76B07A.jpg,"Bronze Age spearhead (plan, profile and plan).",Birmingham Museums Trust,Attribution License,https://finds.org.uk/images/abolton/WAW76B07A.jpg,https://finds.org.uk/images/thumbnails/586022.jpg
795904,Chisel,Bronze Age,Bronze Age,BRONZE AGE,-1150,-850,"A fragment of a Late Bronze Age cast copper-alloy tanged chisel (c. 1150 BC-c. 800 BC).



The chisel has a broken tapering tang which is sub-rectangular in cross-section and has a length of c. 14.1mm. This meets a collar which is sub-oval in cross-section which isi 10.4mm wide. Below the collar the blade flares in a trapezoidal shape before terminating in an old breal . The maximum width of the blade is 11.1mm wide.



The fragment is 37.1mm long, 121mm wide, 4.1mm thick and weighs 8.12 grams.



Similar shaped Bronze Age chisels have been recorded on The Portable Antiquities Scheme database. For example, see finds: BH-49EAD8; BH-E78067; DOR-F18347; DUR-5BADA1; DUR-BB5320; HAMP-488F45; IOW-2182C4; LEIC-25C336; NMGW-B23071; NMS-769173; SF-11EB51; WAW-F5FF52; WILT-5D7742 and WILT-846EE0.",,4,Copper alloy,,Returned to finder,Metal detector,,,,,8.12,,,4.1,37.1,1,Jennifer Jackson,Jennifer Jackson,South East,Hampshire,Winchester,West Meon,SU6520,Generated from computer mapping software,50.97575296,-1.07554754,KENT-77798C,,KENT77798C.jpg,KENT-77798C,Kent County Council,Attribution License,https://finds.org.uk/images/jjackson/KENT77798C.jpg,https://finds.org.uk/images/thumbnails/575476.jpg
795977,Blade,Bronze Age,Bronze Age,BRONZE AGE,-1600,-800,"Bronze age copper alloy blade fragment, 35mm long, 21mm wide and 3mm thick with a weight of 8.25grams. It is very worn and pitted. It has an eliptical cross section and is sub rectangular in form with no obvious complete edges.",,4,Copper alloy,,Returned to finder,Metal detector,,2016-06-16T23:00:00Z,,,8.25,,,3,35,1,Wendy Scott,Joyce Lee,East Midlands,Leicestershire,Melton,Bottesford,SK8237,From a paper map,52.92416219,-0.78172536,LEIC-79D261,,LEIC79D261.jpg,Bronze age copper alloy blade fragment,Leicestershire County Council,Attribution License,https://finds.org.uk/images/jmlarch84/LEIC79D261.jpg,https://finds.org.uk/images/thumbnails/575422.jpg
796817,Palstave,Bronze Age,Bronze Age,BRONZE AGE,-1500,-800,"Possibly a fragment from the blade end of a Late Bronze Age chisel or the butt of a palstave. The object is wedge shaped, with the narrow (blade?) edge slightly rounded due to wear. As the object is incomplete, it is difficult ot identify accurately, though the patina and shape would suggest a Late Bronze Age date.



Diameter: 24mm.",,4,Copper alloy,,Returned to finder,Metal detector,,,,,,,24,,,1,Jake Millar,Jake Millar,,Essex,Chelmsford,Great Waltham,TL6813,From finder,51.7904279,0.43451543,ESS-20B4F7,,036A0019.jpg,Possibly a fragment from the butt end of a Late Bronze Age Palstave.,Colchester and Ipswich Museum Service,Attribution License,https://finds.org.uk/images/jmillaa/036A0019.jpg,https://finds.org.uk/images/thumbnails/576359.jpg
797371,Socketed Axehead,Bronze Age,Bronze Age,BRONZE AGE,-1000,-800,"A fragment of a cast copper-alloy Late Bronze Age axe (c. 1000-800 BC), probably a South-Eastern type of the Ewart Park metalworking phase. The axe fragment (triangular in section) consists the convex cutting edge of the object and a small portion of the sides as the edges flare inwards slightly, though the mid and upper sections of the body have been broken away in post-depositional damage which leaves only the base of the socket still extant. The object is preserved in relatively poor condition, with an uneven greenish patina interspersed with patches of brown covering most of its surfaces. It measures 52.27mm wide at the cutting edge, 39.11mm wide at its broken end, 30.95mm long and 13.11mm thick at its thickest point. It weighs 65.88 grammes.","Comparisons for this fragment can be found in Savory 1980, fig. 24, nos. 184-185 and 189, which are also dated to the Late Bronze Age",3,Copper alloy,,Returned to finder,Metal detector,2016-07-27T23:00:00Z,,,,65.88,,,13.11,30.95,1,Alex Bliss as Finder,Alex Bliss as Finder,South West,Wiltshire,Wiltshire,Stockton,ST9535,GPS (from the finder),51.11426843,-2.07280766,PUBLIC-9D800A,,AxePUBLIC9D800A.jpg,"A fragment of a cast copper-alloy Late Bronze Age axe (c. 1000-800 BC), probably a South-Eastern type of the Ewart Park metalworking phase",The Portable Antiquities Scheme,Attribution License,https://finds.org.uk/images/EdwinWood/AxePUBLIC9D800A.jpg,https://finds.org.uk/images/thumbnails/578623.jpg
797400,Spear,Bronze Age,Bronze Age,BRONZE AGE,-1100,-800,"A copper alloy fragment of a possible socketed Spearhead of Bronze Age date (1100-800 BC). The fragment is from the socketed portion of the object and has a steeply inward curving section.



The metal is dark green in colour with a predominantly smooth patina and some minor areas of lighter green corrosion.",,4,Copper alloy,,Returned to finder,Metal detector,,,,,15.7,,,3.44,29.18,1,Miss Ellie Cox,Miss Ellie Cox,North East,County Durham,County Durham,Sedgefield,NZ2224,From finder,54.61068636,-1.6608963,DUR-9E17B1,,DUR9E17B1.jpg,DUR-9E17B1 : Socketed Spreahead,Durham County Council,Attribution License,https://finds.org.uk/images/elliecox/DUR9E17B1.jpg,https://finds.org.uk/images/thumbnails/576903.jpg
797408,Axehead,Bronze Age,Bronze Age,BRONZE AGE,-1900,-800,"A fragment of a copper-alloy axehead or palstave of Bronze Age date (1500- 800 BC). The fragment is the cutting edge of a blade which is a tapering, curved D shaped in plan. The main body of the object is missing due to an old and abraded break which runs the width of the object.



There is a slight flaring to either side of the cutting edge which hints at the original form of the object which may have been a flared flat axe such as CORN-5F6661, CORN-7DBCCC or a palstave such as LVPL-1FDB7C or WMID-D67E95



The metal is dark brown in colour with a smooth and uncorroded patina.



The breaks are old and abraded.",,3,Copper alloy,,Returned to finder,Metal detector,,,,,39.9,,,11.32,21.45,1,Miss Ellie Cox,Miss Ellie Cox,North East,County Durham,County Durham,Bishop Auckland,NZ0314,From finder,54.52128425,-1.95516538,DUR-9E3CCD,,DUR9E3CCD.jpg,DUR-9E3CCD : Axehead Fragment,Durham County Council,Attribution License,https://finds.org.uk/images/elliecox/DUR9E3CCD.jpg,https://finds.org.uk/images/thumbnails/576907.jpg
797523,Flat Axehead,Bronze Age,Bronze Age,BRONZE AGE,-2350,-2050,"A highly worn fragment of copper-alloy flat axehead of Early Bronze Age date (2350-2050 BC).



The axehead survives as the splayed crescent blade and part of the body of the axe. the blade is very worn and one side of the crescent is stunted. In profile it is broadly lentoid, with slight tapering edges. The butt is missing due to an old and abraded break however what remains tapers inward toward the butt end.The metal is brown in colour with areas of light green corrosion. The object has a heavily pitted green and mottled brown patinated surface.



Measurements: 43.76mm long, 63.21mm wide, 10.62mm thick and 132g in weight.



This axehead resembles those described as coming from the first phases of the Early Bronze Age and is comparable to (although not containing all the attributes of Migdale axes (many of these tend to have narrower butts which flare at the cutting edge).These axes all fit within the earliest phases of metal working in Britain, metalworking stage II, which corresponds to Needham's (1996) Period 2 circa 2350- 2050 CAL.BC.",,3,Copper alloy,,Returned to finder,Metal detector,,,,,133,,,10.62,43.76,1,Mags Erwin,Mags Erwin,South East,Kent,Swale,Minster-on-Sea,TQ9872,GPS (from the finder),51.41243888,0.8458364,KENT-A1066C,,KENTA1066C.jpg,A fragment of Bronze Age flat axe,Kent County Council,Attribution License,https://finds.org.uk/images/ucljo/KENTA1066C.jpg,https://finds.org.uk/images/thumbnails/577302.jpg
797991,Horse Trapping,Bronze Age,Bronze Age,IRON AGE,-1150,-300,Late Bronze/Early Iron Age copper ring dating between 1150-300BC. The object is probably part of horse trappings possibly used for reins (terret ring). It is circular in shape with a round section. The diameter is 40mm and the weight 27.80g.,,4,Copper alloy,,Returned to finder,Metal detector,2016-06-01T23:00:00Z,2016-06-01T23:00:00Z,,,27.8,,40,,,1,Stuart Noon,Stuart Noon,North West,Lancashire,Ribble Valley,Rimington,SD8045,From finder,53.90077622,-2.30586625,LANCUM-0B60F3,,LANCUM0B60F3.jpg,,The Portable Antiquities Scheme,Attribution License,https://finds.org.uk/images/snoon/LANCUM0B60F3.jpg,https://finds.org.uk/images/thumbnails/577516.jpg
798063,Socketed Axehead,Bronze Age,Bronze Age,BRONZE AGE,-1150,-800,"A tip fragment of a late Bronze Age axe, it has a curved blade with probable small wings. The fragment has what looks to be the bottom of the socket within the centre of the broken region. Hence, this is most likely to be c. 1000 - 800 BC similar to the Llyn Fawr phase.



The surface is mottled mid-green with brown staining.",,4,Copper alloy,,Returned to finder,Metal detector,2013-09-07T23:00:00Z,,,"Weekend Wanderers - Segsbury Camp, Wantage, Oxon 2013",1.7,,,2.4,28,1,Rod Trevaskus,Rod Trevaskus,South East,Oxfordshire,Vale of White Horse,Letcombe Regis,SU3983,From a paper map,51.54455436,-1.43900311,BERK-1A9329,,BERK1A9329.JPG,,The Portable Antiquities Scheme,Attribution License,https://finds.org.uk/images/rod/BERK1A9329.JPG,https://finds.org.uk/images/thumbnails/577566.jpg
798214,Palstave,Bronze Age,Bronze Age,BRONZE AGE,-1500,-1300,"A complete copper alloy Middle Bronze Age palstave axehead (c.1500-c.1300 BC). The axehead is a Group I (shield-pattern) type from the Acton Park phase of Bronze Age metalwork, distinguished by its shield-shaped decoration below the stop ridge. Overall, the palstave axehead measures c.158mm long, 71.2mm wide and 34.5mm thick. It weighs over 500g (the object was recorded at an event and the only scales available measured up to 500g).","This object was recorded at the University of Nottingham's 3rd Annual Nottinghamshire Local History and Archaeology Day. It was brought in on behalf of the finder and was not lent to the FLO for full recording. As a result, this record may not meet the normal standards of the PAS.",4,Copper alloy,,Returned to finder,Agricultural or drainage work,,,,,,,,34.5,158,1,Alastair Willis,Alastair Willis,East Midlands,Nottinghamshire,Mansfield,Warsop,SK5869,Centred on field,53.21490213,-1.13290703,DENO-205757,,DENO205757.jpg,Middle Bronze Age palstave axehead,Derby Museums Trust,Attribution License,https://finds.org.uk/images/awillis/DENO205757.jpg,https://finds.org.uk/images/thumbnails/577692.jpg
798423,Finger Ring,Bronze Age,Bronze Age,BRONZE AGE,-1400,-1150,"A copper alloy finger ring of Middle Bronze Age date (c. 1400-1150 BC). The ring consists of a single copper alloy bar, oval in cross-section which has been coiled to create the finger ring. It now has one complete loop and two incomplete loops. It appears to be complete, although both terminals exhibt traces of damage. The ring has a smooth dark green patina, with occasional pitting.



This example is similar to a number of coiled rings found in a Middle Bronze Age hoard found in Sussex, recorded under SUSS-C5D042. Similar rings have been found in the Mecklenburg area of North Germany suggesting close associations with the Continent. A brief period in the Middle Bronze Age is marked by the occurrence, in hoards, of tools and bronze ornaments which owe their inspiration to types current in north Germany and Scandinavia from c.1400 BC. These include torcs, coiled finger rings, ribbed bracelets, knobbed sickles, and square-mouthed socketed axes. This influx seems to have given a boost to the native bronze industry.



Other similar objects recorded on the database include: WILT-6F5708; NCL-DA41F5; LANCUM-A4E905 & SWYOR-3FF370. 



It measures 28.48mm in diameter (internal diameter 19.25mm), is 4.27mm thick, 14.94mm high and weighs 23.74g.",,3,Copper alloy,,Returned to finder,Metal detector,,,,,23.74,14.94,28.48,4.27,,1,Julie Dawn Shoemark,Julie Dawn Shoemark,South West,Somerset,Sedgemoor,Axbridge,ST4354,From finder,51.28227423,-2.81865291,SOM-36B525,,SOM36B525.jpg,Middle Bronze Age finger ring,The Portable Antiquities Scheme,Attribution License,https://finds.org.uk/images/jshoemark3/SOM36B525.jpg,https://finds.org.uk/images/thumbnails/577806.jpg
