PASID,objectType,broadperiod,periodFromName,periodToName,fromdate,todate,description,notes,workflow,materialTerm,secondaryMaterialTerm,subsequentActionTerm,discoveryMethod,datefound1,datefound2,TID,rallyName,weight,height,diameter,thickness,length,quantity,identifier,recorder,regionName,county,district,parish,fourFigure,gridSource,fourFigureLat,fourFigureLon,objectID,knownas,filename,imageLabel,imageCopyrightHolder,imageLicense,imageURL,thumbnail
777234,Flat Axehead,Bronze Age,Bronze Age,BRONZE AGE,-2050,-1700,"Copper alloy developed flat axe of Aylesford type (Schmidt & Burgess, 1981). The axe is dark yellowish brown with an even surface patina except in a few places where green patina is visible. There are a number of shallow grooves on both faces of the blade indicative of use rather than recent damage in the ploughsoil. It measures 58 mm in length but the butt is missing. The break is just behind a median bevelled stop and is patinated consistent with the rest of the axe perhaps suggesting breakage in use. Width at the crescentic cutting edge is 50.5 mm and the axe weighs 89.3 gm with a maximum thickness of 9.2 mm. It has vertically faceted sides worked into slight flanges. No evidence for decoration. It is very similar to an axe from Hutton Cranswick, East Riding, Yorkshire (Schmidt & Burgess, 1981, p. 61 & Plate 37, 316). The axe fits within Needham's Period 3 (MA IV) 2050-1700 CAL BC (Needham, 1996).



References



Needham, S. (1996). Chronology and Periodisation in the British Bronze Age. Acta Archaeologia, 67, 121-140.



Schmidt, P. K., & Burgess, C. B. (1981). The Axes of Scotland and Northern England. München: Beck.",,4,Copper alloy,,Returned to finder,Metal detector,,,,,89.3,,,9.2,58,1,Peter Chowne,Peter Chowne,East Midlands,Lincolnshire,North Kesteven,Heighington,TF0569,GPS (from the finder),53.20770643,-0.4293063,LIN-4D4DF6,,LIN4D4DF6.jpg,Early Bronze Age flat axe,Lincolnshire County Council,Attribution-ShareAlike License,https://finds.org.uk/images/adaubney/LIN4D4DF6.jpg,https://finds.org.uk/images/thumbnails/561907.jpg
777635,Palstave,Bronze Age,Bronze Age,BRONZE AGE,-1500,-1100,"A fragment of a copper alloy palstave dating from the Middle to Late Bronze Age c. 1500 - 1150 BC. The fragment is sub-rectangular in shape the butt and a fragment of the flanged sides survive. The axe has anangular butt and the sides gradually widen towards the break. Both sides of the palstave have high developed flanges, which increase gradually from the butt to from sub-triangular sides. The sides are unfinished, as you can still see the ridges from the casting process.



The faces of the axe fragment are slightly concave, creating a H-shaped cross-section. The faces of the axe show signs of wear, such as scratches and the break is even and patinated, suggesting that the object was broken in antiquity. Due to the fragmentary nature of the object, it is difficult to confidently assign a Type.



The fragment measures 27.12mm in length, 25.93mm wide, 12.78mm thick and weighs 19.78 grams.",,4,Copper alloy,,Returned to finder,Metal detector,,,,,19.78,,,12.78,27.12,1,Fiona Johnstone,Fiona Johnstone,South West,Wiltshire,Wiltshire,Shrewton,SU0844,,51.19516483,-1.88689397,WILT-669FA1,,9963.jpg,Bronze Age palstave,The Portable Antiquities Scheme,Attribution License,https://finds.org.uk/images/cristinasanna/9963.jpg,https://finds.org.uk/images/thumbnails/568061.jpg
777732,Palstave,Bronze Age,Bronze Age,BRONZE AGE,-1500,-1400,"A complete copper alloy palstave of the Middle Bronze Age Acton Park II period c. 1500-1400 BC. The palstave has a deep flange with upright stop; the butt of the palstave narrows slightly from the septum. Casting lines are visible on either side and there does not appear to be a side loop (unlooped palstave). The blade of the palstave flares gently outwards from the stop and although the blade tips are damaged it does not appear to have had a pronounced crescentic cutting edge. There is a narrow linear indentation on one face of the palstave on the blade below the stop which may be the remains of a shield-shaped indent; this is not repeated on the opposing face and therefore may to the result of of an imperfect mould rather than intentional. The flange is c. 77mm tall at the stop, and the back end of the palstave from the stop measures 65mm in length. The blade is 85.6mm long, 55mm wide and 3.2mm thick at the tip. The whole object is 164mm long. The palstave is suffering from bronze disease on all sufaces.



The lack of a side loop and lack of any ribs suggest it maybe relatively early and is probably of the Acton Park II period, c.1500-1400 BC. It is perhaps similar to example from Cwm Rheidol, Cardiganshire, and Arthog, Merioneth. (Savory (1980:130, figs 19, 20, no. 135 and 138).",,4,Copper alloy,,Returned to finder,Metal detector,2016-02-21T00:00:00Z,,,,359.8,,,22.8,164,1,Anni Byard,Anni Byard,South East,Oxfordshire,Vale of White Horse,Kingston Bagpuize with Southmoor,SU4096,GPS (from the finder),51.66136563,-1.42310504,BERK-773E87,,OXPAS2015724.jpg,Bronze Age Palstave: Palstave,Oxfordshire County Council,Attribution License,https://finds.org.uk/images/abyard/OXPAS2015724.jpg,https://finds.org.uk/images/thumbnails/562392.jpg
779148,Sword,Bronze Age,Bronze Age,BRONZE AGE,-1000,-800,"A fragment of a Late Bronze age sword, probably dating to the Ewart Park phase (1,000-800BC). Only part of the blade survives, being roughly rectangular in shape with a ridge running down the centre on both sides. The object has a mid-dark green patina. The blade edges are very worn and no longer exist. 



Two similar examples with a lozenge-shaped section are illustrated in Needham & Rohl (1998, 135, fig.37, nos.386-7).



Dimensions: length: 41.28 mm; width: 21.97 mm; thickness: 7.21 mm; weight: 19.86g.",,4,Copper alloy,,Returned to finder,Metal detector,,,,,19.86,,,7.21,41.28,1,B. Paites,B. Paites,Eastern,Essex,Chelmsford,West Hanningfield,TL7000,Generated from computer mapping software,51.67304766,0.45714235,ESS-4B8242,,ESS4B8242LBAsword.jpg,"A fragment of a Late Bronze age sword, probably dating to the Ewart Park phase (1,000-800BC)e",Colchester and Ipswich Museum Service,Attribution License,https://finds.org.uk/images/bpaites/ESS4B8242LBAsword.jpg,https://finds.org.uk/images/thumbnails/564483.jpg
779405,Rapier,Bronze Age,Bronze Age,BRONZE AGE,-1500,-800,"A Middle/Late Bronze Age (1500-800 BC) copper alloy rapier blade fragment. The fragment is lozengiform in cross section with a prominent rib on either side. The breaks are old. The fragment measures 22.7mm in length, 22.05mm wide, 2.75mm thick and weighs 5.19 grams.



Other such fragments have been recorded on the database including WILT-524387",,4,Copper alloy,,Returned to finder,Metal detector,,,,,5.19,,,2.75,22.7,1,Richard Henry,Richard Henry,South West,Wiltshire,Wiltshire,Berwick Bassett,SU1173,From finder,51.45587485,-1.84307555,WILT-623C7B,,WILT623C7B.jpg,,Salisbury and South Wiltshire Museum,Attribution License,https://finds.org.uk/images/rhenry2/WILT623C7B.jpg,https://finds.org.uk/images/thumbnails/567097.jpg
779426,Ring,Bronze Age,Bronze Age,ROMAN,-1000,100,"A copper alloy possible horse harness ring of Bronze Age to Roman date (c. 1000 BC - AD 410). The ring measures 33.75mm in diameter (internal diameter 16.55mm), is 5.95mm thick and weighs 15.12g. It is circular in shape with a defined circumferential ridge running around the centre. The interior surface also features a defined circumferential ridge, creating a lozenge-shaped cross section. 



Similar rings have been discovered in a number of Bronze Age hoards and have been suggested as horse harness fittings, as being part of the handles of a sheet-metal cauldron of Class A1 (Type Tul-na-cross) and Class B1 (Types Llyn Fawr, Ballyshannon and Castlederg) (Gerloff 2010, Pl. 17, 7b; Pl.32, 14a; Pl. 33, 14f-h; Pl. 34, 15d, Pl. 54, 33c and Pl. 66, 37g)., or part of a chain from which a cauldron or other vessel was suspended over a fire. Similar rings have been recorded from the Hindon hoard",,4,Copper alloy,,Returned to finder,Metal detector,,,,,15.12,,33.75,,,1,Richard Henry,Richard Henry,South West,Wiltshire,Wiltshire,Berwick Bassett,SU1173,From finder,51.45587485,-1.84307555,WILT-62F48A,,WILT62F48A.jpg,,Salisbury and South Wiltshire Museum,Attribution License,https://finds.org.uk/images/rhenry2/WILT62F48A.jpg,https://finds.org.uk/images/thumbnails/567092.jpg
779451,Chisel,Bronze Age,Bronze Age,BRONZE AGE,-1600,-1400,"Fragment of Early Bronze Age/ Middle Bronze Age flanged chisel, broken central part only, both ends missing. Oval-sectioned on one side of the stop ridge, flanges on the other side and break across bubble/casting fault. Extant length 45mm. Width 15mm. Thickness 13mm. Weight 32.66g. This dates to the transitional period from the end of the Early Bronze Age and the beginning of the Middle Bronze Age, centering around 1600 - 1400 BC. Extant proportions similar to those on an example from Garveston (SMR-894E92).",,4,Copper alloy,,Returned to finder,Metal detector,2016-02-24T00:00:00Z,2016-03-29T23:00:00Z,,,32.66,,,13,45,1,Steven Ashley,Steven Ashley,,Norfolk,Breckland,Yaxham,TG0110,,52.65047129,0.96995502,NMS-63EC54,,53969_63EC54_MBA_FlangedChisel_ILL.jpg,Fragment of Early Bronze Age/Middle Bronze Age flanged chisel,Norfolk County Council,Attribution License,https://finds.org.uk/images/awilliamsnorfolk/53969_63EC54_MBA_FlangedChisel_ILL.jpg,https://finds.org.uk/images/thumbnails/1156066.jpg
779639,Knife,Bronze Age,Bronze Age,BRONZE AGE,-1600,1100,"A fragment of copper alloy tanged knife. The tang has a single rivet hole for the attachment of the missing handle and the edges have been worked to create a slight ridge.The knife has a symmetrical, shallow, pointed oval cross section giving two cutting edges.

Date: Middle Bronze Age c. 1600 - 1000 BC

Dimensions: 83.47 mm x 20.11 mm x 2.95 mm

Weight: 20.54 g",,4,Copper alloy,,Returned to finder,Metal detector,,,,,,,,2.95,83.47,1,Ciorstaidh Hayward Trevarthen,Ciorstaidh Hayward Trevarthen,South West,Dorset,Purbeck,Bere Regis,SY8296,Centred on field,50.76330752,-2.25658361,DOR-761B1C,,761B1C.jpg,Bronze Age knife,Somerset County Council,Attribution License,https://finds.org.uk/images/caht/761B1C.jpg,https://finds.org.uk/images/thumbnails/564871.jpg
780103,Spear,Bronze Age,Bronze Age,BRONZE AGE,-1600,-800,"A fragment of copper alloy spear or arrowhead. The tip only surviving. There is a central rib between two curving cutting edges. The typology and exact date of this object are uncertain.

Date:Probably Middle to Late Bronze Age - c. 1600 - 800 BC

Diameter: 24.1 mm x 11.4 mm x 7.1 mm

Weight: 4.11 g",,4,Copper alloy,,Returned to finder,Metal detector,,,,,4.11,,,7.1,24.1,1,Ciorstaidh Hayward Trevarthen,Ciorstaidh Hayward Trevarthen,South West,Dorset,Purbeck,Winfrith Newburgh,SY8085,From finder,50.66432336,-2.28434114,DOR-A09E8A,,A09E8A.jpg,Bronze Age spear tip,Somerset County Council,Attribution License,https://finds.org.uk/images/caht/A09E8A.jpg,https://finds.org.uk/images/thumbnails/565105.jpg
780298,Awl,Bronze Age,Bronze Age,IRON AGE,-1000,-100,"
A square-sectioned Bronze Age to Iron Age copper-alloy awl. Both ends are bent.
",,4,Copper alloy,,Returned to finder,Metal detector,,,,,3.51,,,3.63,57.48,1,Margaret Broomfield,Margaret Broomfield,South East,Hampshire,Winchester,Micheldever,SU5540,GPS (from the finder),51.15661878,-1.21493163,SUR-DD84FE,,16307.jpg,Bronze Age or Iron Age: Awl,Surrey County Council,Attribution License,https://finds.org.uk/images/dwilliams/16307.jpg,https://finds.org.uk/images/thumbnails/568422.jpg
780319,Spear,Bronze Age,Bronze Age,BRONZE AGE,-1500,-700,"
A small worn fragment of a Middle to Late Bronze Age copper-alloy spearhead.
",,4,Copper alloy,,Returned to finder,Metal detector,,,,,9.26,,,8.09,13.71,1,Margaret Broomfield,Margaret Broomfield,South West,Wiltshire,Wiltshire,Amesbury,SU1642,GPS (from the finder),51.17701467,-1.77249601,SUR-DE2186,,16318.jpg,Bronze Age: Spearhead,Surrey County Council,Attribution License,https://finds.org.uk/images/dwilliams/16318.jpg,https://finds.org.uk/images/thumbnails/568438.jpg
780686,Spear,Bronze Age,Bronze Age,BRONZE AGE,-900,-800,"An incomplete copper alloy Late Bronze Age spearhead (c.900-c.800 BC), missing a fragment from the rim of its socket. The spearhead has a flame-shaped blade with a stepped, bevelled edge cast into the blade. It has two cast peg holes through the centre of its socket which is conical. As the socket tapers, it forms the midrib.



The rim of the socket is broken; an old break, possibly caused by the 'ritual killing' of the spear (a common practice in the Bronze Age). The edge of the blade has suffered some erosion and there is a small dent in the midrib, but otherwise the spearhead is in perfect condition. It has a smooth, shiny, dark green patina. There is no evidence on the object to suggest that spear was used prior to deposition.



The shape of the spearhead fits into Richard Davis' Class 11a (2015) and dates to the period c.1100-c.800 BC. However, this type of spearhead arrived later in Nottinghamshire and is more likely to date to c.900-c.800 BC.",,3,Copper alloy,,Acquired by a museum - not a Treasure case,Metal detector,2015-12-01T00:00:00Z,2016-01-31T00:00:00Z,,,112.21,,,26.3,172,1,Alastair Willis,Alastair Willis,East Midlands,Nottinghamshire,Newark and Sherwood,Rufford,SK6362,Generated from computer mapping software,53.15142036,-1.05941975,DENO-F70BF6,,DENOF70BF6.jpg,Late Bronze Age Spearhead,Derby Museums Trust,Attribution License,https://finds.org.uk/images/awillis/DENOF70BF6.jpg,https://finds.org.uk/images/thumbnails/565017.jpg
780726,Spearhead,Bronze Age,Bronze Age,BRONZE AGE,-1200,-800,"The tip of the blade of a Bronze Age copper-alloy spearhead with a pronounced central ridge. Probably dating from the later Middle Bronze Age or the Late Bronze Age, that is c. 1200-800BC. The end of the socket appears at the break and is 7mm deep.",,4,Copper alloy,,Returned to finder,Metal detector,2016-01-01T00:00:00Z,,,,10.05,,,8.65,38.38,1,Margaret Broomfield,Margaret Broomfield,South East,West Berkshire,West Berkshire,Aldworth,SU5481,From a paper map,51.52534027,-1.22302357,SUR-F7C193,,16369.jpg,Bronze Age: Spear,Surrey County Council,Attribution License,https://finds.org.uk/images/margaretb/16369.jpg,https://finds.org.uk/images/thumbnails/568182.jpg
780755,Sword,Bronze Age,Bronze Age,BRONZE AGE,-1500,-1200,"A very worn blade fragment, 15mm long by 17mm wide, from a Middle Bronze Age copper-alloy sword, possibly a rapier.",,4,Copper alloy,,Returned to finder,Metal detector,2016-02-27T00:00:00Z,,,,3.58,,,3.98,14.75,1,Margaret Broomfield,Margaret Broomfield,South East,Oxfordshire,West Oxfordshire,Minster Lovell,SP3009,From a paper map,51.77886767,-1.56655767,SUR-F8335E,,16379.jpg,Bronze age: Sword,Surrey County Council,Attribution License,https://finds.org.uk/images/margaretb/16379.jpg,https://finds.org.uk/images/thumbnails/568188.jpg
781106,Socketed Axehead,Bronze Age,Bronze Age,BRONZE AGE,-1000,-800,"A fragment of a Late Bronze Age socketed axehead, dating 1,000-800BC. The blade end is all that remains and is damaged along the edge. A trace of the hollow nature of the object is visible at the break. The metal is a dark brown colour with patches of mid-green patina developing in places. 



Dimensions: length: 29.50 mm; width: 29.61 mm; thickness: 10.19 mm; weight: 16.07g.",,4,Copper alloy,,Returned to finder,Metal detector,,,,,16.07,,,10.19,29.5,1,B. Paites,B. Paites,Eastern,Essex,Chelmsford,Sandon,TL7603,From finder,51.69814845,0.54533525,ESS-1E9061,,ESS1E9061socketedaxe.jpg,"A fragment of a Late Bronze Age socketed axehead, dating 1,000-800BC.",Colchester and Ipswich Museum Service,Attribution License,https://finds.org.uk/images/bpaites/ESS1E9061socketedaxe.jpg,https://finds.org.uk/images/thumbnails/564970.jpg
781349,Socketed Axehead,Bronze Age,Bronze Age,BRONZE AGE,-1000,-800,"A fragment from a Bronze Age socketed axehead dating to c.1000-800 BC. The fragment comprises a section of the rim of the axe, 16.98mm at its widest, 4.22mm at its narrowest. The rim is flat and narrows towards the body of the axe, starting with a maximum thickness of 5.13mm, tapering down to 1.76mm. The fragment is comprised of two ridges, one is much larger than the other. The patina is a dark green throughout.",,4,,,Returned to finder,Metal detector,,,,,5.36,,,5.13,21.04,1,Fiona Johnstone,Fiona Johnstone,South West,Wiltshire,Wiltshire,Pewsey,SU1757,,51.31186269,-1.75748337,WILT-3398C4,,WILT3398C4.jpg,,Salisbury and South Wiltshire Museum,Attribution License,https://finds.org.uk/images/rhenry2/WILT3398C4.jpg,https://finds.org.uk/images/thumbnails/569085.jpg
781882,Axehead,Bronze Age,Bronze Age,BRONZE AGE,-1000,-750,"Fragment of a cast bronze (copper alloy) socketed axe of Late Bronze Age date (1000 - 750 BC). The fragment comprises part of the blad and part of the socket is visible. The length is 26mm, the width is 14mm thickness 8mm and the weight 5.57g.",,4,Copper alloy,,Returned to finder,Metal detector,2016-01-12T00:00:00Z,2016-01-12T00:00:00Z,,,5.57,,,8,26,1,Stuart Noon,Stuart Noon,Yorkshire and the Humber,East Riding of Yorkshire,East Riding of Yorkshire,Driffield,SE9957,From finder,53.99955279,-0.49118889,LANCUM-8BB5A7,,LANCUM8BB5A7.jpg,,The Portable Antiquities Scheme,Attribution License,https://finds.org.uk/images/snoon/LANCUM8BB5A7.jpg,https://finds.org.uk/images/thumbnails/565364.jpg
781971,Spear,Bronze Age,Bronze Age,BRONZE AGE,-1000,-800,"An incomplete cast copper alloy socketed spearhead (1150 - 800BC). This object is in two pieces, found at different times. The spearhead has a leaf-shaped blade remaing on one side and a pronounced hollow mid-rib extending to the broken tip. The remaining edges of the blade are bevelled. The socket is circular. The mouth of the socket is damaged at one side.  There are remnant s of side loops on both sides of the lower part of the socketed end. There is a large irregular hole on side of the lower part of the socketed end.



Date: Late Bronze Age - 1000 BC - 800 BC

Dimensions: 139.68 mmx x 22.04 mm x 25.35 mm. Thickness of wall - 2.29 mm
Weight: 85.67 g



A silmilar spear is recorded in database record DOR-FD69C8.



There is a difference in the surface colour and condition between the two pieces resulting from surface treatment of the lower section by the finder.",,4,Copper alloy,,Returned to finder,Metal detector,,,,,85.67,,,25.35,139.68,1,Ciorstaidh Hayward Trevarthen,Ciorstaidh Hayward Trevarthen,South West,Dorset,West Dorset,Portesham,SY6386,From finder,50.67248022,-2.52496504,DOR-9A6EE6,,9A6EE6.jpg,Bronze Age spear,Somerset County Council,Attribution License,https://finds.org.uk/images/caht/9A6EE6.jpg,https://finds.org.uk/images/thumbnails/566145.jpg
782914,Flat Axehead,Bronze Age,Bronze Age,BRONZE AGE,-2000,-1700,"A complete cast copper alloy flanged (developed) flat axe of later Early Bronze Age date. The axehead is broadly sub rectangular in plan with a splayed crescentic blade which tapers to a thin edge. Along the length of the axe are raised flanges and between them and nearly central is a very faint stop ridge. The flanges are bevelled both above and below the main body of the axe and may have been hammered. The butt end is narrowed and rounded and also tapers to a thin edge. Copper alloy corrosion is more prevalent on one side of the axe with the opposing surface having almost none; this would be as a result of the depositional environment.



The axe appears to be from the Arreton phase of metalworking (stage V), which corresponds to Needham's (1996) Period 3 circa 2000 - 1700 BC.",,3,Copper alloy,,Returned to finder,Metal detector,2015-05-09T23:00:00Z,,,,183,,,14.9,99.2,1,Anni Byard,Anni Byard,South East,West Berkshire,West Berkshire,Lambourn,SU3482,From a paper map,51.53588568,-1.51119771,BERK-0A0DD7,,2015790.jpg,Bronze Age axehead: Developed flat axe,Oxfordshire County Council,Attribution License,https://finds.org.uk/images/abyard/2015790.jpg,https://finds.org.uk/images/thumbnails/566375.jpg
783810,Flat Axehead,Bronze Age,Bronze Age,BRONZE AGE,-2000,-1500,"An incomplete cast copper alloy (bronze) flat axe of Early Bronze Age period, dating from c. 2000-1500 BC.



The flat axe is broadly triangular in plan with a splayed crescent shaped blade. In profile it is broadly lentoid, with slight tapering edges. In cross section the axe is a stunted H shape. The butt is relatively thin and appears to have a rounded top, however this has been heavily damaged; the width at the butt is 14.8 mm (thickness: 4.46 mm). The sides of the axe gently expand in width from the butt to above the blade where the sides splay to form the blade. However, the axe is thickest at the mid point (11.03 mm). The sides of the axe have a raised ridge on the outside edge of the obverse and the reverse, with a concave dip (or septum) in the centre. There also appears to be a stop ridge or proto-stop ridge at the mid point of the axe. The sides of the blade expand to produce a crescentic blade edge with an abraded width of 39.7 mm. The tips of the crescent shaped blade have been damaged through either abrasion or wear, as has the blade edge itself. A distinct blade facet is not present. There is no evidence of any form of incised or cast decoration present on any surface of the axe. Casting 'flaws' or air bubbles are present over most of the surface of the flat axehead. The axe is a mid to dark brown in colour colour, with lighter brown colours on the surface, with an uneven surface patina. Abrasion, caused by movement whilst within the ploughsoil, has resulted in a loss of some of the original surface detail.



The axe measures 89.51 mm in length, maximum width at the blade is 39.7 mm, width at the butt is 14.8 mm and it has a maximum thickness of 11.03 mm (Thickness of blade: 4.5 mm, thickness of butt: 4.46 mm). It weighs 86.7 grams.



The axehead is best described as coming from the later phases of the Early Bronze Age and is comparable to Aylesford Type (Schmidt & Burgess, 1981, 60 - 61). These are the earliest of the 'developed' flat axes, and have been found along side Migdale type axes, which would suggest a similar date. These axes fit within metalworking stage IV, which corresponds to Needham's (1996) Period 3 circa 2000 - 1700 CAL. BC. This axe is very similar to those identified as Type Aylesford (Burgess and Schmidt: plate 26B, no 310a).



Reference:



Needham, S. (1996) Chronology and Periodisation in the British Bronze Age. Acta Archaeologia, vol 67, pp121-140



Schmidt, P.K. & Burgess, C.B. 1981. The Axes of Scotland and Northern England. Prahistorische Bronzefunde. Abteilung IX. Band 7. C.H. Beck'Sche Verlagsbuchhandlung, Munchen. p.60-61 (also Plate 26B no 310a).",,3,Copper alloy,,Returned to finder,Metal detector,2015-08-31T23:00:00Z,2015-09-29T23:00:00Z,,,86.7,,,11.03,89.51,1,Helen Glenn,Helen Glenn,West Midlands,Staffordshire,East Staffordshire,Barton-under-Needwood,SK1918,Generated from computer mapping software,52.75927618,-1.71989519,WMID-5DEA89,,WMID5DEA89.jpg,"Early Bronze Age: Flat Axehead (Type Aylesford, Early developed axehead)",Birmingham Museums Trust,Attribution License,https://finds.org.uk/images/hglenn/WMID5DEA89.jpg,https://finds.org.uk/images/thumbnails/566711.jpg
